713250,穩懋凱基02購03
715182,波若威兆豐04購01
716074,力旺元大05購05
716641,鴻碩凱基06購03
712078,緯軟國票01購02
713111,宜特元大01購03
713525,欣銓群益03購01
5356,協益
8415,大國鋼
712462,昇佳電國泰02購01
713498,威剛永豐02購01
713646,聚積凱基03購01
716447,群聯元大06購02
713556,雙鴻國票03購02
73570P,萬潤凱基04售01
73756P,中美晶永豐06售03
713306,建榮永豐01購01
716240,迅得凱基06購01
4995,晶達
711673,信驊統一02購01
714962,均豪元大04購01
711748,欣銓群益01購01
712818,大宇資群益02購01
714364,網家凱基03購01
716217,雙鴻富邦06購03
73358P,群聯元富07售02
711553,精測群益01購01
713379,中美晶兆豐03購02
714291,譜瑞凱基04購01
712429,金居永豐01購01
712624,旺矽永豐01購02
5209,新鼎
6530,創威
710786,神盾中信9C購01
713157,均豪群益03購01
713591,原相麥證02購01
713385,環球晶元大01購09
713403,新潤國票03購01
715886,金居永豐05購02
716744,聯亞凱基06購01
714824,群聯元大04購05
715022,碩禾永豐04購02
3081,聯亞
3426,台興
715862,穩懋富邦07購02
73214P,鈊象國票9C售01
4721,美琪瑪
714290,碩禾凱基05購02
715041,雍智群益04購01
00848B,中信新興亞洲債
711854,信驊凱基01購01
715801,大中群益05購01
712520,力旺元大01購01
716492,鈊象元富0C購01
715654,璟德群益05購01
712238,聯亞統一9C購04
713301,環球晶元大01購05
714884,新普凱基04購01
715384,鈺太凱基05購01
715476,穩懋元大05購04
711255,大學光國泰9C購01
711330,元太凱基9C購01
00862B,中信投資級公司債
716965,波若威凱基06購02
73554P,網家國票03售01
712803,威剛元大01購02
715085,環球晶元富06購02
716049,元太元富06購01
73342P,鈊象元富07售03
73382P,群聯群益04售01
712019,神盾統一01購01
712744,頎邦兆豐01購01
73563P,創惟國票03售01
711827,太醫元大01購01
715316,精測富邦06購01
715761,鈊象群益05購03
716500,合晶凱基06購02
73446P,穩懋兆豐03售05
712089,碩禾永豐9C購01
712116,是方元大9C購02
712720,加高凱基01購01
73760P,精材元大06售05
3325,旭品
711815,精測國泰01購01
714055,昇佳電元富08購03
6629,泰金-KY
713860,廣明元大02購01
714293,磐亞國票04購01
715515,萬潤凱基05購01
8446,華研
713454,合晶元大02購01
714132,泰博群益04購01
5315,光聯
73671P,力旺永豐05售01
715415,弘塑凱基05購01
715519,曜越統一07購01
5464,霖宏
5289,宜鼎
715577,合一元富05購01
3709,鑫聯大投控
6020,大展證
713142,昇佳電元大01購08
714870,倉和國票05購01
716431,網家凱基06購01
716586,信驊凱基06購01
712245,鈺太元大9C購03
73742P,精材群益09售02
713746,群聯元大02購01
715278,東洋元大04購03
715351,旺矽群益05購01
716070,倉和永豐05購01
712832,鈺太群益01購03
712903,譜瑞永豐01購01
712979,精材統一03購02
73415P,譜瑞元大01售09
714907,廣運群益04購02
712111,鈺太凱基01購01
713187,弘塑永豐01購02
711313,穩懋凱基9C購02
715151,穩懋凱基04購04
715451,合晶國票06購01
715726,信驊兆豐06購02
714763,康全電群益04購02
5475,德宏
6411,晶焱
713914,桂盟元大02購02
712882,宏捷科元大01購05
716298,金居統一07購01
713397,創惟群益03購04
714992,雙鴻麥證04購01
715976,創惟富邦06購01
714586,海韻電元大03購03
714558,群聯群益03購03
716353,雍智元大08購04
712855,碩禾國票02購02
713977,宣德統一04購05
6425,易發
715468,台燿凱基06購01
8349A,恒耀甲特
715025,東洋國票05購01
715037,倉和國泰06購01
716236,鈺太元大05購02
712099,神盾統一02購01
713221,宣德凱基01購03
715277,東洋元大04購02
716418,新普群益08購01
73609P,穩懋國票05售03
711974,宇峻群益01購01
73442P,雙鴻凱基02售05
713020,穩懋元大02購01
716732,優群兆豐06購01
715828,精測兆豐05購02
716235,精材元大05購17
716314,台半元大06購02
716585,合晶凱基06購03
714183,信驊永豐03購01
716041,鈊象富邦06購02
716180,台半凱基06購01
716577,茂達國票07購01
73735P,東碩群益06售02
5205,中茂
73297P,環球晶群益01售04
4535,至興
6223,旺矽
714912,群聯元富08購04
716469,僑威群益07購01
715323,千附永豐04購02
715262,旺矽國票05購01
714631,晟德凱基04購01
6469,大樹
712288,大學光國票01購02
715569,宏捷科國票07購01
716939,直得元富09購01
00760B,FH新興企業債
712465,海韻電富邦02購01
713511,雙鴻群益04購02
713152,精測凱基01購08
715531,精材元大05購01
73574P,穩懋元富07售03
4534,慶騰
712053,台燿國票01購01
716379,中美晶元富06購03
712231,宏捷科統一02購01
716257,皇田永豐05購01
712455,金居元富01購01
2740,天蔥
5014,建錩
711984,東洋元大01購01
5386,青雲
715273,精材永豐04購01
713047,宜特凱基01購01
714238,皇田統一04購01
715426,均豪永豐05購01
716897,家登凱基06購01
713994,聯亞群益03購01
712373,譜瑞統一03購02
712666,耕興康和01購01
00842B,台新美元銀行債
714242,中美晶凱基05購01
711426,環球晶群益9C購02
711867,穩懋中信06購02
714696,鈺太元大04購01
715921,建榮永豐05購02
716646,群聯元富0C購01
73347P,力旺永豐01售01
712702,群聯元大01購03
4523,永彰
73579P,日揚國票04售01
3287,廣寰科
713709,穩懋日盛02購01
714483,聯亞凱基03購02
715461,昇佳電中信08購01
715847,濱川凱基06購01
716969,威剛凱基06購02
73332P,大學光國票02售02
713297,統新元大01購01
713332,世界群益03購01
716006,力旺康和05購01
716342,新普凱基06購01
73351P,穩懋凱基01售02
711696,中美晶國票01購01
713895,是方永豐02購01
716083,聚和元大05購01
716452,大學光永豐06購02
73400P,新普凱基01售02
712627,閎康康和01購01
716503,原相凱基07購01
714041,桂盟群益03購01
714130,鈊象元大03購07
715234,旺矽凱基04購01
73768P,穩懋凱基06售02
713783,元太國票03購01
3114,好德
714222,力致元大03購06
715846,緯軟凱基05購01
711491,大學光兆豐9C購01
713826,宣德元大02購06
714048,宣德元大03購04
714946,聚和永豐04購01
715341,網家永豐05購01
713369,鈺太兆豐01購03
00787B,元大10年IG醫療債
3489,森寶
6291,沛亨
715891,藏壽司永豐05購01
6535,順藥
713453,世界元大02購02
714947,穩懋永豐04購01
716036,精材統一07購04
712801,宏捷科元大01購04
713381,威剛元大01購03
714399,兆利永豐03購01
716803,信昌電國票07購03
73329P,信驊元大01售03
712158,大江群益01購03
5426,振發
716892,譜瑞國票07購02
712530,博智元大02購01
713595,佳邦元大02購01
714143,泰博永豐03購03
73726P,雍智群益06售01
715346,松瑞藥凱基05購01
716128,環球晶元富05購01
716476,原相國票09購01
713000,健喬永豐01購01
714770,由田永豐04購01
715455,鈺太國票06購01
73630P,旺矽元富05售01
713220,昇佳電凱基02購03
713337,凡甲國票03購02
715877,穩懋元大05購10
716118,威剛元大05購01
6516,勤崴國際
716299,優群統一06購01
713871,碩禾元富08購04
714539,雙美永豐03購02
714913,廣錠元富0A購01
713125,世界元富04購01
716537,中美晶凱基0A購01
73508P,泰博永豐03售01
3236,千如
6461,益得
713208,良維群益01購01
714232,緯軟國票04購01
714489,海韻電統一05購01
716363,環球晶凱基06購05
00718B,富邦中國政策債
714991,網家麥證04購01
714314,精材群益03購02
00720B,元大投資級公司債
6199,天品
714433,原相凱基04購01
714841,健亞永豐04購01
713520,昇佳電凱基03購01
714266,環球晶兆豐04購01
3118,進階
713907,耕興康和02購01
715020,系微永豐04購01
716665,新鉅科凱基06購02
73702P,萬潤國票07售02
712404,茂達凱基01購01
713363,神盾元大01購02
00789B,FH公司債A3
711945,金居凱基01購01
712620,力致永豐01購02
716120,群聯元大05購07
73497P,桂盟國票04售01
73727P,中美晶凱基06售08
714028,僑威凱基03購02
73308P,倉和群益9C售03
712708,穩懋元大01購06
713587,宣德統一04購01
713294,世界元大01購03
713638,宣德元大02購02
714650,聯亞元大03購04
715231,旺矽元大05購01
716439,大學光元大07購01
73714P,環球晶群益06售04
6173,信昌電
712656,日揚凱基01購01
712946,精材元大01購05
6432,今展科
715575,中美晶元富09購02
716335,精材元富06購01
713345,健喬凱基01購01
715269,雙鴻國票07購01
713192,大學光凱基02購02
714259,台半元大03購03
716471,譜瑞群益06購01
716568,世界群益07購01
711828,原相元大02購01
712218,倉和群益9C購01
716804,泰博國票07購01
2064,晉椿
711754,環球晶群益01購01
711866,穩懋中信06購01
716260,創惟永豐05購02
711600,M31富邦01購01
712187,鈊象元大01購04
8358,金居
716820,元太群益07購01
8111,立碁
712171,精華永豐9C購02
713813,碩禾凱基02購02
713852,信驊元富08購01
714153,凡甲統一04購01
716286,立端凱基06購01
8929,富堡
711804,六角統一01購01
713183,穩懋統一03購02
715856,均豪國票06購03
9950,萬國通
713222,神盾凱基02購02
715601,中美晶凱基06購02
711184,穩懋國泰9C購01
716968,信驊凱基09購01
715758,鴻碩群益05購02
712054,宜鼎國票01購01
715290,廣運統一07購02
714859,廣錠統一06購02
73423P,金居凱基02售02
4804,大略-KY
6170,統振
713752,緯軟永豐02購01
714792,精測凱基04購01
712284,昇達科群益9C購01
713435,精材元大03購02
00847B,中信美國市政債
716046,萬潤國票07購01
73604P,廣錠統一04售01
714454,M31元大03購02
715342,熱映永豐05購01
714601,晟德國泰04購01
714839,世界永豐04購01
73256P,凡甲國票01售01
713729,統新群益02購02
716061,雍智永豐05購02
715700,精測富邦05購02
716109,創惟凱基05購02
716606,欣銓元大06購02
712144,鈊象凱基9C購06
715130,長科*元大04購01
8941,關中
716691,廣積永豐06購01
3675,德微
713372,信驊元富07購03
716028,信昌電凱基05購02
714258,中菲行元大03購03
714507,金居群益03購02
712156,鈺太國泰01購01
712267,鈊象國票01購04
712239,久元元大01購02
712970,昇佳電凱基02購01
73698P,環球晶群益05售03
8916A,光隆甲特
712852,前鼎國票02購01
714633,萬潤國泰05購01
5371,中光電
714637,環球晶群益03購04
73511P,倉和國票04售01
715197,宣德元大04購01
716609,大江兆豐06購01
6182,合晶
712550,桂盟永豐01購01
715398,迅得群益05購01
73421P,倉和國票03售01
712190,東洋統一02購01
713687,環球晶國票03購01
713102,金居國票02購02
715173,廣運元大05購01
716277,胡連元大06購01
712542,迅得永豐01購01
712819,中美晶群益01購03
714575,均豪群益03購02
712177,倉和元大02購01
714270,合晶凱基03購01
714869,雙鴻群益04購07
713355,昇佳電元大01購09
714361,波若威凱基05購01
715530,群聯元大06購01
3556,禾瑞亞
714296,威剛元富07購01
714665,元太統一03購02
716037,鈊象統一06購01
712858,鈊象國票02購02
713230,新鉅科國票02購02
715506,穩懋元大05購06
4533,協易機
8908,欣雄
713368,穩懋兆豐03購02
714131,宏捷科群益05購02
713903,穩懋元大02購09
715429,原相永豐05購01
712602,信驊元富07購01
713378,神盾永豐01購05
714230,譜瑞元大03購01
716600,世界元大06購05
73696P,譜瑞中信09售01
711343,雍智國泰01購01
712856,聯亞國票02購01
715622,旺矽國票08購01
713564,鈊象群益02購04
6125,廣運
715199,精測元大06購01
715689,精測凱基05購01
713138,波若威永豐01購03
713820,原相統一02購04
00790B,FH次順位IG金融債
713042,雙鴻統一03購01
716078,閎康元大05購01
5490,同亨
712871,原相群益01購05
714948,東洋統一05購02
73569P,中美晶兆豐04售01
73766P,力旺元富06售03
714401,聚和永豐03購01
716782,博智元大06購02
714957,頎邦國票05購01
73596P,宣德凱基04售03
5457,宣德
714979,兆利永豐04購01
716064,群聯富邦06購02
712182,環球晶元大9C購13
713506,雙鴻康和02購01
714432,宏捷科凱基05購01
714537,創惟永豐03購01
73658P,鴻碩凱基06售02
711369,聯亞凱基01購01
711734,雙鴻國泰02購01
715621,富喬康和05購01
714593,倉和國票04購04
715603,信驊凱基05購02
715901,金居統一06購01
713413,M31元大01購09
714329,精測麥證03購02
73572P,宏捷科康和05售01
00784B,富邦中國投等債
712552,高技永豐01購01
716964,旺矽凱基06購06
714211,台燿統一03購01
715181,穩懋統一06購04
711693,穩懋凱基02購01
714769,加百裕永豐04購01
714791,群聯凱基04購01
712179,倉和元大9C購02
712193,倉和統一02購01
715779,鈺太凱基05購04
6538,倉和
712734,精測凱基02購03
713938,鈊象統一04購01
715047,雍智元大04購02
716601,弘塑元大06購01
714810,磐亞群益04購01
716761,原相統一08購01
6244,茂迪
712201,邦特國票01購02
713290,統新群益01購01
715212,華星光群益04購01
6279,胡連
716950,中菲行兆豐07購01
714360,中美晶凱基03購03
715637,精材元富05購02
6175,立敦
713241,創惟統一03購01
716936,中美晶元富06購06
6242,立康
714920,世界兆豐05購01
716086,環球晶元大05購06
716764,弘塑國票07購03
4931,新盛力
712087,網家國泰01購02
713050,大學光永豐01購03
714392,兆利元大03購01
715520,曜越統一07購02
716818,精材永豐06購03
00745B,富邦中政債0-1
6486,互動
712457,聚積元富04購01
713185,神盾麥證01購01
716440,中美晶元大06購04
712930,鈺太康和01購01
715939,鈊象國票06購01
5820,日盛金
6134,萬旭
713531,世界元大02購04
714109,力致國票04購03
715806,群聯元大05購05
73546P,鈺太國票03售01
712393,茂達國票02購01
713198,環球晶凱基01購04
715424,雍智國票06購01
6588,東典光電
714953,精材國票05購01
712947,精材元大01購06
713210,系微元大02購02
73686P,精材元大05售13
712283,大學光群益01購01
714212,威剛統一03購02
713169,弘塑元大01購03
8437,大地-KY
714638,日揚永豐03購01
2745,五福
713209,中美晶元大01購03
714002,創惟元大03購01
715237,雍智凱基04購01
6482,弘煜科
73681P,精材永豐05售05
714451,晶焱兆豐04購01
714536,雙美永豐03購01
716355,中美晶富邦08購01
716380,環球晶元富06購03
711682,合晶國泰02購01
711936,中美晶統一02購03
712506,穩懋統一01購07
712775,璟德群益01購01
715159,原相統一06購01
716930,信驊群益07購01
712285,博智群益9C購02
714635,精測富邦05購01
711196,世界統一9C購01
712383,鈊象元大01購05
4205,中華食
712857,穩懋國票02購01
00748B,凱基中國債3-10
712449,博智國票02購01
712939,精材國泰03購01
714321,環球晶統一04購01
715013,廣錠統一07購02
713217,大江凱基01購01
4128,中天
713146,穩懋元大01購10
713154,譜瑞凱基03購01
715226,台半元大04購01
73466P,威剛元富08售02
712723,合晶凱基01購02
712927,原相兆豐03購02
715804,旺矽元大07購01
4503,金雨
713913,大江元大02購03
715464,信昌電永豐05購01
712715,網家群益01購01
73556P,信驊群益03售03
711685,精測群益01購02
712461,鈊象元富07購02
713543,新鉅科凱基03購01
715878,迅得國泰06購01
713831,新鉅科凱基02購02
714592,鈊象元大03購11
715308,廣運元大04購04
715386,昇佳電國票06購01
716726,力旺永豐06購02
711874,金居群益02購01
712313,邦特元大9C購04
715075,大中凱基04購01
711732,博智國泰02購01
1264,德麥
2066,世德
712176,倉和元大01購02
715865,均豪永豐05購02
8042,金山電
715010,群聯凱基04購02
3374,精材
714863,樺晟國泰06購01
716854,松瑞藥元大06購01
714465,中美晶元大04購01
714540,宣德兆豐04購01
3570,大塚
4502,健信
73716P,環球晶凱基09售03
3555,重鵬
716945,信驊國票07購01
712968,穩懋元富07購01
711669,碩禾元富03購01
712014,元太統一02購01
716944,系微國票07購01
3178,公準
713512,譜瑞群益02購01
713514,雙鴻統一03購03
73598P,信驊元富07售04
4154,康樂-KY
716489,閎康元富0C購01
716961,弘塑凱基06購03
714963,宜特元大04購01
73449P,信驊凱基02售04
711631,譜瑞統一02購02
715335,旺矽元大05購03
713100,世界國票02購01
73764P,力旺統一07售01
716692,璟德永豐06購01
00834B,第一金金融債10+
3611,鼎翰
713313,統新凱基01購01
714806,雙美元大04購01
712508,中菲行康和01購01
715057,群聯國票05購01
713891,雙鴻國票03購03
73293P,譜瑞國票01售02
715906,宏捷科國票07購03
713666,原相元大03購05
714394,僑威元大03購08
713190,萬潤永豐01購01
713504,譜瑞元富03購01
715271,泰博第一04購01
5306,桂盟
711431,宏捷科元大9C購03
712489,神盾凱基01購01
73485P,鈊象元富08售07
713344,世界凱基03購01
714340,僑威元大03購06
714745,元太凱基04購01
716329,元太群益06購01
716532,合晶國票08購01
716556,元太元大06購01
712990,展旺國票02購01
714167,神盾國票04購01
712068,旺矽凱基02購01
715996,藏壽司永豐05購02
716043,M31國票07購01
00843B,台新中國政策債
4420,光明
5493,三聯
712295,M31永豐9C購01
715094,環球晶元大04購03
712555,聚和永豐01購01
715123,大江國泰06購02
6118,建達
711701,元太統一03購01
712328,力旺元富03購01
713621,僑威凱基02購01
716373,力旺兆豐07購01
73672P,力旺國票05售01
712142,大江凱基9C購04
712416,精測群益01購06
73321P,鈊象國票01售05
73547P,創惟元大03售02
712868,迅得群益01購03
715288,宣德統一05購05
3227,原相
711799,台燿凱基01購01
715320,寶雅國票05購01
713673,日揚凱基02購01
714409,優群凱基04購01
5465,富驊
712432,博智永豐01購01
713081,璟德凱基01購04
715310,環球晶元大05購03
715393,鴻碩永豐05購01
713308,統新永豐01購01
714491,譜瑞元富05購01
714202,倉和元富09購01
715292,長科*凱基04購02
713327,穩懋統一03購03
714194,佳邦元大03購01
712279,鈊象群益01購03
713718,凡甲凱基03購01
715435,鈊象元大05購04
716326,優群國泰08購01
714333,精測元富09購01
714849,環球晶兆豐04購02
73668P,力旺元大05售01
714529,茂達永豐03購01
715636,原相元富05購01
715068,群聯統一05購01
716115,合晶元大05購05
716957,晶焱統一07購01
712478,中菲凱基01購01
712785,環球晶凱基01購03
713177,鈊象群益01購09
715746,六角康和05購01
73234P,鈊象國票9C售02
711234,宏捷科凱基9C購04
712499,波若威國票02購02
714858,廣錠統一06購01
716780,鴻碩元大06購02
716647,群聯元富0C購02
5276,達輝-KY
6654,天正國際
713291,環球晶群益01購07
714149,泰博凱基04購02
3628,盈正
73237P,穩懋國泰9C售02
714011,廣明統一04購01
716625,鈊象永豐06購01
714860,廣錠統一07購01
6130,星寶國際
713159,櫃200群益01購01
714147,泰博凱基03購02
716328,中美晶群益07購01
712280,弘塑兆豐01購02
714999,創惟國票05購01
716658,合晶凱基06購05
8049,晶采
713439,原相元富07購02
715049,雍智元大05購01
713598,新普元大02購01
714111,萬潤國票04購01
716201,大中國票06購01
3067,全域
712768,系微群益01購01
713035,豪展國票02購01
711207,群聯兆豐9C購01
713858,是方元大02購01
713457,原相元大03購04
2926,誠品生活
716169,原相元大05購06
712918,原相統一03購01
73392P,智擎國票03售01
73484P,僑威群益03售02
711501,雙鴻富邦9C購01
4543,萬在
714504,穩懋富邦06購01
715427,信驊永豐05購01
716734,久元元大06購01
713104,宜特康和01購02
716592,合晶統一09購01
73543P,欣銓國票03售02
711963,緯軟國票01購01
3609,東林
5489,彩富
715143,佳邦群益04購02
716072,環球晶永豐05購01
73623P,東洋群益04售03
714801,鈊象永豐04購01
712948,精材元大02購01
714576,創惟群益03購06
712541,豆府永豐01購01
713077,大學光凱基01購03
712220,網家群益9C購04
715453,神盾國票06購01
6233,旺玖
712711,群聯國泰03購02
716953,元太統一08購01
715101,鈺太凱基06購03
711778,信驊元大01購01
715294,寶雅凱基04購01
715400,聯亞群益05購01
710961,環球晶統一01購01
715841,均豪凱基06購01
716587,倉和凱基08購02
716651,中美晶群益07購02
01112S,081中租賃B
715081,環球晶凱基04購02
716405,大宇資永豐06購01
3152,璟德
8084,巨虹
713791,聯亞兆豐04購01
715946,群聯元富05購02
713348,譜瑞凱基01購05
714524,千附永豐03購01
715317,廣運富邦06購01
716900,群聯凱基06購03
711544,精測兆豐9C購01
712155,倉和國泰01購01
716943,合一國票07購03
5543,桓鼎-KY
715763,雙鴻國泰07購01
716468,萬潤群益08購01
716611,信驊兆豐07購01
712571,威剛凱基01購02
73365P,精材元大01售02
73386P,M31國票03售01
713452,環球晶群益03購02
712623,宜特永豐01購01
713028,碩禾群益01購02
5227,立凱-KY
715702,六角群益05購01
715916,濱川元大05購01
714662,閎康兆豐03購01
714798,威剛永豐04購01
712077,博智國票01購01
716258,胡連永豐05購02
713441,環球晶元富03購06
716571,聯亞富邦08購01
716009,神盾元富07購01
716186,穩懋凱基05購05
712896,神盾永豐01購04
716628,創惟國票07購01
713226,穩懋統一02購04
713117,晶焱元大01購01
716536,中美晶凱基09購01
715635,頎邦富邦06購01
73378P,群聯元富07售04
8472,夠麻吉
712013,力旺統一01購02
714648,穩懋統一03購07
716026,中美晶凱基06購05
716482,大學光元富08購01
716696,信驊元富0C購02
715629,原相永豐05購02
713284,晶焱元富04購01
713879,良維元大02購02
714134,統新群益04購01
716413,威剛兆豐07購01
716637,晶焱凱基06購01
711605,譜瑞凱基02購01
714408,豪展凱基04購01
713566,環球晶兆豐03購02
714040,原相群益03購05
5523,豐謙
713655,雙鴻國泰04購01
713216,力旺凱基01購03
713583,良維凱基02購01
713912,熱映國泰04購01
714882,波若威凱基07購01
716199,精材兆豐06購02
715481,鈺太兆豐05購01
715591,中美晶元大05購02
715995,廣運永豐05購02
73457P,宏捷科元大02售04
712469,迅得群益01購01
715293,熱映凱基04購01
6609,瀧澤科
6616,特昇-KY
4126,太醫
715209,優群永豐04購01
716737,旺矽元大06購06
714158,精測麥證03購01
714983,創惟永豐04購01
712434,鈺太永豐01購01
714139,台半永豐03購01
715725,中美晶兆豐06購01
6171,亞銳士
711991,穩懋元大01購02
73205P,大學光國票9C售02
715399,欣銓群益05購01
714208,倉和凱基03購02
4736,泰博
5340,建榮
709609,穩懋元富02購01
73448P,穩懋國泰02售01
73715P,環球晶凱基06售06
5468,凱鈺
714206,M31凱基03購01
713660,力致永豐02購01
713631,大宇資永豐02購01
714757,大江群益04購01
714793,聚和凱基04購01
715585,旺矽兆豐05購02
715668,原相國票07購01
713485,宜鼎國票03購01
715454,豪展國票06購01
716817,譜瑞麥證06購01
713134,環球晶中信03購02
716667,精測凱基07購01
3483,力致
710914,原相元大01購01
713097,昇佳電群益01購06
714758,由田群益04購01
716826,旺矽元大08購01
5487,通泰
713083,雙美凱基01購01
713915,僑威元大02購01
712573,原相凱基01購04
714960,鈊象麥證04購01
715803,中美晶元大05購05
711769,合晶統一01購01
00780B,國泰A級金融債
715936,金居康和05購01
715229,系微元大04購01
73538P,雙鴻國票04售04
713269,大學光元大01購08
714255,緯軟凱基03購02
712991,桂盟國票02購01
716478,群聯國票07購01
73656P,萬潤元大05售01
714425,群聯兆豐04購01
715469,倉和凱基05購02
73709P,力旺元大06售01
714550,鈊象元大03購09
715188,大江永豐04購02
8931,大汽電
712650,日揚永豐01購02
713857,弘塑元大02購05
715586,威剛兆豐06購01
3211,順達
6150,撼訊
714689,光頡永豐04購01
714935,穩懋富邦07購01
716024,精材群益05購05
713544,雙鴻凱基02購04
73548P,穩懋國泰05售01
714510,頎邦群益03購04
715220,迅得國票05購01
1777,生泰
3083,網龍
711887,太醫國票01購01
714091,原相群益03購06
714349,原相元富09購01
714625,弘塑凱基03購06
715287,昇佳電統一05購03
715608,譜瑞凱基05購02
73411P,世界凱基01售03
73765P,力旺國票07售02
712746,M31元大01購04
714410,中菲行國泰05購01
73567P,碩禾元富09售01
712480,豆府凱基01購02
716672,信昌電國票07購02
713053,元太群益01購02
714393,僑威元大03購07
716699,台半兆豐06購01
716893,驊訊國票06購01
00740B,富邦全球投等債
711517,譜瑞統一02購01
3064,泰偉
713164,弘塑國票02購02
714736,力致凱基06購01
712536,中菲行永豐01購01
716723,原相群益06購01
716742,加百裕凱基06購01
715580,合一元富09購01
713701,精測元大02購04
715337,鈊象元大05購02
712219,倉和群益9C購02
714735,雙鴻永豐04購01
716333,長科*元富08購01
715082,宣德元富08購02
73416P,聯亞凱基01售04
712308,大江元大9C購08
715336,網家元大05購01
716075,力旺元大05購06
715051,網家元大04購02
715535,合一群益05購01
715658,原相統一05購04
716703,精材兆豐07購01
715003,大江元大04購05
715077,長科*凱基04購01
716730,弘塑元富09購02
712477,力致凱基01購01
713548,原相兆豐03購04
712813,佳邦凱基01購01
714892,統新永豐04購01
711459,譜瑞國泰01購02
712266,大江國票01購01
713799,優群元大02購03
716272,中美晶元大06購01
712150,穩懋統一9C購08
713156,合晶群益01購01
712020,穩懋統一02購02
712965,精測元富01購02
716122,鈺太元大06購02
716588,海韻電凱基08購02
711056,碩禾中信03購01
712495,力致國票02購01
713894,波若威永豐02購04
714623,網家統一05購01
715137,大宇資國票05購01
715547,穩懋凱基05購02
6127,九豪
715727,穩懋兆豐05購02
714686,穩懋統一06購01
714862,碩禾國泰06購01
716635,倉和凱基06購01
712424,聯亞元大01購03
712635,力旺元大01購04
714124,M31元大03購01
714766,台燿中信08購01
715521,合一國泰07購01
6716,應廣
6732,昇佳電子
712071,穩懋凱基03購01
712637,日揚元大01購01
716188,雍智統一07購01
716302,胡連國票07購01
716681,力旺中信06購01
4530,宏易
715605,泰博凱基05購02
715829,環球晶兆豐05購02
715574,鈊象國票07購01
715171,華星光元大05購01
715238,穩懋凱基04購06
716425,威剛凱基07購01
712350,力旺群益9C購02
715345,台半凱基05購01
