716669,中美晶國票07購03
712213,雙鴻永豐9C購02
715251,旺矽元富06購01
73669P,力旺凱基05售02
00746B,富邦A級公司債
712149,璟德統一9C購01
716016,廣運元大05購04
4729,熒茂
711464,新普群益9C購03
714151,鈊象凱基05購02
714767,原相中信08購01
715813,胡連統一07購01
73639P,鈊象凱基05售04
710768,中美晶統一9C購01
713319,統新統一03購01
716360,中美晶凱基06購06
714378,佳邦凱基03購01
716101,M31凱基05購01
713421,世界凱基01購04
713163,弘塑國泰03購02
714785,大田元富08購01
716916,台燿永豐06購01
715676,原相元大05購02
716451,大學光永豐06購01
716911,宇峻元大06購02
6185,幃翔
711885,雙鴻元大01購01
713604,昇佳電永豐02購02
715403,泰博元大05購01
712374,譜瑞富邦03購01
714667,碩禾永豐03購03
716146,迅得永豐05購02
712250,鈊象國泰03購01
713158,威剛群益01購04
716896,均豪凱基06購03
716946,精測國票07購01
712470,昇佳電群益01購01
713596,欣銓元大02購02
714233,神盾兆豐04購01
716457,旺矽永豐06購01
712072,譜瑞凱基02購02
712841,穩懋永豐01購01
715470,群聯凱基05購02
716816,璟德統一08購01
73528P,群聯元富07售06
711570,智擎國票01購01
714083,大江統一04購02
73384P,凡甲國票03售01
713606,聚積永豐02購01
714032,僑威統一03購01
712460,鈊象元富07購01
716621,晶焱永豐06購01
711603,穩懋國票01購01
712002,信驊國票01購02
716798,晶焱兆豐07購02
716912,威剛元大06購03
715863,金居中信08購01
711519,凡甲凱基9C購01
712574,海韻電凱基01購01
00874B,凱基BBB公司債15+
713739,大江康和02購01
715988,伍豐永豐05購01
712170,倉和永豐9C購01
715178,穩懋凱基04購05
73562P,統新群益03售02
716104,世界凱基05購01
5381,合正
711399,元太統一01購01
714318,聯亞凱基03購01
712685,網家兆豐03購01
715029,宏捷科兆豐05購02
715735,胡連凱基05購01
716735,世界元大06購06
73650P,旺矽國票06售04
711374,穩懋統一9C購05
712645,精測元大01購03
715063,台燿兆豐04購02
714996,建榮國票04購01
715595,精測元大05購03
716718,合一國泰08購02
6122,擎邦
8032,光菱
712617,環球晶富邦03購01
712695,合晶元大01購01
714615,晟德永豐03購02
715194,雍智永豐04購03
716283,環球晶元大06購02
8255,朋程
711516,穩懋統一02購01
714599,頎邦元大03購03
713467,光頡凱基02購01
714567,大田永豐03購03
713875,宏捷科國泰03購02
712696,合晶元大01購02
712891,鈺太元大01購02
712676,展旺群益01購01
715990,明安永豐05購01
716088,環球晶元大05購08
3526,凡甲
711768,中美晶統一01購01
716044,大田國票07購01
712657,宇峻凱基01購01
713585,桂盟凱基02購02
716416,威剛群益06購01
715122,大宇資國泰06購01
715888,聚和永豐05購01
716695,信驊元富0C購01
73755P,精材統一07售09
711427,雙美群益9C購03
713930,熱映凱基02購01
715055,大中國票05購01
715157,豪展永豐04購01
715795,金居永豐05購01
73213P,宇峻國票9C售01
2752,豆府
713045,M31凱基01購04
714797,迅得永豐04購01
73233P,聯亞國票9C售01
5291,邑昇
4972,湯石照明
711878,中美晶元大01購01
713640,統新元大02購03
715522,原相國泰07購01
3169,亞信
716465,大學光群益06購01
8416,實威
73418P,穩懋元富01售04
4163,鐿鈦
713371,宜特元富04購01
713921,原相元富08購01
73581P,宜特國票04售02
4116,明基醫
6015,宏遠證
713650,統新統一02購01
716529,穩懋富邦08購01
715641,泰博元大05購03
715655,元太麥證05購01
716127,僑威元富09購01
712447,神盾國票02購01
714467,弘塑元大03購03
714970,佳邦群益04購01
716575,威剛國票07購03
714148,泰博凱基04購01
714263,精測永豐03購01
714362,是方凱基03購01
715571,雍智國票07購01
4549,桓達
712562,高技群益01購01
712906,大宇資凱基01購01
716316,長科*元大06購04
4911,德英
713575,宣德中信02購01
716271,精材富邦06購01
7556,意德士
8050,廣積
712168,鈊象群益01購02
715084,環球晶元富06購01
715721,穩懋元大05購08
73470P,雙鴻群益03售02
713615,萬潤群益03購01
713886,環球晶凱基03購03
715940,中美晶麥證05購01
713013,群聯元大01購05
713539,精測元大02購03
73502P,環球晶元大03售01
3479,安勤
714404,世界國票04購01
715922,海韻電永豐05購01
711684,群聯群益01購01
714029,穩懋凱基03購04
6697,東捷資訊
715986,力旺永豐05購02
4908,前鼎
714516,鈊象統一04購02
4129,聯合
712978,精材統一03購01
712498,波若威國票02購01
711514,瓦城統一02購01
715118,網家統一06購02
714474,原相國票04購01
3288,點晶
6186,新潤
714044,頎邦群益03購03
715179,鈊象麥證04購02
711690,精測凱基02購01
713354,統新統一03購03
713356,宣德元大01購06
6485,點序
715525,元太元大05購01
73486P,鈊象元富08售08
712122,頎邦元大9C購01
713821,碩禾統一05購01
00777B,凱基AAA至A公司債
712774,網家群益01購02
714663,碩禾兆豐04購01
713960,僑威永豐03購01
711822,緯軟群益01購01
713398,創惟群益03購05
6138,茂達
712962,璟德群益01購02
714472,聚和元大03購01
716751,合一中信07購01
73476P,神盾凱基02售04
712108,聯亞凱基01購03
712199,鈊象統一02購01
714271,璟德凱基03購01
712603,中美晶兆豐03購01
714187,台半國票04購01
713592,精測麥證02購01
716424,旺矽凱基06購03
713855,金可兆豐03購01
73377P,大學光凱基01售04
711310,原相統一01購01
714496,金居元大03購02
715952,力致元大05購01
711620,智擎中信02購01
711942,優群統一01購02
713551,大江永豐02購01
714879,樺晟元大04購01
715089,信驊元大04購02
716238,大宇資凱基08購01
716863,驊訊元大07購01
3484,崧騰
712691,頎邦台新01購01
713168,弘塑元大01購02
713935,鈊象凱基05購01
714903,鈊象元大04購01
713667,璟德元大02購03
714309,健喬元大03購01
715227,宏捷科元大05購02
715338,欣銓永豐05購01
715722,穩懋元大05購09
716580,頎邦國票08購01
712401,鈺太群益02購01
713008,優群永豐01購01
709067,統新統一01購01
712243,群聯元大9C購03
713425,環球晶凱基03購02
714347,富喬康和03購01
714499,倉和元大03購03
73445P,昇佳電國泰02售02
707491,櫃200T永昌9C購01
713343,大田凱基01購01
712629,旺矽統一01購01
3218,大學光
5483,中美晶
713692,精測元富05購01
716843,雍智國票07購02
716450,元太富邦08購02
3597,映興
716636,博智凱基07購01
714915,倉和凱基04購03
716038,M31富邦06購01
713249,環球晶凱基01購06
716777,晶焱元大06購02
712384,久元永豐01購01
713492,穩懋元大03購01
715860,穩懋國票07購02
716511,璟德兆豐06購03
4973,廣穎
713422,倉和凱基03購01
714876,萬潤元大04購01
713351,原相統一01購05
713353,原相統一03購03
73436P,穩懋元大02售03
712132,元太元大9C購05
712459,優群元富01購01
715141,僑威國票05購01
712955,穩懋兆豐03購01
714285,穩懋兆豐04購01
73670P,力旺群益05售01
3092,鴻碩
6190,萬泰科
8083,瑞穎
713470,精測凱基02購05
715915,精測元大05購04
713983,立端康和03購01
8938,明安
711394,頎邦國票9C購01
73504P,僑威國票03售02
715015,合晶群益05購01
5328,華容
711817,力旺群益01購01
713479,元太凱基03購01
716417,威剛群益06購02
8424,惠普
714163,佳邦國票04購01
714559,聖暉群益03購01
714366,明安統一05購01
713232,信驊元富07購02
713570,良維元大02購01
711446,邦特國票9C購01
715760,雙鴻群益05購06
715359,璟德兆豐06購01
715196,信驊元大04購05
708924,穩懋永昌9C購01
713948,大江元大03購02
712223,鈺太兆豐01購02
712257,璟德凱基9C購01
712758,世界富邦03購01
716215,原相元富08購02
8289,泰藝
711376,群聯富邦9C購01
712185,譜瑞元大01購06
712005,譜瑞國票01購01
713012,神盾元大02購05
716432,威剛統一08購01
713911,鈺太群益03購02
715842,宏捷科凱基06購04
716150,新鉅科康和05購01
73469P,創惟凱基02售01
73603P,雙鴻元富08售02
73694P,環球晶元富05售02
6234,高僑
713825,宣德元大02購05
714844,群聯永豐04購01
713684,宇峻國票03購01
715612,原相元富0B購01
716698,力旺兆豐06購02
3707,漢磊
712722,禾瑞亞凱基01購01
713155,久元群益01購02
716618,世界永豐06購01
713904,合晶凱基02購02
716615,精材群益09購01
6265,方土昶
712147,精測統一01購02
712630,威剛統一02購01
713063,精測元大01購11
73307P,元太群益9C售02
713475,閎康群益02購01
713509,前鼎群益04購01
714572,宣德凱基03購05
714751,康全電凱基05購01
5520,力泰
711393,金居國票9C購01
713256,迅得群益02購01
713206,弘塑群益01購03
716059,威剛永豐05購01
711794,環球晶群益01購02
712999,桂盟永豐01購02
712589,旺矽元大01購04
716175,精材元大05購15
716534,昇佳電國票07購01
716649,精材國泰08購03
73346P,大學光元大01售02
714812,波若威元富06購01
00860B,群益1-5年IG債
3552,同致
712264,穩懋統一01購05
8047,星雲
711315,精測麥證9C購01
712056,頎邦國票01購01
713224,鈺太凱基01購02
716301,合晶國票07購01
3260,威剛
713955,穩懋第一03購01
714302,健喬群益03購01
715639,倉和元大08購01
73541P,璟德元大03售03
73750P,群聯元富0C售03
711935,力旺統一01購01
714289,松瑞藥凱基03購01
73771P,譜瑞元富06售02
711678,穩懋統一01購03
713523,雙鴻凱基02購03
715119,創惟兆豐04購01
713795,前鼎元大02購02
713854,世界兆豐03購01
713991,頎邦永豐03購01
716714,精材元大08購01
5281,大峽谷-KY
712376,力旺國泰03購01
715538,熱映群益05購01
716962,系微凱基06購02
714136,鈺太群益04購02
714154,中菲行統一04購01
715380,宏捷科凱基05購03
5452,佶優
712414,金居群益03購01
714596,鈺太國票03購02
715514,威剛凱基05購01
715880,原相富邦07購01
712316,網家元大9C購03
716844,鈊象國票07購04
73460P,中菲行康和02售02
5013,強新
713203,宣德永豐01購05
713338,世界國票03購01
714997,原相國票04購02
714145,宣德凱基03購04
2230,泰茂
3623,富晶通
712248,精測永豐9C購02
716182,瑞基凱基05購01
716252,廣運統一06購04
716736,世界元大07購01
73664P,環球晶兆豐05售03
712613,昇佳電統一05購02
715445,統新凱基06購01
73500P,宣德凱基03售03
73447P,大江元大02售01
5703,亞都
714805,碩禾元大04購01
715026,欣銓國票05購01
714782,藏壽司永豐04購01
715389,穩懋國票06購01
712674,信驊群益01購02
713423,神盾凱基01購03
716076,原相元大05購04
712017,胡連統一02購01
6227,茂綸
713968,鈊象凱基03購04
714746,加百裕凱基04購01
715730,信昌電永豐05購02
716802,波若威國票08購01
00869B,FT10-25年公司債
6212,理銘
715630,精材中信07購02
714236,M31統一03購02
715232,泰博元大04購04
715802,大中元大05購01
73364P,精材元大01售01
711765,中美晶凱基02購01
5905,南仁湖
711937,六角統一02購02
714220,昇佳電永豐03購01
716792,杰力永豐06購01
711677,璟德統一02購01
712205,聚積國票01購01
713698,雙美凱基04購02
715106,聯亞群益04購01
73589P,雙鴻兆豐05售02
3317,尼克森
711405,信驊元大9C購01
716011,穩懋元富08購04
712592,原相元大01購06
713113,昇佳電元大01購07
715713,原相元大05購03
4806,昇華
712394,M31群益03購01
712561,桂盟群益01購01
716445,宣德元大06購01
716951,元太兆豐07購01
715671,廣運國票06購02
00761B,國泰A級公司債
710671,大江富邦9C購02
714217,中菲行永豐03購03
711978,雙美群益01購01
73632P,宏捷科國票05售01
714429,雙鴻國票04購05
714929,東洋群益04購01
714330,雙鴻麥證03購01
715002,大江元大04購04
715444,金居凱基05購01
716522,群聯元大06購03
710951,譜瑞中信05購01
712949,精材元大02購02
711667,鈊象兆豐01購01
711803,大江統一01購03
6221,晉泰
716208,原相國泰08購01
3191,和進
715364,鴻碩國票06購01
716246,雍智凱基05購03
716834,瑞基凱基06購01
73319P,旺矽國票01售02
3226,至寶電
714659,鈺太國票04購02
716030,璟德凱基05購04
712322,大學光凱基01購01
715457,聯亞元富08購01
711496,原相元富03購01
715129,金居元大04購01
714640,大宇資凱基03購01
716256,旺矽永豐05購02
716719,創惟國泰08購01
3434,哲固
713131,日揚國泰03購01
715023,廣錠永豐04購02
715752,頎邦元富05購01
715768,雙鴻富邦06購02
716484,宜鼎元富0C購01
713853,碩禾元富08購03
3073,天方能源
714166,泰博國票04購02
714096,鈺太凱基03購02
715325,寶雅永豐04購01
5324,士開
711563,凡甲凱基02購01
712310,中美晶元大9C購07
714614,晟德永豐03購01
714564,倉和國票04購03
73451P,精測國泰03售02
73741P,倉和群益06售02
715390,台燿永豐05購01
73309P,璟德元富9C售03
712941,M31元大01購06
713824,世界元大02購06
715433,泰博元大05購02
711652,穩懋富邦01購02
4121,優盛
716877,信驊永豐06購02
712829,順達群益01購01
714712,世界統一05購01
716775,元太元大07購01
73385P,中美晶台新01售01
6568,宏觀
6662,樂斯科
712544,昇佳電永豐01購01
8349,恒耀
715798,群聯國泰06購02
712222,環球晶兆豐9C購03
715712,中美晶元大05購03
713589,宣德統一05購01
713637,凡甲元大03購02
715260,倉和群益04購02
712524,昇佳電元大01購01
713279,統新國泰03購01
712468,光頡群益01購01
73645P,中美晶元富08售01
3310,佳穎
712830,僑威群益01購02
713030,精材群益01購03
713727,中菲行群益04購01
73391P,前鼎國票03售01
712406,博智凱基03購01
713027,智擎群益01購01
715782,宏捷科國票07購02
715870,迅得元大05購02
716377,威剛國票07購01
716597,萬潤富邦08購01
715562,廣明永豐05購01
715673,旺矽元大05購05
715301,廣運兆豐05購01
73535P,精測國票03售01
712823,宣德群益01購01
713162,譜瑞國票02購02
713189,良維永豐01購01
713389,欣銓凱基01購01
716673,精材國票07購05
711332,聯亞凱基9C購01
713932,璟德凱基02購01
714229,緯軟元大03購02
713025,世界群益01購01
713617,環球晶統一02購02
73551P,倉和元大03售02
715373,雍智元大08購01
716412,旺矽元富08購01
714072,鈊象元大03購04
716002,伍豐國票06購01
716610,弘塑兆豐06購02
73584P,世界元大04售01
712207,南光凱基9C購01
714033,僑威統一04購01
73592P,大江凱基04售02
715382,宣德凱基05購01
73438P,雙鴻元大02售05
5529,志嘉
710977,泰博元大01購01
4162,智擎
712921,聯亞統一02購01
715545,曜越凱基05購01
714102,鈺太群益04購01
3093,港建
712464,豪展國泰02購01
712889,優群元大01購02
712660,展旺凱基01購01
713277,環球晶元大01購04
714911,群聯元富08購03
712529,原相元大02購03
712704,僑威元大01購01
712840,展旺永豐01購02
714468,兆利元大03購02
714697,鈺太元大05購01
711526,鈺太凱基02購01
4114,健喬
5309,系統電
715140,原相國票06購01
715961,力旺凱基05購01
710650,新普國泰9C購01
713364,群聯元大01購07
713276,精測元大01購15
715623,桂盟國票06購01
1258,其祥-KY
711482,網家統一01購02
711486,世界凱基01購01
714982,金居永豐04購01
712828,博智群益01購01
714023,群聯國票03購01
712395,大學光群益01購02
714298,緯軟元富07購02
713562,晶焱群益04購01
714978,台半永豐04購01
716595,群聯統一06購01
716066,佳邦群益07購02
711128,金居國泰01購01
713980,中美晶群益03購01
714573,雙鴻凱基04購02
716173,瑞基元大05購01
711852,中美晶凱基01購01
73490P,宣德永豐03售01
714881,鈺太元大04購02
712751,鈺太元大01購01
716589,富喬凱基06購01
8477,創業家
713161,均豪國票02購01
716334,信驊元富09購01
715264,雍智國票05購04
715311,鈊象元大04購04
714133,泰博群益04購02
712553,新潤永豐01購01
713659,M31永豐02購01
715099,濱川凱基04購01
712178,倉和元大9C購01
712196,智擎統一01購02
73648P,信驊凱基05售01
3322,建舜電
3498,陽程
4147,中裕
716350,富喬元大07購01
716375,合晶兆豐07購01
73564P,閎康國票03售01
712822,信昌電群益01購01
713465,穩懋統一02購05
713317,昇佳電統一02購03
713900,璟德永豐02購01
714140,合晶永豐03購01
715588,精材國泰07購01
3492,長盛
00747B,FH中國政策債
712234,南光統一01購01
712873,精測群益01購07
715000,新普國票05購01
715593,萬潤元大06購01
715808,鈺太元大07購01
716799,優群兆豐08購01
713822,信驊兆豐03購02
714117,盛弘永豐03購01
716870,譜瑞元富08購01
73642P,神盾元大05售01
6494,九齊
712917,原相統一02購03
714344,精華國票04購01
714921,頎邦兆豐04購02
716955,威剛統一08購04
73371P,力旺元大01售06
713519,昇佳電凱基02購04
713383,優群元大01購05
713683,M31國票03購03
715821,晟德永豐05購01
3362,先進光
712877,博智富邦04購01
713223,群聯凱基01購03
4747,強生
00697B,元大美債7-10
711326,金居群益9C購01
713215,譜瑞元大02購02
716497,大學光凱基06購01
713065,雙鴻元大03購01
713271,前鼎元大02購01
712388,威剛永豐01購01
715452,東洋國票06購01
713471,力旺國票03購01
714275,台燿群益03購01
714443,M31永豐03購01
716336,聚和元富07購01
712652,信驊永豐01購01
00744B,國泰中國政金債5+
00846B,富邦歐洲銀行債
3224,三顧
713581,中美晶凱基04購01
714249,精華群益03購01
712910,原相凱基03購02
714260,迅得元大03購02
715176,華星光凱基04購01
711703,旺矽統一02購01
712634,穩懋台新01購02
716578,聯亞國票08購01
716785,精材元大09購01
714192,台半元大03購02
715925,中美晶兆豐06購02
8436,大江
714020,宏捷科國票03購02
714294,環球晶麥證03購01
713411,弘塑國泰03購03
713420,力旺凱基01購05
716733,力旺元大08購01
712952,精測元大01購07
713237,聯亞元富04購01
716047,精材國票06購03
73443P,信驊國票03售01
1788,杏昌
8937,合騏
713876,環球晶國泰03購01
715733,鴻碩永豐05購02
715368,合晶元大05購03
715927,六角凱基05購02
73440P,信驊元大02售02
716291,力旺元富06購01
713989,精材永豐03購01
716853,佳邦元大07購01
4745,合富-KY
5603,陸海
712672,昇佳電群益01購03
713501,雙鴻永豐02購02
715115,宣德統一05購04
715550,倉和統一07購01
716270,威剛富邦06購01
716306,中美晶永豐06購01
712928,穩懋兆豐01購03
712026,鈊象凱基02購02
712420,新鉅科元大01購01
712200,鈊象兆豐9C購02
714006,鈊象元大03購01
715643,精材元大06購01
716224,中美晶國票08購01
709239,環球晶第一01購01
711000,雙美國泰01購01
716875,直得永豐06購01
713121,雙鴻元大02購04
715871,佳邦元大06購01
715987,由田永豐05購01
711904,環球晶統一01購02
714476,鈊象國票04購02
716347,中美晶統一08購01
713438,世界群益03購02
714379,茂達凱基03購01
714857,宣德統一06購01
715282,環球晶元大05購02
715785,鈊象國票07購02
713366,穩懋元大01購11
714328,穩懋國票04購02
716814,雙鴻凱基07購02
4109,加捷生醫
712074,合晶國票01購01
716459,茂達永豐06購01
716229,迅得元大06購01
712375,M31國泰03購01
714152,頎邦凱基03購02
715953,中美晶元大05購06
712146,健喬統一9C購01
5514,三豐
715853,金居兆豐05購01
73306P,信驊凱基9C售02
3265,台星科
714478,中菲行凱基03購02
715286,大江統一06購02
713188,宇峻永豐01購01
715014,千附群益04購01
712792,M31兆豐01購01
73687P,合晶元富0B售01
4550,長佳
716003,信昌電國票07購01
713540,環球晶元大02購03
2640,大車隊
711276,宇峻元大9C購02
712367,穩懋凱基02購02
715589,精材富邦05購01
6457,紘康
712365,大江凱基02購02
712870,前鼎群益01購01
714905,台燿群益04購01
715331,合晶元大05購01
715607,穩懋凱基06購01
712110,譜瑞凱基01購02
73337P,大學光群益02售01
715218,緯軟兆豐05購01
715875,倉和元大05購03
6241,易通展
713084,穩懋凱基01購03
713516,譜瑞統一05購01
3713,新晶投控
6264,富裔
713599,萬潤元大02購01
714080,力致凱基05購01
714794,環球晶凱基04購01
715876,群聯元大05購06
716713,精材元大06購06
716756,佳邦凱基08購01
713021,鈊象元大01購09
713026,宜特群益01購01
715387,倉和國票06購01
716806,譜瑞國票07購01
716813,群聯凱基06購02
713174,宜鼎群益03購01
713707,神盾永豐02購03
714005,緯軟元大03購01
73311P,穩懋富邦01售03
712527,展旺元大01購01
716712,博智元大06購01
73473P,宏捷科凱基02售01
9960,邁達康
715236,旺矽凱基06購01
716624,雙美永豐06購01
714926,雙鴻國票05購02
715289,廣運統一06購03
3522,御頂
8038,長園科
712180,倉和元大9C購03
713771,弘塑元大04購01
73454P,神盾永豐02售02
712795,原相兆豐03購01
715298,泰博元富04購01
73739P,雙鴻凱基06售03
712445,金居國票02購01
73362P,精測群益01售08
73366P,精測元大01售06
5508,永信建
712532,豪展元大01購02
714281,中美晶元大03購03
716974,鴻碩凱基08購01
713114,昇佳電元大02購01
714110,神盾國票03購01
716027,元太凱基05購02
2641,正德
3171,新洲
713558,精材康和02購01
715322,精測凱基04購02
715456,長科*元富05購01
716191,智擎元富08購01
716569,旺矽群益06購01
3339,泰谷
3580,友威科
713753,鈊象永豐02購01
713839,雙鴻第一02購01
716458,金可永豐06購01
716949,家登康和06購01
711550,鈊象國泰02購01
712010,原相兆豐01購02
6512,啟發電
8933,愛地雅
711888,信驊國票01購01
711911,原相兆豐01購01
712336,穩懋元大9C購15
712139,璟德元富9C購02
3202,樺晟
712755,美琪瑪永豐01購02
6147,頎邦
715561,豪展永豐05購02
4542,科嶠
8935,邦泰
712369,力旺統一02購01
714563,信驊國票04購01
716045,神盾國票06購03
716231,胡連元大05購02
713734,波若威國票03購01
73725P,群聯群益06售03
712815,閎康凱基01購01
711540,直得國票9C購01
713626,昇佳電群益03購01
716427,海韻電凱基08購01
73520P,鈊象國票04售01
711301,博智元大9C購01
711357,世界群益9C購02
6274,台燿
713333,原相群益03購01
714037,宏捷科群益05購01
715701,力致群益05購01
716323,中美晶康和06購01
3086,華義
713675,合晶統一04購01
714085,力致群益04購01
712566,久元凱基03購01
715772,群聯元大05購04
714146,泰博凱基03購01
714682,宏捷科凱基06購01
712342,弘塑永豐9C購01
713443,原相凱基02購04
711438,久元凱基9C購01
73506P,宣德元大03售07
714061,力致永豐03購01
710762,穩懋中信9C購01
712301,智擎永豐9C購02
00880B,第一金電信債15+
73662P,鈊象兆豐05售02
00751B,元大AAA至A公司債
716907,家登統一08購01
714685,網家統一06購01
714958,群聯麥證04購01
715330,精材富邦07購01
716189,博智元富0B購01
716763,元太國票07購03
713429,萬潤國票03購01
713497,欣銓永豐02購01
714522,海韻電中信03購01
715753,迅得群益05購02
73616P,穩懋凱基04售03
712953,精測元大01購08
716454,中美晶永豐06購02
73654P,精材統一05售04
5902,德記
712119,環球晶元大9C購12
4767,誠泰科技
6762,達亞
712595,精測元大02購01
715160,網家統一06購03
712788,美琪瑪康和01購01
713464,六角永豐02購01
712474,海韻電群益01購01
714407,M31凱基03購02
73479P,聯亞元大02售01
713789,創惟凱基03購02
714544,欣銓凱基03購01
6109,亞元
6126,信音
714188,宏捷科國票04購01
3512,皇龍
8932,宏大
715028,廣錠國票05購02
73674P,神盾元富05售03
713376,倉和永豐01購02
712101,邦特凱基9C購01
714307,健喬永豐03購01
715352,森鉅群益05購01
711727,威剛兆豐01購01
711985,原相元大02購02
713981,昇佳電國泰03購02
716356,胡連富邦06購01
00722B,群益15年IG電信債
711545,晟德兆豐9C購01
712957,神盾群益01購06
714224,弘塑元大05購02
714042,群聯群益03購01
715490,泰博群益05購01
716034,創惟統一07購01
716112,鈊象統一07購01
3085,新零售
6418,詠昇
714326,統新國票04購03
73777P,晟德群益07售02
713537,閎康元大02購01
715993,高技永豐05購01
73222P,雙美國票9C售01
5206,坤悅
6161,捷波
715943,統新元富0B購01
716185,聚和凱基05購02
716327,環球晶國泰08購01
716657,合晶凱基06購04
8107,大億金茂
713706,中菲行永豐02購02
715177,環球晶凱基05購02
714210,德微凱基03購01
714653,晟德元大03購02
715200,璟德元大04購02
712476,環球晶群益01購05
713922,精測元富08購01
714584,兆利元大03購03
712738,杰力永豐01購02
713009,M31元大01購07
715213,雍智元富0A購02
712051,元太國票01購01
712229,譜瑞凱基9C購03
3372,典範
714502,廣明元大03購02
716690,廣明永豐06購01
712662,僑威凱基01購01
713521,欣銓凱基02購01
4905,台聯電
712739,前鼎永豐01購03
715105,環球晶群益04購02
5202,力新
716202,中美晶國票06購01
73748P,昇佳電統一06售02
713172,弘塑群益01購02
714708,加高凱基05購01
713538,順達元大02購02
715477,穩懋元大07購01
73316P,精測群益9C售01
3144,新揚科
712642,博智元大01購02
6248,沛波
716830,佳邦凱基08購02
713657,環球晶群益02購02
715624,精材國票08購01
714273,緯軟統一03購01
73774P,家登統一07售01
713140,大學光元大01購07
714348,威剛元富07購02
715241,宏捷科麥證04購01
712490,高技凱基01購01
714664,倉和國泰05購02
715066,大田統一06購01
715911,元太元大05購02
716309,雙鴻永豐06購01
73420P,力旺元富04售01
713594,弘塑元大02購03
713786,原相國泰03購02
713602,中菲行永豐02購01
714125,力致元大03購04
715356,元太統一07購01
716541,茂達凱基06購01
711869,原相永豐01購01
712897,博智永豐01購02
4924,欣厚-KY
73331P,雙鴻永豐01售01
712366,博智凱基02購01
716932,雍智群益07購01
712647,穩懋元大01購04
715249,旺矽國泰06購01
715649,昇佳電群益06購01
713872,宣德中信03購01
716401,鈊象元大06購01
5364,力麗店
6680,鑫創電子
714501,倉和元大04購02
715053,台燿富邦06購01
715619,穩懋兆豐06購01
716288,泰博凱基06購01
716722,力旺群益06購03
713147,南光元富01購01
713490,欣銓元大02購01
73356P,鈊象群益01售06
3141,晶宏
8067,志旭
713374,鈺太元富07購01
716077,原相元大06購02
713212,桂盟元大01購02
