716421,中美晶凱基06購07
712186,譜瑞元大9C購03
714843,新普永豐04購01
716143,台半中信09購01
716165,環球晶群益05購02
711987,精測元大01購02
712413,旺矽群益02購01
4506,崇友
715749,旺矽元富07購01
712673,金可群益01購01
714458,迅得元大03購03
714604,優群群益03購02
713493,譜瑞元大02購03
5904,寶雅
714310,群聯元大03購01
1781,合世
6113,亞矽
4971,IET-KY
713805,碩禾群益02購01
715046,雍智元大04購01
715777,信昌電凱基05購01
715255,創惟兆豐05購01
716292,中美晶元富07購01
714027,弘塑凱基03購05
714493,統新永豐03購02
713665,宣德元大02購03
715994,晶焱永豐05購01
711199,元太富邦9C購01
713661,金可永豐02購01
714003,聖暉元大03購01
714054,昇佳電元富08購02
73638P,信驊元大05售01
712501,展旺統一01購01
712786,雙美凱基03購01
713809,M31凱基02購02
712741,聚和永豐01購02
711402,寶雅統一01購04
713953,精華元大03購01
715917,聯亞元大05購03
4944,兆遠
713361,原相元大03購02
713487,原相台新02購01
713480,宜鼎凱基02購01
714643,鴻碩凱基03購01
716881,驊訊永豐06購01
4168,醣聯
73751P,中美晶群益06售04
01016S,93中信貸c
713603,宜鼎永豐02購01
713766,元太兆豐03購01
715845,精測凱基05購02
713472,凡甲永豐02購01
715204,環球晶凱基04購04
714704,精測元大04購01
715837,信昌電元大05購02
716687,宜鼎永豐06購01
716149,富喬康和05購02
713611,精測兆豐03購01
714070,宣德元大03購05
712341,凡甲永豐9C購01
713261,元太元富03購01
716126,松瑞藥元富08購01
713918,凡甲永豐02購02
715873,金居元大05購01
716370,環球晶統一09購01
712759,金居富邦02購01
714645,大江統一03購01
716915,雙美元大06購01
9962,有益
73717P,環球晶統一07售02
712399,精測群益02購01
713298,統新元大01購02
1785,光洋科
714319,宣德統一04購06
714816,雙鴻元富07購02
712726,杰力凱基03購01
713299,統新元大02購01
715031,碩禾兆豐05購01
716056,緯軟元富05購01
716693,雙鴻第一06購01
712138,博智元富9C購02
715776,昇佳電凱基05購01
5864,致和證
73515P,群聯國票04售01
713252,南光永豐01購01
716287,長科*凱基06購01
5009,榮剛
712161,南光群益9C購02
713034,威剛國票02購01
713931,熱映凱基03購01
714709,宏捷科凱基05購02
712235,是方統一02購01
712579,鈊象凱基03購03
3128,昇銳
713963,原相國票03購02
715126,中美晶元大04購03
715203,泰博凱基04購03
715546,曜越凱基06購01
712105,群聯凱基9C購02
713079,桂盟凱基02購01
715576,中美晶元富0B購01
713619,宏捷科凱基03購03
713648,昇佳電統一04購01
714015,弘塑永豐03購01
716481,大學光元富07購01
712272,中美晶群益01購01
712136,穩懋元大9C購13
712551,海韻電永豐01購01
712655,M31凱基02購01
713091,大學光永豐01購04
711623,旺矽永豐01購01
716663,信昌電凱基06購01
712931,中美晶國票02購01
713865,精華凱基02購02
714176,加高群益03購01
714256,鈊象凱基03購06
712487,前鼎凱基01購01
715434,穩懋元大05購02
714557,美琪瑪群益03購01
714670,鈺太永豐03購01
713339,弘塑國票03購01
73496P,宣德國票04售02
8403,盛弘
712203,是方國票01購01
712846,群聯元富07購01
712521,力旺元大01購02
714938,宏捷科凱基06購02
715518,譜瑞凱基05購01
712106,精測凱基01購03
716010,新鉅科元富08購02
716553,聯亞永豐06購01
716554,泰博麥證06購01
714219,系微永豐03購01
714265,博智兆豐05購01
713811,原相凱基02購05
712453,雙鴻國票02購02
713286,環球晶元富03購04
73410P,新鉅科國票03售01
715787,新鉅科元富05購01
716477,新鉅科國票07購01
715642,精材元大05購05
713943,熱映康和02購01
715734,瓦城凱基05購01
4945,陞達科技
711494,旺矽元富9C購01
713149,昇佳電凱基01購04
716124,世界元富05購01
4953,緯軟
6167,久正
711924,穩懋元大01購01
713193,六角凱基01購01
714449,聯亞元富09購01
715715,晶焱元大05購01
716623,聚積永豐06購01
713823,中美晶台新02購01
713971,僑威群益03購01
712984,凡甲國票02購02
715076,佳邦凱基05購01
712700,系微元大02購01
715790,桂盟兆豐06購01
716771,中美晶兆豐07購03
715965,欣銓凱基05購01
716755,元太凱基06購01
73315P,宏捷科群益9C售03
1597,直得
6752,叡揚資訊
712361,鈊象群益02購01
714545,昇佳電元大03購08
716490,僑威元富07購02
713927,廣明群益02購01
716926,宇峻群益07購01
713816,碩禾元大03購01
714893,廣運永豐04購01
714523,創惟中信03購01
715191,泰博永豐04購02
712821,金居群益02購02
713450,倉和群益02購01
6649,台生材
713482,萬潤凱基02購02
715532,精材元大05購02
715443,宏捷科凱基05購04
712327,鈊象統一03購01
713651,群聯統一03購02
716212,新鉅科群益05購01
713549,雙鴻兆豐03購01
716435,萬潤國泰08購01
713010,昇佳電元大01購04
713273,創惟元大01購01
714818,廣錠國泰06購01
714995,創惟統一06購02
715230,旺矽元大04購01
00726B,國泰5Y+新興債
4419,元勝
710721,威剛統一9C購02
716282,環球晶元大06購01
716639,聚積凱基07購01
73376P,大學光元大01售04
714279,宏捷科國票04購02
716865,雙鴻中信0A購01
713726,威剛麥證02購01
714129,廣明元大04購01
5432,達威
714986,胡連凱基04購01
73206P,群聯國票9C售01
715372,群聯元大05購01
715831,金居國泰07購01
716819,中菲行國泰08購01
713132,宣德國泰03購01
712839,宣德永豐01購03
715326,雙鴻麥證04購02
711208,群聯兆豐9C購02
712405,原相凱基01購02
714115,大田永豐03購01
714949,穩懋統一05購02
715638,旺矽元大05購04
714299,泰博兆豐03購01
714497,信昌電元大03購02
713653,聯亞統一03購01
715379,鴻碩群益05購01
73621P,穩懋兆豐04售03
73769P,中美晶富邦06售02
712166,雙美群益01購02
712333,中美晶元大03購01
714067,力致元大03購02
715074,千附凱基04購01
5530,龍巖
712302,雍智永豐9C購02
713942,僑威國票04購01
712198,聯亞統一9C購03
713749,皇田永豐02購01
715918,六角永豐05購02
716966,長科*凱基06購02
712016,威剛統一01購03
712415,僑威群益01購01
713392,創惟凱基03購01
715497,宏捷科元大08購01
73403P,力旺元大01售08
73463P,宣德國泰02售01
716387,環球晶永豐06購03
73425P,精材國票03售01
73566P,僑威群益03售08
714452,穩懋兆豐04購02
713716,豪展永豐02購01
73272P,大學光國票02售01
713056,大學光富邦03購01
73629P,環球晶群益04售03
712189,大江統一02購01
4105,東洋
715883,精測中信05購01
715494,良維永豐05購01
00759B,FH製藥債
2743,山富
713311,弘塑凱基03購02
3499,環天科
712639,宜特元大01購01
713568,凡甲元大03購01
713731,中菲行國票02購01
714193,弘塑元大05購01
73565P,精材永豐03售02
712344,建榮永豐9C購02
713245,宣德凱基02購01
73622P,環球晶凱基04售05
716895,弘塑凱基06購02
73614P,雙鴻元大04售01
713649,信驊統一04購01
716545,東碩群益07購01
714272,原相統一05購01
716922,台半富邦08購01
4987,科誠
716331,環球晶群益06購01
712925,精測麥證01購02
713107,緯軟凱基01購02
715186,泰博國票05購01
715691,原相統一06購02
716596,群聯統一08購01
715148,環球晶凱基04購03
716054,創惟元富05購01
73558P,倉和國票03售03
714162,兆利國票04購01
713062,閎康元大01購02
714831,健亞群益04購01
4966,譜瑞-KY
711130,譜瑞國泰01購01
712667,力旺群益01購02
714469,原相元大03購06
715560,精材永豐05購01
716898,家登凱基07購01
712287,璟德群益9C購02
716583,信驊永豐06購01
716629,晶焱國票07購01
73431P,台燿國票04售01
6236,康呈
714634,大江富邦06購01
713782,網家統一02購04
714201,昇佳電元富05購04
714517,頎邦統一03購01
716443,旺矽元大06購04
711733,璟德國泰02購01
712649,頎邦元大01購01
715250,昇佳電國泰06購02
715590,網家富邦07購01
716039,僑威富邦05購01
713309,大江凱基02購03
73624P,鈺太群益04售05
73459P,群聯凱基02售04
73472P,群聯元富08售02
713016,優群元大01購03
713335,頎邦群益03購01
713588,宣德統一04購02
713629,雙鴻群益04購03
711606,精測麥證01購01
6419,京晨科
3115,寶島極
3162,精確
712619,昇佳電中信01購01
714351,群聯元富07購05
714796,大江永豐04購01
715065,千附統一05購01
716467,創惟群益08購01
006201,元大富櫃50
713956,昇佳電中信03購01
73510P,鈊象群益04售02
73683P,力旺元大05售07
00781B,國泰A級科技債
715778,聖暉凱基05購01
716176,精測元大05購07
711967,M31元富03購01
3490,單井
3577,泓格
713180,穩懋元富04購02
714475,海韻電國票04購01
714942,頎邦凱基04購01
715363,熱映國票06購01
711717,旺矽元大01購01
6509,聚和
714548,聚和元大03購02
715661,精材統一09購01
6210,慶生
713296,宏捷科元大02購03
713600,雙鴻元大02購07
715275,旺矽群益04購02
716748,力旺國泰08購01
712582,力旺元大01購03
716942,台燿國票07購01
713641,雙鴻元大03購02
714276,鈺太群益04購03
713693,凡甲麥證02購01
713715,華研永豐02購01
714171,聚和國票04購01
712298,信驊永豐9C購01
713975,頎邦群益04購01
714762,康全電群益04購01
712164,新鉅科群益9C購02
713901,精材元大02購04
714616,中美晶富邦06購01
715150,雙鴻凱基06購01
4417,金洲
4702,中美實
711355,環球晶元大9C購03
713094,磐亞永豐01購01
715670,精材國票07購02
6679,鈺太
713880,碩禾元大02購03
714150,泰博凱基05購01
716685,合一永豐06購02
713639,神盾元大03購02
715279,東洋元大06購01
715347,信音凱基06購01
715731,胡連永豐05購01
713965,昇佳電凱基04購01
715374,精測元大05購01
711441,弘塑凱基9C購01
713507,久元群益02購01
714594,閎康國票04購01
6292,迅德
6690,安碁資訊
8390,金益鼎
712069,金可凱基02購01
713037,桂盟統一03購02
713725,宏捷科統一02購02
714627,創惟凱基04購01
716914,威剛元大08購01
711470,信驊元大9C購02
715252,旺矽元富06購02
715833,宏捷科群益05購03
712324,胡連凱基9C購01
712942,久元元大01購03
714492,譜瑞中信07購01
716376,中美晶國票08購02
712076,茂達國票01購01
714549,鈊象元大03購08
713268,晶焱兆豐03購01
714246,雙鴻凱基05購01
713995,雙鴻群益04購04
712409,譜瑞凱基01購03
714739,德微凱基05購01
715602,元太凱基05購01
712306,優群元富03購01
712581,M31元大01購03
713085,譜瑞統一03購05
6462,神盾
714159,鈺太元富09購01
73710P,環球晶元大06售03
713246,創惟凱基01購01
716729,中美晶元富06購05
712148,璟德統一02購02
713219,宜特凱基02購01
714866,新普群益04購02
712604,雙鴻兆豐01購03
712612,昇佳電統一05購01
712816,網家凱基01購01
714231,世界台新03購01
713476,世界元大02購03
714964,昇佳電元大04購01
73611P,宣德元富08售03
711823,鈺太群益01購01
713763,桂盟元富08購01
715164,穩懋統一07購01
715205,鈊象凱基04購07
715222,優群國票05購01
712756,原相永豐01購04
716129,金居凱基05購03
3388,崇越電
712325,優群凱基9C購02
714160,台燿兆豐04購01
73305P,金居國票01售01
711309,久元統一01購01
712364,力旺凱基9C購03
714768,大中永豐04購01
712221,信驊兆豐9C購01
713676,宏捷科統一05購01
715104,信驊群益04購01
715773,雍智元大08購02
716285,久元凱基06購01
4712,南璋
8091,翔名
711151,泰博中信01購01
712362,力旺凱基02購01
715422,宣德國票06購01
6160,欣技
713776,穩懋永豐02購01
714322,台燿國票04購02
716121,廣運元大07購01
716544,東碩群益06購01
3646,艾恩特
711380,弘塑國票9C購01
00772B,中信高評級公司債
713848,原相群益02購03
73429P,中美晶國票04售01
3373,熱映
716359,頎邦群益08購01
716441,合晶元大06購01
712706,優群元大02購02
713201,大學光永豐01購05
713730,廣運群益02購01
713841,宣德永豐02購03
715892,中美晶凱基05購03
716958,譜瑞統一08購01
73529P,泰博群益03售01
1565,精華
3672,康聯訊
716065,台半群益05購02
715125,宣德兆豐05購01
6180,橘子
712797,宏捷科台新01購01
1569,濱川
4413,飛寶企業
713909,璟德群益03購01
714835,廣錠國票05購01
73612P,環球晶元富04售01
711889,鈊象國票01購02
712505,穩懋統一01購06
715412,穩懋元大06購01
716346,環球晶凱基08購01
713115,東洋元大01購02
8034,榮群
714063,南光永豐03購01
715396,中美晶群益05購02
716627,弘塑國票07購02
8176,智捷
716904,驊訊凱基07購01
714690,前鼎永豐04購01
73505P,大江元富09售02
715789,原相兆豐06購01
716276,長科*元大06購02
712640,原相元大01購07
713973,緯軟群益03購01
716242,金居凱基05購04
711634,宏捷科凱基01購01
711795,環球晶群益01購03
713264,倉和元富07購01
713576,大江永豐02購02
714445,信驊永豐03購02
715313,元太兆豐05購01
715999,大江國票06購01
716848,晟德兆豐07購01
711858,環球晶凱基01購02
713095,雙鴻永豐01購03
8924,大田
73212P,精測國泰9C售03
73534P,良維國票03售02
712776,環球晶群益01購06
714320,皇田統一03購01
715633,精材永豐05購03
712594,群聯元大01購01
3630,新鉅科
5604,中連貨
714714,東洋統一05購01
715594,精材元大05購04
715910,璟德群益05購02
713837,宣德康和02購02
714341,碩禾元大06購01
713833,碩禾統一04購01
716250,鈊象凱基05購11
73373P,精測元富01售03
73575P,穩懋元大04售01
716255,均豪永豐05購03
714173,鈊象國泰05購01
714985,均豪凱基04購01
714990,大江麥證04購01
715193,萬潤永豐04購01
8076,伍豐
712389,雍智永豐01購01
713466,中光電凱基02購01
716198,精材兆豐05購02
6016,康和證
715578,合一元富07購01
73641P,聯亞元富05售01
715754,佳邦群益07購01
5015,華祺
712659,美琪瑪凱基01購01
714415,熱映中信03購01
712725,系微凱基01購01
713265,海韻電元富07購01
713785,新鉅科國票03購02
714710,信昌電凱基04購01
712448,神盾國票02購02
715214,精測元富07購01
715440,信昌電群益05購01
715640,原相元大05購01
711787,久元群益01購01
713670,新普兆豐03購01
714324,金居國票04購01
712626,台燿康和01購01
8421,旭源
713794,世界元大03購01
716753,神準永豐06購01
713148,聖暉元富04購01
714587,神盾元大03購03
716172,新鉅科元大05購01
716594,胡連統一08購01
712233,東洋統一02購02
715488,璟德國票06購01
73518P,大江群益03售01
712271,鈺太元大9C購04
713106,萬潤凱基02購01
714380,僑威凱基05購01
715762,原相國泰07購02
711597,網家元大01購01
73583P,譜瑞國票04售02
712446,原相國票02購01
716171,神盾元大05購02
73582P,熱映國票04售02
6488,環球晶
00756B,群益15年EM主權債
712944,精材元大01購03
713280,精測富邦01購02
716071,精材永豐05購07
00832B,新光美債20+
712843,群聯麥證01購02
4433,興采
714325,健喬國票04購01
716947,緯軟國票07購01
73341P,威剛國票03售01
713518,世界凱基02購01
715062,雍智康和04購01
73706P,環球晶凱基06售03
5011,久陽
711959,久元國票01購01
714654,晟德元大03購03
715168,群聯群益04購03
716080,精材元大05購08
713242,創惟統一04購01
713039,精材統一03購03
713430,力旺元大02購01
715091,廣運元大04購03
716772,力旺元大06購02
8291,尚茂
710692,精測國泰9C購02
711428,雙鴻群益9C購02
73493P,大江國票04售01
712212,鈊象中信9C購01
6246,臺龍
714694,群聯元大04購01
715664,旺矽凱基06購02
711992,譜瑞元大01購03
73682P,神盾永豐05售03
6154,順發
7402,邑錡
715998,力旺國票07購01
716085,璟德元大05購02
712319,譜瑞元大9C購05
714674,倉和元大05購01
716100,鈺太元富08購01
4152,台微體
712423,環球晶元大01購02
714787,萬潤元富0A購01
715044,大江元大04購06
715254,倉和兆豐05購01
716294,信驊元富08購02
711217,建榮永豐9C購01
716354,穩懋元大06購04
715012,聚和統一06購01
715971,海韻電統一06購01
713553,宣德永豐02購01
714988,碩禾凱基06購02
73453P,神盾群益02售01
1591,駿吉-KY
4541,晟田
8096,擎亞
712294,譜瑞中信06購03
712507,閎康中信01購01
716599,中美晶元大06購09
00764B,群益25年美債
714431,原相統一05購02
714743,元太元大04購02
714981,均豪永豐04購01
715509,精材國票06購02
716152,美琪瑪永豐05購01
711561,瓦城統一01購02
715059,雍智國票05購02
715855,雙鴻兆豐06購01
714101,僑威群益04購01
710110,信昌電富邦9C購01
713468,順達凱基03購01
713797,精華元大02購01
711499,M31國泰02購01
712398,碩禾群益01購01
714039,昇佳電群益03購03
715340,順達永豐05購01
715357,廣運統一07購03
73689P,精材元富05售06
5245,智晶
713882,穩懋元富08購01
714184,倉和永豐03購01
714660,鈺太國票05購01
715960,信昌電兆豐05購01
712510,昇佳電康和01購01
712808,神盾元大01購01
4609,唐鋒
714600,頎邦元大03購04
712598,環宇元大01購01
713314,統新凱基02購01
716295,合晶統一06購01
73397P,環球晶元富03售03
73708P,中美晶元富07售02
712472,杰力群益01購02
714917,弘塑麥證04購01
715187,大宇資永豐04購02
715371,創惟元大05購01
716786,精華元大06購02
00831B,新光美債1-3
713067,合晶國票02購01
713864,皇田凱基03購01
73468P,鈺太群益03售01
712863,穩懋國泰03購01
6240,松崗
711958,雙鴻富邦01購01
714669,鈊象永豐03購03
716831,昇佳電凱基06購01
8048,德勝
712511,杰力康和01購01
712742,合晶兆豐01購02
73359P,鈊象元富07售05
8917,欣泰
712134,雍智元大01購01
716909,群聯麥證06購01
715018,碩禾群益04購02
715036,濱川永豐04購02
1595,川寶
712124,M31群益9C購01
715217,網家兆豐05購01
713228,系微國票02購01
73530P,僑威群益03售07
715096,聯亞元大04購01
716495,群聯兆豐07購01
712286,網家群益9C購05
713419,精材統一03購04
713426,穩懋凱基03購02
714074,力致國票04購01
714277,鈺太群益04購04
714959,晟德麥證04購01
716396,欣銓元大06購01
716493,旺矽兆豐07購01
716940,信驊元富09購02
714834,碩禾國票05購02
715319,僑威國票06購01
716293,弘塑元富06購01
716967,信驊凱基06購03
73455P,昇佳電國票02售03
711864,中美晶中信06購01
4510,高鋒
5383,金利
714741,熱映統一06購01
716927,系微群益06購01
6129,普誠
711636,網家凱基02購01
714706,頎邦元大04購02
716941,元太國票07購05
711729,晟德兆豐01購01
713572,雙鴻元大02購06
713690,宣德康和02購01
715365,合晶國泰07購01
713762,倉和元富08購01
715479,熱映國泰07購01
712260,鈊象凱基03購02
716851,中美晶元大06購11
5201,凱衛
713182,雙鴻統一03購02
713758,中美晶麥證02購01
715243,旺矽永豐04購02
3306,鼎天
712884,原相元大01購08
715905,台燿國票06購02
716099,精材元富08購02
73519P,雙鴻國票04售01
713165,佳邦國票02購01
713656,中美晶群益02購02
715699,信驊富邦06購01
2755,揚秦
4305,世坤
5403,中菲
711910,大學光兆豐01購01
712502,展旺統一02購01
716362,廣運凱基07購01
8043,蜜望實
712922,穩懋統一03購01
714961,大江元大04購03
715408,環球晶元大05購04
712611,昇佳電統一03購02
713697,弘塑凱基03購04
716108,倉和凱基09購01
4561,健椿
6287,元隆
01110S,051中租賃B
715568,合一國票07購02
715989,迅得永豐05購01
8916,光隆
711311,環球晶統一9C購03
4111,濟生
714506,璟德兆豐03購02
716324,環球晶康和06購01
711487,旺矽凱基01購01
712854,新鉅科國票02購01
716971,萬潤凱基06購01
6548,長科*
714287,泰博元大04購01
716485,欣銓元富0C購01
01111S,081中租賃A
713031,精測群益01購10
714031,昇佳電統一04購02
714439,昇佳電凱基03購02
714498,威剛元大04購01
714836,穩懋國票05購01
715964,佳邦凱基05購02
713737,精材兆豐03購01
716330,合晶群益06購01
73753P,合晶凱基06售06
3564,其陽
6207,雷科
711675,智擎統一01購01
713445,倉和國票03購02
714427,群聯國票04購02
716132,順達凱基05購01
711747,大江群益01購01
712909,宣德凱基01購02
713395,頎邦凱基01購02
714525,弘塑永豐03購03
714883,宣德凱基04購02
716864,信昌電中信09購01
713437,雙美元大03購01
714182,弘塑永豐03購02
712771,昇佳電群益01購05
712859,宏捷科康和01購01
715299,群聯元富04購01
716634,旺矽凱基06購04
5299,杰力
00679B,元大美債20年
714365,宏捷科麥證03購01
01017S,93中信貸d
712259,聯亞凱基9C購04
712523,禾瑞亞元大01購01
713103,優群國票02購02
713896,原相永豐02購01
715156,康全電永豐04購02
713072,桂盟統一01購02
714778,翔名永豐04購01
716793,金居永豐06購01
716796,原相兆豐07購01
73536P,雙鴻永豐03售01
711694,譜瑞凱基01購01
713407,中美晶元富03購01
712609,昇佳電統一02購02
712800,合晶元大01購03
713815,碩禾元大02購02
3230,錦明
715498,昇佳電元大05購01
711806,邦特統一01購02
715611,M31元富08購01
1742,台蠟
4580,捷流閥業
715211,鈊象永豐04購02
712593,神盾元大02購02
711676,緯軟統一01購01
712113,大江元大01購02
713998,鈊象元富08購04
714053,弘塑元富08購02
715312,旺矽元富06購03
8027,鈦昇
712959,精材群益01購01
715280,長科*元大04購02
713240,宣德統一03購01
2729,瓦城
713552,良維永豐02購01
713014,精測元大01購09
712473,美琪瑪群益01購01
714323,昇佳電國票05購01
715738,鴻碩凱基05購02
711258,環球晶富邦01購02
715709,明安國票06購01
711523,聯亞凱基9C購02
713367,宏捷科麥證01購01
714456,均豪元大03購01
4129A,聯合甲特
711562,直得統一02購01
714375,良維元富09購01
714076,合晶國票04購01
716296,合晶統一07購01
73482P,宣德元大03售02
713289,宏捷科群益03購01
716694,弘塑元富0C購01
73697P,中美晶群益05售07
713702,豪展元大02購01
714582,M31元大03購03
709611,穩懋元富02購03
714295,中菲行元富05購01
715679,聯亞元大05購01
716048,精材國票07購03
716251,精測統一05購02
712045,譜瑞統一02購04
714840,杰力永豐04購01
714914,佳邦凱基04購01
715109,信驊國票05購02
73412P,世界元大01售04
3228,金麗科
712569,迅得凱基01購01
3402,漢科
712172,鈊象永豐9C購04
714871,精測國票05購01
73526P,台燿元大03售01
711235,網家凱基9C購02
712163,神盾群益01購02
713388,創惟統一06購01
715309,環球晶元大04購05
716856,家登元大06購02
6603,富強鑫
73198P,頎邦群益9C售02
73602P,大江元富08售05
00841B,凱基AAA-AA公司債
712988,東洋國票02購01
713843,新普永豐02購01
713197,博智凱基01購01
716572,大江國票07購01
73348P,鈊象群益01售04
4429,聚紡
712486,波若威凱基01購02
712653,僑威永豐01購01
715080,雍智凱基07購01
716134,環球晶凱基05購04
73494P,中菲行國票03售01
4529,淳紳
713170,合晶元大01購04
713478,穩懋元大02購04
713828,宣德凱基02購03
712526,杰力元大01購01
73458P,穩懋元大02售07
00725B,國泰投資級公司債
716244,原相凱基05購06
710648,弘塑國泰9C購01
715491,信昌電富邦07購01
716234,精材元大05購16
716499,大學光凱基08購01
716720,凡甲富邦08購01
710165,大學光元大9C購01
712631,建榮統一02購01
715318,信昌電國票05購01
715559,金可永豐05購01
716280,雍智元大08購03
6270,倍微
713417,精材群益04購01
715784,旺矽國票07購01
716382,環球晶元富06購05
716642,雙鴻凱基08購01
3289,宜特
713672,雙鴻麥證02購01
4127,天良
714547,碩禾元大06購02
716160,力旺富邦06購01
8431,匯鑽科
710769,宏捷科統一9C購01
711834,胡連國票01購01
712125,大江群益01購02
713508,信驊群益03購01
711543,宏捷科兆豐9C購01
712973,原相凱基05購01
4107,邦特
3624,光頡
715618,璟德兆豐06購02
6026,福邦證
8401,白紗科
714113,僑威國票04購02
714715,鈊象元富07購10
713428,精材元富04購01
713928,鈊象群益03購01
714016,宇峻永豐03購01
714799,瑞穎永豐04購01
716184,精測凱基05購03
8069,元太
712127,鈺太群益9C購01
712422,聚積元大02購01
714832,博智群益04購01
714878,廣運元大04購02
715306,宏捷科元大05購03
711182,原相國泰9C購01
712318,璟德元大9C購05
716390,精材國泰08購01
714528,金可永豐03購01
714894,樺晟永豐04購01
3379,彬台
715887,統新永豐05購01
713696,中美晶凱基02購04
3324,雙鴻
711569,大學光國票01購01
715945,群聯元富05購01
713524,譜瑞凱基03購02
714503,倉和國泰05購01
715110,濱川國票05購01
715414,穩懋元富08購02
714213,群聯統一03購03
714359,僑威群益03購06
3354,律勝
713267,大江兆豐01購02
713647,弘塑統一03購01
714204,泰博元富09購02
712211,大江中信9C購01
712335,聯亞元大9C購04
716226,新鉅科國票06購01
00799B,國泰A級醫療債
714922,廣運統一06購01
715524,僑威國泰07購01
716842,萬潤國票07購03
3587,閎康
714045,中菲行元大03購01
6441,廣錠
714989,穩懋凱基04購02
715716,新普元大05購01
713759,M31國票03購04
712431,神盾永豐01購03
715343,鈺太永豐05購01
711091,弘塑統一01購01
713214,僑威元大01購02
73678P,神盾群益05售02
6179,亞通
711681,大江國泰02購01
712370,力旺統一03購01
73430P,元太國票04售01
3615,安可
711671,大江統一01購01
715172,萬潤元大04購02
716214,M31元富05購01
4175,杏一
5410,國眾
8906,花王
711805,台半統一01購01
713128,昇佳電元富05購03
713018,雙鴻元大01購04
713999,鈊象元富08購05
715418,台燿國票06購01
716133,群聯凱基05購04
712278,雙鴻群益01購02
712951,精材元大03購01
73532P,精測凱基03售02
713448,M31群益03購02
715818,合一永豐05購02
73544P,統新國票03售05
712665,頎邦凱基01購01
713184,譜瑞統一03購06
714655,晟德元大04購01
714288,元太凱基03購02
715528,信昌電元大05購01
715975,神盾富邦07購01
4161,聿新科
6640,均華
714250,緯軟群益04購01
713130,鈊象元富07購06
715657,旺矽統一0A購01
715949,鈺太元富05購01
716444,威剛元大06購02
716518,宣德元大06購02
3687,歐買尬
712761,元太國票02購01
713455,合晶元大02購02
715139,世界國票05購01
716582,東碩永豐06購03
712864,M31群益01購01
716517,合晶元大07購01
