068019,玉晶光國票02購06
070088,華城永豐02購01
072869,晶華永豐04購01
073972,技嘉永豐04購01
04588P,大立光元大08售01
069778,彩晶元大02購02
074261,臺股指富邦04購01
074939,FBVIX凱基05購02
08611P,聯發科凱基01售08
063021,大立光元大9C購05
066108,惠特國票02購02
067925,可成兆豐02購01
068558,聯電元大01購07
069289,玉晶光國泰08購02
069565,鴻海凱基04購02
072776,嘉澤中信04購01
073481,松翰元大04購04
03007X,元展07
068986,帆宣元大02購02
075803,華新科元大05購05
08742P,友達凱基01售02
064729,聯茂統一02購02
074774,華立凱基04購01
076044,喬山國票07購01
076140,台塑凱基05購01
077486,世紀鋼國票08購01
078128,FANG+群益06購02
08780P,聯發科群益02售06
03082P,鴻海元大01售21
04955P,台積電國票07售04
071040,台積電元富09購01
072040,致伸元大03購03
079289,元大金統一06購01
08990P,台積電元大01售28
03366P,TPK元大02售03
04425P,臺股指國票04售07
064860,聯發科富邦03購01
072324,道瓊銀富邦06購01
074348,國巨統一05購03
079257,京鼎元大06購03
08565P,聯發科群益9C售12
063213,智伸科國票9C購01
066942,滬深2X元大03購02
070138,欣興統一04購06
076071,友達元富05購03
2324,仁寶
071324,宏達電統一03購02
1731,美吾華
07269P,台灣50元大01售08
065410,國巨永豐9C購01
066494,旺宏國泰03購01
072466,聯電元富05購03
079211,金像電日盛06購01
069096,瑞昱統一02購02
069234,華通康和03購01
070868,玉晶光台新03購01
073927,欣興元大06購01
074649,立積國票05購01
075615,GIS凱基05購01
064914,友達統一02購03
066578,臺股指元大01購07
070716,亞聚元大03購01
076818,景碩富邦05購01
060872,高股息中信02購01
072312,TPK統一04購05
079351,華新凱基06購01
1437,勤益控
04525P,華邦電國票05售04
064236,奇力新統一01購04
064552,巨大凱基01購01
065224,和大凱基02購02
073659,創意兆豐04購02
04395P,國產中信08售02
076505,茂林凱基06購01
05335P,國巨元大06售16
062940,華新科凱基9C購02
070880,大立光麥證03購01
072106,嘉晶兆豐04購01
073064,揚明光凱基05購01
073546,聯電群益04購10
073220,材料凱基04購01
076852,大成鋼凱基05購02
8163,達方
04426P,臺股指國票04售08
064337,大毅元大01購02
067973,玉晶光群益02購23
068541,上証2X國票03購02
071724,上証2X群益03購10
075273,聯發科永豐05購02
01003T,兆豐新光R1
066610,台積電麥證01購02
068320,國巨元大01購17
07532P,台灣50中信01售02
079197,華夏群益06購01
061966,旺宏統一01購03
066329,達欣工永豐01購01
5534,長虹
075576,光磊國票06購01
079493,智邦凱基09購01
03720C,臺股指凱基06牛29
066455,聯發科統一01購10
069394,臺股指元大03購09
070707,臺股指凱基04購09
072481,祥碩國泰04購01
073861,上銀國票05購01
079613,金像電富邦08購01
067683,上緯控元大01購03
069089,億光康和02購01
071891,國喬元富09購01
078793,滬深2X凱基07購02
03196P,台積電元富07售15
066308,中化永豐01購01
068456,冠德國票03購01
069448,聯詠統一03購02
070164,GIS兆豐04購01
070352,台灣50國票02購04
071804,台灣50元大03購12
074994,南帝群益05購01
075877,台灣50凱基05購11
076425,友達元富05購05
077815,滬深2X元大07購04
063159,嘉澤國泰01購01
067412,玉山金中信07購01
067644,康舒統一01購01
072368,聯發科元大03購17
073383,景碩統一05購03
074213,台積電元大04購21
074614,立積康和04購01
078050,華邦電元大06購01
078343,圓剛凱基06購01
068820,聯陽元大02購01
072099,TPK群益03購02
075180,台灣50元大05購03
3023,信邦
03645P,臻鼎群益02售01
072634,瑞昱統一03購02
07389P,臺股指群益9C售08
079230,南電凱基06購06
079663,鴻海元大09購03
04351P,欣興群益04售02
065270,TPK元大01購01
072186,永光群益03購01
077155,為升元大05購08
077962,旺宏元大06購04
065381,緯穎元大9C購03
068068,瑞昱凱基01購03
073886,大立光中信04購01
074207,深中小元大04購01
078690,鴻海國泰08購02
1423,利華
071593,義隆凱基04購01
072008,創意永豐03購02
079704,FBVIX群益06購02
9925,新保
04303P,聯電群益04售12
065695,友訊群益01購02
068696,聯詠凱基02購03
071834,彩晶國泰05購02
078033,長榮凱基08購01
078558,圓剛元大06購02
03929P,聯茂群益03售02
04755P,晶豪科凱基06售02
065828,大立光凱基06購01
072857,聯發科國泰09購01
073228,永冠群益04購01
075435,可成凱基05購03
077041,上銀永豐05購02
078747,中興電國票07購01
08710P,鴻海元富07售03
04758P,臺股指凱基05售14
064175,華通國泰02購01
069152,台灣50元大02購10
070811,金寶元大03購03
074045,台積電元大07購02
075611,嘉晶凱基05購01
076327,大立光元大05購12
078275,亞光國票09購01
078771,聯電群益08購01
9910,豐泰
070551,華新科群益02購05
8480,泰昇-KY
05393P,臺股指凱基06售25
068052,玉晶光統一03購02
069247,美律凱基03購01
2247,汎德永業
04650P,國巨群益05售02
064758,可成凱基02購02
069581,宏碁永豐02購01
079343,滬深2X凱基08購03
04887P,臺股指國票05售07
065787,奇鋐永豐9C購01
065940,立積群益02購01
069395,臺股指元大03購10
065022,同欣電富邦01購01
070435,國巨凱基02購11
071017,康舒國票04購01
071111,元大金國票04購01
072804,松翰國票06購01
074342,鴻海台新04購01
075864,愛普永豐05購01
04438P,台積電國泰07售05
069981,新興凱基02購01
070743,台灣50群益03購06
076548,臺股指元大05購40
077900,南亞科凱基07購01
3164,景岳
063521,國巨凱基03購01
066768,瀚宇博永豐01購01
072695,日月光永豐03購02
077467,華邦電國票06購03
020016,統一MSCI美科技N
1906,寶隆
2457,飛宏
065779,台勝科國泰01購02
068959,鴻海群益02購05
070323,華擎兆豐03購03
077071,台聚元富05購01
078425,台積電群益06購05
078782,帆宣群益06購01
04836P,台灣50麥證05售01
067223,嘉基元大01購02
067628,力山永豐01購01
067865,友達元大01購02
073198,大亞凱基04購01
076977,元金2X元大05購07
04575P,台積電群益05售07
066774,聯詠富邦03購01
069116,金像電群益02購02
070482,國巨永豐02購01
07274P,上証2X群益01售01
076501,精元凱基05購02
2511,太子
071504,旺宏麥證03購01
072647,國巨元富07購20
075549,台灣50元大05購05
076304,健策元富05購04
078171,臺股指凱基07購03
04500P,聯電康和04售04
071399,冠德國票04購01
073679,奇鋐凱基05購01
074036,T50反1元大04購07
076383,康那香凱基05購01
077568,友達元大05購03
079304,台肥富邦08購01
03023P,玉晶光群益02售27
066271,東森元大01購01
067846,大立光元富01購01
069326,瀚宇博兆豐03購02
07053P,台灣50兆豐01售01
071238,道瓊反國泰04購01
079635,瑞昱康和06購01
4968,立積
05486P,聯發科元富09售06
070801,神基國票03購01
070814,精元元大03購03
079510,滬深2X元大06購07
3705,永信
069866,南港群益02購01
074759,敬鵬康和04購01
076869,鴻海元大05購11
077489,元石油中信06購01
079200,群創群益07購01
079342,上証2X凱基08購01
6269,台郡
065437,台表科凱基9C購03
065553,聯詠凱基9C購03
070209,華新科元大03購02
077770,盛群群益06購01
078218,寶齡永豐06購01
066962,致新元大01購02
067756,奇鋐國泰03購01
078691,鴻海國泰08購03
070518,宏碁元大02購05
073977,精成科永豐04購01
077463,國巨國票08購01
067986,亞德客元大01購04
078500,新唐國票07購01
078683,新唐元大07購01
03490P,聯電元大02售23
066105,松翰國票01購01
071887,聯詠統一04購01
074678,鴻海統一06購02
078040,TPK凱基06購01
078092,大立光統一06購11
066747,台郡元大01購03
069214,南電元大02購07
070866,群創統一04購01
071844,旺宏統一03購03
078472,南亞科統一08購01
067972,玉晶光群益02購22
068102,晶豪科永豐01購01
068283,帆宣中信01購02
079657,T50正2元大09購07
08825P,義隆元大01售04
064828,聯發科統一01購06
073502,大立光統一07購01
073695,聯發科元大04購07
074160,可成凱基05購02
076625,T50反1元大08購07
074387,晶碩群益05購01
076961,國巨群益05購06
077609,道瓊銀富邦08購01
08902P,台灣50中信05售01
04450P,台積電元大05售06
074860,嘉晶兆豐06購01
08892P,台積電元大01售27
912398,友佳-DR
068975,瑞昱元大02購03
069094,金像電統一02購02
069335,國巨群益02購05
070898,長興元大03購01
071276,仁寶兆豐03購01
071733,瀚宇博群益03購02
072512,S&P正2中信04購01
03503P,欣興元富05售02
05414P,彩晶元大07售02
066159,寶成康和01購01
071211,南亞科統一04購02
078409,瑞軒永豐06購01
078991,中鴻凱基06購01
02001L,富邦蘋果正二N
062781,微星元大9C購01
068865,茂林元富08購01
069813,聯詠國票03購02
072302,國巨統一03購09
079515,台玻元大07購01
03050F,恒指麥證02購03
04979P,南電元大05售05
066746,聯茂元大01購01
067192,矽格凱基01購03
070532,台積電統一03購19
071118,國巨兆豐05購01
03557P,欣興元大02售17
063660,儒鴻統一9C購01
064151,義隆統一01購01
067879,元黃金群益01購02
068989,瑞昱永豐02購01
073509,聯成國票05購01
074043,鴻海元大05購02
067403,眾達永豐01購03
067785,晶技群益01購03
071970,國巨元大04購04
072414,世紀鋼統一05購01
072478,上緯控永豐03購03
078804,大毅凱基06購01
064051,新日興統一01購01
076406,義隆統一05購02
05441P,臺指2X群益06售01
066379,台達電康和01購01
071103,T50反1國票05購01
073077,華新科國泰06購01
077114,中磊元富06購01
077737,精成科富邦06購01
1810,和成
066787,聯發科麥證01購06
068150,英業達元大01購02
072277,中石化元大03購02
073880,瑞軒永豐04購02
04243P,滬深2X元富04售04
069863,志超永豐02購01
073003,華通元大04購01
08870P,鴻海群益01售09
063742,道瓊指國票9C購01
065780,國巨富邦03購02
065897,凌華統一03購01
066756,長興永豐01購02
067374,大立光統一01購08
078204,力成元大06購01
066316,台船永豐01購01
068331,欣興元大01購09
078697,華通富邦06購02
04519P,台灣50台新04售01
067512,台郡統一02購03
067625,欣興富邦03購01
068780,國揚國票03購01
078273,南亞科國票08購02
04144P,祥碩元大03售06
04976P,台積電元大05售20
069295,奇力新中信03購01
069890,上銀元大02購01
075098,元石油國票05購01
078184,大成鋼元大06購03
078674,全新元大06購02
066566,康控元大01購01
074177,台積電元富08購29
03028P,玉晶光元大01售11
04943P,萬海元大05售04
062465,臺指反凱基01購01
069617,台積電統一03購18
071079,台勝科元大03購01
060494,台灣50元大01購12
072791,華通國票05購01
076842,長榮群益05購03
063339,智邦統一01購01
065223,旺宏中信01購01
072307,可成統一04購04
077271,臺股指元大05購51
063437,聚陽統一01購01
064450,致茂統一01購01
068815,精元元大02購01
070541,欣興元富08購06
073473,新興元大04購01
076460,義隆元大06購01
077312,牧德富邦05購01
066914,樺漢凱基02購01
067211,聯發科元大01購19
08847P,滬深2X群益03售06
04674P,台積電統一05售07
04831P,玉晶光元富0B售01
066802,亞光凱基02購01
067919,玉晶光永豐01購03
072707,鴻海統一03購09
074870,國巨兆豐05購02
075257,緯穎元富05購03
079559,力麗國票08購01
03096P,台積電凱基03售05
066527,泰鼎統一03購01
067100,華邦電群益01購01
068754,聯發科國泰08購01
073169,台達化國票05購01
075471,南帝富邦06購01
077764,大成鋼群益06購02
03038X,元展35
04656P,大立光元富05售03
059263,瑞昱中信01購01
063887,香港2X中信02購01
069836,聯華群益04購01
070145,南電統一04購04
071015,彩晶國票04購01
072517,上銀群益03購07
073153,萬海元大04購02
074224,松翰元大04購05
077503,中磊兆豐06購02
00689R,國泰20年美債反1
03614P,國巨國票02售05
03858P,聯電國泰05售01
067836,聯發科統一03購05
068179,致茂群益02購01
072757,滬深2X國泰05購02
076110,緯穎富邦05購02
078494,聯發科國票09購01
061912,台積電中信05購05
065998,友訊國票01購02
066791,牧德康和01購01
067914,鴻海永豐01購01
076499,光罩凱基05購01
04584P,南帝元大05售02
065281,和大群益01購02
069341,國產群益04購01
071619,旺宏元大03購06
6108,競國
069031,台積電統一04購07
070355,廣宇國票03購01
070757,東森群益03購01
071557,貿聯元大03購05
074568,彩晶凱基04購04
076291,TPK統一05購01
066171,德律凱基01購01
071910,華城元大03購04
074029,中石化國票05購02
076718,臺指反群益05購01
07755P,台灣50國票03售01
8463,潤泰材
064178,台郡國泰01購01
068596,亞德客凱基01購03
071637,南紡國票04購01
074495,大立光統一06購09
065208,義隆國票01購01
068807,上緯控群益02購01
070750,台積電群益03購05
072254,申豐凱基03購01
073467,南亞科元大04購03
03216P,臺股指群益02售01
068829,台積電國泰04購01
069298,欣興中信04購01
073525,聯發科國泰08購02
078248,T50反1群益08購02
079280,牧德國票07購01
078954,鴻海群益08購01
065531,聯電統一01購01
066777,群創富邦01購01
069243,台積電凱基03購13
076849,滬深2X凱基06購03
077552,群創國票06購02
079334,緯穎群益07購01
08851P,義隆群益01售03
04280P,大立光凱基04售08
066703,聯詠群益01購02
066804,緯創凱基01購01
068899,TPK元大02購01
075641,奇力新統一05購02
08636P,華通國票01售03
6166,凌華
072526,聯發科元大03購20
076446,聯發科麥證0A購01
076516,滬深2X元大05購07
074251,臺股指國票04購03
04667P,儒鴻凱基05售02
063141,聯發科統一9C購10
066692,T50反1群益01購04
067915,宏碁永豐01購01
068721,致茂元大02購01
06997P,台灣50中信03售01
077235,元金2X元大05購08
078085,世芯永豐07購02
078095,世芯統一0A購02
078657,正新元大06購01
03581P,台積電群益03售04
03769P,瑞昱群益05售01
058209,臺股指凱基01購01
062818,大立光兆豐9C購01
071741,台橡永豐03購01
072606,T50反1群益03購06
072918,長興元大04購01
064957,台表科凱基02購02
069191,晶技統一04購01
077586,聯電統一06購09
078202,彩晶元大09購01
04764P,台積電永豐05售02
063467,大立光元大9C購06
071711,南電統一03購06
065841,國巨元大9C購20
069422,南六統一02購04
073385,欣陸統一06購01
065569,智邦群益01購01
073686,T50反1元大04購05
076774,嘉聯益元大06購02
00676R,富邦臺灣加權反1
05204P,T50正2凱基07售01
071427,國巨元大03購06
074257,聯茂統一06購01
074370,聯詠國票05購01
08772P,滬深2X凱基03售03
065563,T50反1群益9C購04
067356,欣興群益01購01
068352,台積電凱基01購22
073895,南帝國票05購01
067022,台虹中信01購01
070031,南電國票03購05
071912,台積電元大03購13
078865,T50正2元大09購02
00706L,元大S&P日圓正2
1307,三芳
070155,台積電台新02購03
075691,和大統一05購02
076885,聯詠元大05購04
08206P,鴻海群益9C售03
04828P,南電統一05售06
064711,國喬統一02購01
068809,台灣50元大02購07
073400,台積電元富07購32
2344,華邦電
03114P,台灣50富邦03售05
058666,上証反群益01購01
059497,滬深2X元富9C購05
067075,亞光元大01購04
067896,玉晶光群益02購10
069203,華邦電元大02購01
03742P,南電元大03售04
1417,嘉裕
03835P,欣興凱基03售08
062539,可成國泰01購01
068939,鴻海日盛02購01
070501,台積電國票03購13
073134,台玻元大04購01
075600,聚陽凱基05購01
072482,祥碩國泰05購01
073608,南六兆豐05購01
075677,台積電麥證05購02
078140,南亞科群益06購02
05032P,台積電中信09售05
05136P,旺宏凱基06售02
066283,鎧勝元大01購02
066319,聯強永豐01購01
072612,國巨國票04購04
079209,臺股指麥證06購04
04659P,台灣50群益05售03
073000,柏文群益04購01
068867,旺宏台新02購01
070735,FANG+統一03購01
08559P,瑞昱國票9C售01
05459P,台積電凱基08售06
065597,旺宏元大01購03
071873,康那香群益04購01
073908,智易群益04購02
076384,台塑兆豐05購01
061864,臺指反元大01購07
069596,精元國票02購01
072475,敬鵬永豐03購01
072553,上緯控國票03購07
072677,大立光國泰05購01
077523,美指2X凱基06購01
078076,華邦電國泰08購01
2467,志聖
03678C,臺股指凱基01牛02
063452,創意統一01購01
064760,玉晶光凱基01購02
069249,聯發科凱基02購09
077154,為升元大05購07
078979,華新科日盛06購01
069424,瑞昱台新02購01
070210,國揚元大02購03
074094,光罩永豐04購02
077097,國巨第一07購01
079237,上銀元大06購02
08693P,宏達電群益01售02
03066P,台積電群益01售19
03428P,台積電元大02售28
04683P,嘉聯益元富05售02
060974,滬深2X元大01購01
067047,大立光凱基01購07
071135,聯發科元富09購01
072221,聯電凱基04購02
069807,金像電國票03購02
077140,長榮凱基05購04
04148P,T50正2中信05售01
065872,漢翔群益9C購01
068992,日電貿永豐02購01
073217,達邁凱基04購01
075779,為升凱基05購02
07606P,台灣50國票01售02
03200P,台積電統一03售11
079376,金寶元大06購01
5243,乙盛-KY
072198,旺宏元大03購08
075135,聯電永豐05購02
08609P,世紀鋼永豐9C售03
05324P,臺股指凱基06售15
069319,正崴兆豐03購01
078174,國巨兆豐06購06
079111,微星凱基07購02
065630,台積電國票9C購09
067931,旺宏凱基01購05
074679,華邦電統一05購01
076525,國巨元大07購03
04498P,欣興元大04售07
04527P,華邦電康和04售01
068476,聯鈞群益01購02
073367,可成元大04購05
073970,和桐永豐04購01
075402,華新科統一08購01
05460P,台積電凱基0A售04
062687,華擎統一01購02
062742,技嘉國泰01購01
068048,美律統一03購01
074586,精元群益04購02
065619,金融類元大9C購02
065683,嘉聯益統一03購01
1717,長興
066027,華擎群益02購01
068072,聯發科凱基01購18
069377,華碩元大02購02
078809,華晶科凱基07購01
079099,台達電日盛06購01
08613P,同欣電凱基9C售04
08750P,台灣50群益01售04
1301,台塑
04184P,義隆國票05售01
068657,台積電元大02購10
070613,聯發科台新03購01
070634,拓凱元大03購01
08576P,嘉澤凱基9C售03
061965,台積電統一02購02
066339,總太永豐01購01
067498,臻鼎元大01購03
067523,上証反群益06購01
069102,TPK統一04購03
070926,聯發科永豐03購02
076687,訊芯凱基05購01
077451,中鴻國票06購01
05308P,群創元富06售04
066636,健策凱基01購02
067046,聯發科凱基04購01
068049,玉晶光統一01購13
076410,和碩統一06購01
077789,台光電凱基06購01
08891P,國巨元大01售11
2429,銘旺科
04781P,臺股指國票09售13
04905P,台積電元大05售14
05379P,國巨兆豐07售01
067370,南亞科統一03購03
069610,緯穎國票03購02
073201,台玻凱基04購01
075445,富邦金麥證05購01
075538,華新科國票06購01
077786,台達電凱基06購02
068980,欣興元大02購06
070409,奇力新元大02購06
076025,大立光元大05購09
2468,華經
068611,臻鼎凱基01購01
073306,台聚群益04購01
075157,玉晶光元大07購04
077247,旺宏元大05購05
078400,友訊永豐06購01
03141P,台灣50國票01售08
068367,聯電富邦03購02
068382,亞德客統一03購01
076987,聯成國票06購01
08968P,台表科元大01售04
05018P,友達群益05售03
05418P,臺股指國票0B售03
068406,同欣電元富07購01
069563,百和康和02購01
069928,聯電統一03購07
070115,欣興元大02購19
076016,台積電元大08購02
077702,國巨元大06購06
079178,開發金富邦08購01
04098P,台灣50凱基04售16
070731,貿聯元大03購02
073092,國揚兆豐04購01
074816,南六統一04購01
05104P,聯發科統一05售08
068577,台積電國泰03購08
069182,台達電麥證02購01
070207,奇力新元大03購01
075760,大成鋼兆豐05購01
079016,中興電元大08購02
066614,貿聯麥證01購01
070394,大立光國票03購01
070469,國產群益03購01
073474,大立光元大04購08
074689,愛普統一06購02
00655L,國泰中國A50正2
075365,上緯控國票07購01
074763,滬深2X凱基04購04
075303,南電麥證05購01
077902,聯發科凱基0C購01
2337,旺宏
6152,百一
05444P,彩晶群益07售02
068307,美律國票03購01
070583,華通凱基02購04
077126,晶豪科群益05購02
078688,美利達元大06購01
079727,和大統一07購02
03828P,上銀元富05售02
05327P,台灣50國票08售03
065065,世芯群益01購01
068885,健鼎統一02購06
071786,慧洋兆豐03購01
071974,群創元大03購08
072684,和大永豐03購01
075139,欣興麥證05購01
076759,SP黃豆元大08購01
03218P,聯電康和02售02
069373,華新元大02購01
071704,康那香國票04購01
071944,神隆國票04購02
04956P,台積電國票07售05
064840,彩晶統一02購01
068789,旺宏凱基04購01
073465,智邦元大04購04
075018,國巨元大05購04
076409,合勤控統一06購02
08842P,京鼎凱基01售03
03050X,元展47
065923,臺指反國票02購03
070219,世紀鋼元大02購03
077727,南電元大07購01
2380,虹光
03330P,牧德群益02售03
073903,道瓊銀群益04購01
079374,華新元大07購01
03578P,創意元富08售04
075032,智易元大05購01
077030,世芯凱基06購02
07813P,台灣50群益9C售03
04092P,台積電國票03售17
065606,可成元大01購05
070787,神基凱基03購02
03879P,臺股指元大04售09
077854,中磊元大07購01
078267,元金2X國票08購03
03914P,台灣50群益03售13
069311,大立光凱基04購01
069363,華擎永豐02購01
070589,美利達凱基02購03
072246,致新國票04購01
073276,漢翔永豐04購01
075487,SGBR2X元大05購02
076741,順德凱基06購01
03415P,臺股指元大03售07
067780,臺指反群益02購03
072801,貿聯國票05購01
072948,台積電國票04購09
073444,友達凱基04購02
03471B,臺股指凱基05熊27
03673P,技嘉國票03售02
063205,貿聯統一9C購01
065478,緯創元大9C購03
066333,晶華永豐01購01
067782,亞德客群益01購04
068840,瑞儀永豐02購01
072882,亞德客群益04購01
077680,富邦金凱基06購01
08698P,可成凱基01售02
00881,國泰台灣5G+
066472,美利達統一02購01
066733,大立光元大01購10
068285,道瓊反群益01購05
072476,京元電永豐03購02
076269,台積電凱基07購04
079473,宏碁兆豐06購01
067604,晶技凱基01購02
079162,嘉晶元大06購03
8016,矽創
03391P,國巨兆豐03售03
078652,中興電元大06購03
04807P,臺股指凱基05售15
069824,百和統一04購01
072444,大立光麥證03購06
072965,旺宏統一04購04
077211,台灣50凱基05購17
065665,鴻海凱基9C購04
070309,燿華中信02購02
072727,大立光凱基05購01
08863P,台積電元大01售25
03108P,台積電元大01售40
066177,上緯控凱基01購01
070867,世紀鋼統一04購03
073587,旺宏凱基04購05
073939,南帝康和04購01
079442,T50反1元富0B購02
05216P,玉晶光元大06售12
05447P,長榮國票07售08
068569,健策元大01購13
069271,聯電永豐02購03
074591,欣陸群益04購02
077479,上緯控國票07購02
077527,國巨凱基05購11
05234P,T50正2中信0C售01
069504,華通永豐02購02
073130,大亞元大04購01
079687,臺股指元大07購09
03457P,欣興凱基02售08
064050,景碩統一01購01
065919,禾伸堂凱基02購01
074266,台積電永豐04購03
075958,創意永豐05購02
079141,華碩元大07購01
079616,緯穎富邦07購01
04997P,世芯國票07售02
070173,台積電永豐02購06
073765,欣興中信05購01
075089,晶豪科富邦07購01
079424,世紀鋼永豐06購01
063200,瑞昱統一9C購01
078907,長榮國泰08購02
079357,聯發科凱基06購11
079579,合勤控國票07購01
076330,聯詠元大06購01
068100,喬山永豐01購01
069975,台化凱基02購01
077084,新日興元富05購01
078027,南亞科凱基08購01
2397,友通
070192,中租群益02購01
072764,智易國泰05購01
073964,欣興國泰08購01
2345,智邦
071503,群創群益05購01
068463,聯發科富邦03購07
074940,SP黃豆凱基07購02
066045,聯發科元大01購08
067415,大成凱基01購01
068870,美利達中信03購01
072545,世紀鋼元大03購08
075497,大立光元大05購07
075772,道瓊反凱基06購02
076627,臺指反元大08購01
2401,凌陽
5007,三星
08896P,台灣50群益01售10
04728P,台積電統一05售09
067769,國巨統一02購04
073753,國巨元富08購10
074322,技嘉元大04購01
075266,立積國泰07購02
077280,南六統一07購01
065423,T50反1凱基02購04
076582,上証2X中信06購01
04625P,台表科群益05售02
071722,台灣50群益03購12
07882P,台灣50凱基01售12
2535,達欣工
057991,健策統一9C購01
070715,華夏元大03購01
076076,台積電麥證05購04
077519,台灣50凱基05購22
065323,聯發科凱基9C購09
073323,台肥國票05購01
073738,聯電統一06購02
059286,S&P正2元富01購03
063098,台灣50群益01購02
064855,聯發科國泰02購01
065254,大成鋼元大9C購01
071934,台苯永豐03購02
072175,矽格永豐03購01
076198,致新元富05購01
078067,彩晶元大06購04
05121P,萬海元大06售02
073820,欣陸元富04購01
075542,日月光國票06購02
078932,亞光永豐06購01
05130P,亞德客元大06售01
066434,台虹元大01購01
068091,華碩群益01購02
073516,台郡國票05購01
075052,欣興統一07購01
076351,華通永豐05購01
076616,訊芯國票06購01
063424,新日興凱基01購01
072773,聯茂兆豐04購01
074245,松翰凱基05購01
075954,大立光永豐05購02
077852,上緯控元大06購01
03669C,滬深2X元富09牛01
04706P,祥碩國泰07售02
065420,中租國票01購01
069310,大立光凱基02購06
072441,台積電麥證03購04
073419,精英永豐04購02
076942,祥碩富邦05購01
078612,亞德客兆豐06購01
08585P,台表科群益9C售04
065734,凌華凱基9C購01
066460,智原統一03購01
066669,華擎凱基02購02
074341,臻鼎群益05購01
077076,宏碁元富05購01
2540,愛山林
063389,大立光兆豐9C購02
075672,達欣工凱基05購01
078983,國巨麥證06購02
079561,華新國票07購01
079591,鴻海元富06購02
062485,華通國泰01購01
067483,禾伸堂元大01購02
070193,彩晶群益04購01
075911,聯電元大06購05
03282P,京元電凱基02售01
066342,上緯控永豐01購01
068232,泰鼎元富04購01
070365,國產國票03購03
071773,康那香元大03購01
