05031P,台積電中信09售04
068888,茂林統一03購01
069239,聯電凱基02購02
069679,瑞昱元大02購06
073369,大立光元大05購04
073929,群創元大04購05
075999,大立光中信09購01
077892,臺指反凱基09購01
078557,達方永豐06購01
065938,文曄群益01購01
068722,瑞昱元大02購02
070894,香港2X元大04購01
072203,聯發科元大03購15
075262,大立光國泰07購03
07734P,台積電富邦9C售10
079009,祥碩凱基06購02
064477,南六國泰02購01
067179,健策康和01購01
068926,道瓊銀永豐02購01
069573,臻鼎凱基02購02
070150,T50反1元富08購05
076241,T50正2中信0B購02
04387P,金像電群益04售02
067926,嘉晶兆豐01購02
075352,南電群益06購01
075372,國揚兆豐07購01
077147,南茂凱基05購01
00684R,元大美元指數反1
03093X,永豐金元大61展01
03897P,中石化國票04售02
079345,深中小凱基08購01
04873P,台灣50中信08售02
05352P,臺股指凱基06售20
063133,喬山統一01購01
066095,友訊中信05購01
070529,世紀鋼元大02購04
077300,聯電國泰07購04
05023P,台灣50元大05售18
061482,健策元大9C購01
066960,盛群元大01購01
070085,大成永豐02購01
071021,T50反1國泰05購02
072931,大立光元大04購03
075260,華邦電國泰07購01
08909P,華新科凱基01售04
2723,美食-KY
066208,聯鈞統一02購01
066260,聯強元大01購02
071799,富邦金國票03購01
08587P,聯發科中信01售05
071006,中興電國票04購01
074184,啟碁元富0A購01
074615,華城凱基05購01
03764P,南電永豐03售01
064724,健鼎統一02購02
069955,玉晶光永豐02購04
065741,聯發科麥證9C購06
068011,台表科元大01購05
070618,上銀元大03購01
075493,台積電元大08購01
077132,聯電凱基05購09
078367,圓剛元大07購01
068096,聯電富邦03購01
069712,美食國票03購02
070249,聯發科統一04購04
04999P,萬海康和05售03
05262P,國巨凱基06售05
05422P,長榮統一06售04
069473,百和國票03購01
074433,京元電凱基04購02
03205P,聯發科凱基01售24
05256P,玉晶光群益06售03
061613,南六統一9C購01
04852P,臺股指凱基05售22
059714,A50正2元大9C購01
066893,技嘉兆豐01購02
069197,T50反1元大02購03
072788,松翰凱基04購02
075457,台積電群益05購09
076144,國泰金凱基05購01
076519,中興電元大05購02
079369,台聚元大06購01
08970P,臺股指元大01售13
04223P,祥碩統一04售02
065975,緯創元大02購01
069156,台積電元大02購21
073449,康控凱基05購01
078300,聯電兆豐07購03
078596,神達元大06購01
08612P,嘉晶凱基9C售03
08965P,台灣50元大01售30
062756,臺指反凱基9C購01
065789,泰碩永豐9C購02
066186,台郡凱基02購01
070082,瀚宇博凱基03購01
077405,南六凱基05購03
078256,大立光群益07購02
08717P,台灣50元大01售16
8454,富邦媒
070345,拓凱元大02購01
076526,國巨元大07購04
078317,聯電麥證06購04
067283,南亞科國票02購01
069776,創意元大02購04
072311,群創統一05購01
076800,聯發科國票07購05
08765P,鴻海富邦01售02
05011P,精成科元富0B售01
073946,南亞科凱基04購01
076642,富邦金元大07購01
077242,中興電元大05購04
3054,立萬利
5515,建國
03886P,臺股指群益03售08
075155,景碩元大05購02
076527,友訊元大06購01
068913,聯發科群益02購11
070923,友達國泰04購01
071270,群創凱基04購01
08280P,臺股指中信02售01
08579P,臺股指元大9C售27
05095P,欣興凱基05售11
065861,台汽電元大9C購01
067421,華邦電凱基01購02
2233,宇隆
03680P,國巨凱基03售03
04081P,上緯控群益03售01
6243,迅杰
064946,台積電凱基01購07
074416,欣陸元大04購02
074527,聯電元大04購16
075287,萬海凱基06購01
075516,上緯控統一08購01
079128,華新科國票07購02
03831P,牧德永豐03售01
069597,京元電國票03購01
071499,義隆群益04購03
073271,精英永豐04購01
076038,T50反1國票09購05
076465,富邦金元大05購02
076736,台積電凱基06購06
00866,新光SHILLER CAPE
04177P,嘉晶凱基04售01
066505,可成富邦03購01
067910,玉晶光國泰03購03
069910,美利達元大02購02
071481,國產凱基03購03
075535,精英國票06購01
066700,瑞昱群益01購01
069385,華擎元大02購03
069660,世紀鋼凱基03購03
072592,奇鋐永豐03購07
075338,滬深2X群益05購01
079073,上銀永豐06購01
074883,友達國票05購02
076765,旺宏元大05購02
079103,力麗凱基06購01
03195P,台積電元富07售14
072178,健策元富05購02
075305,道瓊反元大08購01
05431P,友達麥證06售03
067213,大立光元大01購11
068365,大立光國泰03購06
070440,大立光凱基03購06
072520,崇越群益03購01
075753,T50反1群益05購04
064240,群創統一02購02
072693,大立光永豐03購04
077283,聯成元富06購01
04600P,台積電凱基05售07
067252,智邦國票02購02
068106,南電永豐01購02
078200,眾達元大06購01
04242P,貿聯元大04售01
063302,國巨凱基9C購05
065132,臻鼎兆豐01購01
065297,旺宏統一02購01
067676,大立光元大01購12
073585,精英凱基04購02
075259,T50反1國泰09購02
076019,聯發科元大08購02
079069,全新富邦06購01
3047,訊舟
063271,中磊兆豐9C購01
070261,華通元富08購02
072859,松翰國泰06購01
07510P,台灣50元富04售02
2852,第一保
063749,聯發科國票9C購04
066446,健策群益01購06
068124,康友元富07購01
076721,光罩群益05購01
079337,聯發科麥證06購03
05154P,長榮凱基06售03
066782,A50正2中信03購01
071035,T50反1元富09購01
076650,台虹元大05購02
054477,聯發科中信9C購02
068936,景碩永豐02購01
070225,臺指反國票02購04
070226,臺指反國票03購03
074237,金像電凱基04購03
062684,華新科統一01購02
070458,正文元大02購02
070701,聯電凱基04購01
079035,瑞昱元大06購04
03047P,矽創國票03售01
03367P,臺股指元大02售10
03874P,啟碁國票04售02
05377P,富邦金中信06售01
073817,聯發科元富0A購02
074643,旺宏國票06購01
076807,惠特國票06購01
04577P,美律群益05售01
070431,可成統一04購03
076020,聯發科元大08購03
078927,華新科永豐06購01
079610,榮成富邦07購02
2059,川湖
058841,深中小群益01購01
065909,大立光永豐9C購02
068122,彩晶元富03購01
068464,聯詠富邦03購02
2923,鼎固-KY
067633,致茂永豐01購02
068408,緯穎元富01購02
069022,台積電國票03購06
071578,旺宏群益04購01
074440,康控凱基04購01
075164,東鋼元富05購01
077575,長榮航元大05購04
077861,台達電富邦08購01
078516,元金2X凱基06購05
04265P,臺股指凱基06售04
077967,長榮元大06購05
070852,玉晶光永豐03購02
072730,貿聯凱基03購02
065447,緯創統一02購02
068717,華通元大02購04
072327,旺宏富邦05購01
074073,聯電元富06購05
078070,金寶國票07購01
078889,大立光元大07購05
5285,界霖
8996,高力
04430P,臺股指國票04售12
065948,燿華統一01購02
069751,華碩中信03購01
073139,新光鋼元大04購01
073190,台灣大康和04購01
073593,新日興凱基04購01
04916P,台灣50凱基05售12
065613,GIS元大9C購08
078433,友達群益09購02
065672,嘉晶凱基01購01
067842,微星元富07購01
068168,臺股指元大01購18
077214,力麗凱基05購01
079360,禾伸堂凱基07購01
079372,華新元大06購01
075031,創意元大05購02
2062,橋椿
064457,禾伸堂統一01購02
067677,大立光元大01購13
073524,台積電國泰07購03
07655P,台灣50凱基01售09
064015,立積國票01購01
066473,大成鋼麥證01購01
078554,玉晶光永豐06購05
079098,欣陸兆豐07購01
08882P,上証2X國票02售02
065971,金像電元大02購01
066394,建準凱基01購01
066881,上証2X永豐01購02
067720,瑞昱凱基01購02
071000,玉晶光群益04購02
071145,上銀凱基05購01
03768P,華碩群益03售02
064776,金像電群益01購01
066592,大立光群益01購06
067428,大毅凱基01購02
068981,晶技元大02購01
071230,中興電元富04購01
074675,緯穎永豐04購01
078464,聯電統一08購02
060149,元金2X富邦04購01
062049,亞德客統一01購01
069488,大立光元大02購06
075320,晶技元大05購01
078125,元石油群益06購01
075698,上緯控統一07購05
079235,大成鋼元大06購06
070180,台中銀康和02購01
079380,宏碁元大06購02
04763P,台灣50國泰07售03
075437,大立光凱基05購07
075507,樺漢元大05購02
078627,神達群益06購01
064921,景碩統一02購01
067404,盛群永豐01購01
068898,健策元大02購05
070081,泰鼎凱基02購03
074555,鴻海凱基04購06
04890P,臺股指國票05售10
05448P,欣興國票07售03
067393,欣興國泰03購02
069501,華新永豐02購01
071670,為升凱基03購04
071882,南六凱基03購03
076670,超眾元富05購03
066476,禾伸堂麥證01購01
067901,旭富群益01購04
069113,鴻海群益03購01
070356,華碩國票03購02
073258,華城永豐04購01
073330,友達國票06購02
073569,聯發科元大07購01
075185,台積電元大05購07
078946,全新統一09購01
04982P,台灣50國票06售03
05406P,上証2X凱基07售02
063053,聯發科統一01購04
065596,鴻海元大9C購16
065996,T50反1第一01購01
068701,道瓊銀國票02購01
078461,岱宇統一07購01
078484,鴻海國票08購01
078515,精成科群益06購01
063357,聯發科國泰01購04
05186P,聯電國泰08售03
067833,台積電統一02購06
068790,義隆凱基02購02
069147,聯鈞永豐02購01
070855,緯穎永豐03購01
075823,華擎國票07購01
067367,台積電統一01購11
071157,訊芯凱基03購01
075477,義隆永豐05購01
03525P,欣興凱基02售12
04932P,美食康和05售02
070712,群創國票04購02
072838,可成元大04購02
076776,南電元大05購04
076949,凌陽永豐05購01
08075P,聯電群益9C售01
058443,T50正2富邦01購01
066816,泰鼎兆豐03購01
068321,國巨元大01購18
078057,強茂元大06購02
067216,健策元大01購09
070522,京元電元大02購06
075300,技嘉麥證05購01
078828,全新國票08購01
065781,創意富邦01購01
06859P,元金2X中信9C售01
068796,麗豐凱基02購01
075334,國巨富邦08購01
077860,日月光國泰08購01
3406,玉晶光
062101,T50反1國票01購01
069379,微星元大03購01
071761,奇鋐元大03購07
072495,臺指2X凱基05購01
076834,台泥兆豐06購01
08689P,高股息中信01售01
05207P,聯電凱基06售06
075922,彩晶元大06購01
076220,友訊永豐05購02
062948,台積電富邦01購02
064365,美食統一01購02
066364,可成中信03購01
072272,世紀鋼群益04購03
072351,祥碩群益03購01
075130,松翰凱基05購03
077695,台達化元大06購01
1503,士電
03978P,上銀元富06售01
04064P,FBVIX群益03售02
05410P,上緯控凱基06售05
065876,牧德群益02購01
071459,英利永豐03購01
072544,彩晶元大03購08
077434,為升永豐05購02
068526,聯發科元富04購03
068783,亞德客康和02購01
075820,鴻海國票06購01
060658,台灣50凱基01購04
069087,緯穎凱基03購01
074482,國喬兆豐04購01
077151,台灣50元大05購17
079142,致茂元大06購02
064385,台積電富邦03購02
072802,日月光國票05購01
075899,元黃金元大05購01
076244,健策中信07購01
077711,華新科元大06購03
066317,英利永豐01購01
067799,玉晶光康和01購01
071180,臺指反元大05購07
071942,T50反1國票04購02
076364,聯成凱基05購01
03677C,臺股指元大05牛02
04847P,臺股指凱基05售17
064440,大立光凱基03購03
069227,欣興群益02購05
069494,健策元大02購07
077096,愛普富邦06購01
03801P,大立光元富09售04
067921,旭富永豐01購02
071978,聯電國票05購01
077734,榮成富邦07購01
066330,新興永豐01購01
066345,正文永豐01購01
073580,聯電康和04購02
077966,國揚元大06購01
079454,聯發科元富0C購02
3017,奇鋐
063963,鴻海國票01購01
074057,泰鼎元大04購01
074406,南亞科元大04購04
076651,台積電統一06購05
077622,祥碩永豐05購01
08975P,欣興群益01售05
4190,佐登-KY
064697,健策群益01購02
068257,聯發科國泰03購05
076275,欣興凱基05購07
077171,寶成元大05購02
077920,光磊群益06購01
9928,中視
03358P,金像電群益02售03
08792P,聯發科中信02售02
062892,臺指反元大02購13
069917,華碩凱基03購01
070213,欣興元大03購08
075782,智原凱基05購01
076839,元油反群益05購02
05123P,滬深2X中信08售01
064055,台郡統一02購01
067132,瑞昱永豐01購01
073958,臺股指凱基04購19
1201,味全
04212P,台灣50元大06售03
064405,美食凱基01購02
065405,華新科富邦03購01
067965,美律群益01購02
071757,金像電元大03購08
072821,華通群益04購02
075475,微星永豐05購01
076696,SP黃豆富邦08購02
04627P,聯發科元富05售09
064237,奇鋐統一01購01
065285,宏碁群益01購01
065458,立積元富03購02
068904,美利達元大02購01
070391,貿聯永豐02購01
071896,漢唐元富07購03
073800,晶豪科群益04購01
077453,聯電國票06購04
078183,中石化元大0A購01
2103,台橡
3711,日月光投控
4526,東台
071607,華擎麥證03購01
063514,南電麥證9C購01
063672,GIS統一9C購01
065976,牧德元大02購02
079665,台積電元大07購06
077777,T50反1凱基07購07
078780,嘉晶群益07購01
08608P,臺股指富邦9C售06
067500,台表科元大01購03
067935,大立光凱基01購09
073766,智易中信08購01
079777,創意永豐06購01
062503,玉晶光群益01購03
066162,泰豐凱基01購01
067007,拓凱永豐01購02
068731,健策元大03購01
070125,寶成元大02購02
071651,聯發科國票06購01
077558,中興電元大05購05
03300P,台積電元富08售07
066511,劍麟永豐01購01
069659,百和凱基03購01
072202,聯發科元大03購14
072739,台積電元大03購25
074041,華城元大04購01
075051,技嘉統一07購01
078938,中磊永豐06購01
079323,智伸科兆豐07購01
068803,國揚群益03購01
1456,怡華
075818,聯電國票07購02
076442,鴻海麥證05購02
03613P,台灣50國票03售04
063906,T50反1凱基02購03
070697,上銀凱基03購02
074316,臺指反元大04購12
074516,台積電國票07購01
074961,可成麥證04購01
075268,欣興富邦07購01
04481P,世紀鋼元富04售02
066464,台郡統一02購02
073246,大亞國泰06購01
075171,群創統一07購02
04966P,大立光中信06售03
072082,日月光麥證03購01
074887,萬海國票05購02
069912,百和元大02購02
070635,中租元大03購01
072288,世紀鋼元大03購05
074232,茂林麥證04購01
075990,貿聯群益05購01
078502,彩晶國票09購01
08548P,台勝科凱基9C售03
063336,大成鋼統一9C購02
070406,友達元大02購03
077310,金像電富邦07購01
065855,瀚宇博元大9C購03
067540,新日興群益02購01
03210P,美食國票03售01
04458P,滬深2X元富0A售01
063272,GIS兆豐9C購01
070421,T50反1台新08購01
070471,嘉晶群益02購03
071958,正文凱基03購01
067482,高鐵元大01購01
070906,智伸科元大03購02
077446,元石油國票08購02
078871,亞德客元大07購01
079288,義隆統一06購01
04074P,台積電統一03售22
059770,A50正2群益9C購01
070211,欣興元大02購20
075058,中纖元富05購01
075632,全新永豐05購01
076907,中興電國票06購03
078094,世芯統一0A購01
6184,大豐電
069756,國巨兆豐03購04
070992,力山群益04購01
071116,力山兆豐05購01
074428,台積電凱基04購17
076586,台積電中信09購02
076607,元金2X國票08購01
064229,台表科國票01購01
067068,台積電元大01購21
075868,力成兆豐05購01
03167P,友達元富07售02
03385P,台積電凱基02售17
061761,臺指反元大02購01
067974,玉晶光群益02購24
070828,和大群益03購01
075166,貿聯元富05購01
078374,立積元大06購04
078827,興勤國票07購01
079557,SGBR2X國票0A購01
1256,鮮活果汁-KY
066936,新日興國票02購01
075532,台積電國票09購02
077258,欣興元大05購03
077792,義隆凱基07購01
079419,智易永豐06購01
067823,台表科凱基01購02
071866,華城群益03購01
03756P,南電國票04售01
066885,牧德永豐01購02
068963,欣興群益02購03
071703,緯穎國票04購03
071797,順德國票04購01
074306,台光電凱基04購02
075009,國巨兆豐06購01
077148,世紀鋼凱基05購05
04078P,世紀鋼元富09售03
04258P,精元元富08售02
065205,金寶國票01購01
066626,盟立凱基01購01
08729P,創意永豐01售01
2520,冠德
03251P,台灣50台新03售01
04777P,臺股指國票09售09
04853P,長榮元大05售02
063929,高鐵統一02購01
069077,智邦凱基03購02
069280,智易永豐02購02
074264,力山永豐04購01
08911P,力成凱基01售01
063582,瑞祺國泰9C購01
067117,健策群益01購09
067877,T50反1群益01購07
070636,上海銀元大03購01
03186P,台積電元大01售50
071665,長榮航永豐03購01
075781,奇力新凱基07購01
078682,群創元大06購05
076555,全新元富08購01
078911,華新科富邦06購03
079564,寶齡國票08購01
072717,臺股指國票03購19
075038,華夏國票06購01
03782P,智伸科國票04售02
03981P,臺股指元富06售02
070010,美食元大02購01
073621,聯電元富06購02
073692,台積電元大05購04
076226,T50反1群益05購05
076404,台積電台新05購01
077264,台表科元大05購06
069740,智邦永豐02購02
075639,台灣50台新05購02
076135,聯成康和05購01
04641P,臺股指群益05售03
073620,世紀鋼統一05購06
076095,達方凱基05購01
03726P,可成元大03售01
03750P,欣興國票04售01
066026,泰碩群益03購01
072718,世紀鋼麥證03購01
073017,嘉澤元大04購02
075108,聚陽康和05購01
079238,鴻海元大08購02
04903P,台灣50元大05售10
066145,昇陽半群益01購01
067385,申豐統一02購04
067713,聚陽凱基01購02
068729,宏達電元大03購01
074149,世紀鋼元大07購01
1232,大統益
066682,聯詠兆豐03購01
069278,晶技永豐02購02
074263,T50正2永豐04購02
4942,嘉彰
065000,和大國票02購01
066799,台光電凱基01購02
068765,台積電統一04購03
076318,華通元大05購02
067349,中化群益02購01
068141,鴻海元大01購25
071396,旺宏國票04購02
03907P,臺股指凱基03售12
071362,達方永豐03購01
077413,SGBR2X元富0B購02
078745,潤泰新元富0C購01
079690,臺股指元大07購12
069915,國巨凱基02購10
072812,欣興統一06購01
073905,儒鴻群益04購01
075983,大立光群益05購08
4557,永新-KY
04695P,臺股指凱基05售11
063702,聯發科群益9C購04
073685,世紀鋼凱基04購06
073821,儒鴻麥證04購01
03016Q,恒指麥證05售03
061963,台積電統一01購04
067516,美利達統一03購04
071863,上緯控凱基03購01
077169,聯鈞元大05購02
077505,帆宣兆豐06購01
03086P,台積電元大01售37
078744,訊芯元富0C購01
07965P,玉晶光群益01售02
064369,彩晶統一01購01
065609,嘉澤元大01購02
071478,台積電凱基04購05
078926,可成永豐06購01
079543,正隆群益07購01
6477,安集
067228,華新群益01購01
08784P,上証2X元富01售01
2603,長榮
03932P,上緯控國票03售05
065345,台光電統一01購04
065637,台灣50元大9C購50
068181,長榮航群益02購01
074705,立積元富0A購02
04175P,聯電康和04售01
071706,聯電統一05購01
073060,京城銀凱基06購01
075449,祥碩麥證05購01
077454,聯電國票06購05
078093,世芯統一08購01
08634P,大立光元大9C售26
03064P,台灣50群益01售14
04471P,南帝元富07售01
063601,金像電凱基01購01
066078,南電凱基02購02
066858,聯鈞國票02購01
070067,南亞科日盛03購01
074178,順德元富07購02
075247,SP黃豆元富09購02
2913,農林
04896P,臺股指國票05售16
060497,臺指反元大01購02
077858,世紀鋼元大06購04
08830P,A50正2群益01售05
04572P,欣興國票06售02
066382,拓凱康和01購01
073055,英利凱基05購01
061201,FBVIX元大01購03
064818,華新統一01購01
065817,聯發科元富03購08
068290,大立光群益01購12
074717,立積富邦06購01
077930,大立光群益07購01
067818,玉晶光凱基02購02
074965,旺宏國泰06購02
077656,台表科統一06購01
04806P,台積電凱基05售10
065905,聯茂富邦02購01
067360,日月光群益01購01
068154,聯發科元大01購23
071321,仁寶統一05購01
068160,智易元大01購01
076054,寶成國票06購01
077996,友達國泰08購01
07876P,台灣50國泰01售01
063304,大立光凱基01購02
071026,中興電永豐03購01
074683,晶豪科統一06購01
076189,瑞昱元富05購01
04045P,台積電群益03售19
05078P,玉晶光元富05售05
065164,和大元大01購01
073149,旺宏元大04購07
04549P,台積電元大04售23
067508,奇鋐統一03購01
068407,同欣電元富07購02
070012,玉晶光元大02購10
070571,智邦永豐02購04
075520,億光元富05購01
065452,康友統一02購01
070039,統一永豐02購01
074745,嘉聯益元大04購02
078518,岱宇凱基06購01
08976P,臺股指群益01售10
062062,貿聯統一01購01
065426,台積電凱基01購09
071070,華城元大03購02
08664P,金像電凱基01售02
05035P,南電群益05售07
065305,泰鼎元富9C購01
067964,燿華群益02購02
074933,日月光元大05購02
075882,和大凱基05購01
065230,義隆凱基02購01
065854,臻鼎元大9C購05
066387,FBVIX凱基03購03
077370,聯發科元大05購17
077637,嘉聯益群益06購01
08171P,嘉澤國票9C售01
03101P,GIS凱基01售04
065752,正崴元大9C購01
066710,彩晶群益03購01
072260,元金2X群益05購01
068478,瑞儀群益01購02
00851,台新全球AI
03469B,臺股指元大05熊32
03678P,國巨元大03售03
04489P,愛普元大04售01
066107,惠特國票02購01
068697,聯詠凱基03購02
073345,萬海凱基04購01
00783,富邦中証500
04517P,台積電元富04售06
065837,臺指反元大03購05
075502,和碩元大05購01
065382,緯穎元大9C購04
065599,台光電元大9C購05
065958,T50反1元大01購01
069459,華碩兆豐03購01
070706,百和凱基03購02
073061,大立光凱基05購02
074147,力成元大04購02
075951,南紡永豐05購01
5225,東科-KY
03824P,聯鈞國票04售01
072298,GIS國票04購01
073114,強茂元富07購01
076091,欣興凱基05購06
076163,中石化元大08購01
078883,友達元大08購03
03376P,南電元大02售05
069893,台積電元大02購32
070395,FBVIX中信06購01
077716,欣興元大06購02
08333P,大立光富邦02售03
067556,義隆國票02購02
074169,大立光統一06購07
074710,立積群益04購01
077569,友達元大05購04
078230,華邦電元富0A購06
079065,台達電國泰08購01
079387,晶技元大06購03
079751,鴻海元富07購19
03340P,瀚宇博國票04售01
064162,貿聯統一02購01
068600,台積電凱基03購06
069558,元大金日盛02購01
072908,嘉澤凱基05購01
074256,國巨統一06購03
04346P,台積電中信08售02
077807,瑞儀元富08購01
04825P,台灣50永豐05售02
065015,上証2X富邦01購01
066307,華城永豐01購01
071350,群創國泰05購01
075091,亞聚永豐05購01
076539,上緯控元大05購05
069111,T50反1群益02購05
073652,正隆兆豐04購01
078811,健策凱基06購02
065944,大成鋼統一02購01
066753,聯鈞國泰03購01
075115,嘉聯益群益05購01
078476,彩晶統一08購01
064424,華新科兆豐01購01
076503,長榮凱基06購01
078656,榮成元大06購01
6525,捷敏-KY
04858P,臺股指元大05售37
05268P,臺股指凱基06售11
071925,台汽電元大03購01
079368,SGBR2X元大06購04
03015P,玉晶光永豐01售06
066732,可成元大01購06
066800,晶豪科凱基02購01
068667,聯電統一03購05
072786,可成凱基04購04
08763P,健策永豐01售02
1103,嘉泥
062228,南六統一02購01
065812,寶成群益9C購02
071560,矽創元大03購03
068340,緯穎元大03購01
073526,智易國泰06購01
076260,亞泥凱基05購01
065386,華通兆豐9C購02
066322,群光永豐01購01
066737,創意元大01購05
069931,聯發科統一02購12
074505,世紀鋼元富04購01
065444,燿華統一02購02
066506,宏達電富邦03購01
068390,聯詠統一03購01
070215,景碩元大03購01
074581,南六永豐04購02
075777,儒鴻凱基05購03
076937,台泥富邦07購01
077068,愛普統一07購03
078836,燿華兆豐07購01
1419,新紡
04137P,T50正2群益03售01
065917,全新凱基02購01
067715,泰豐凱基02購01
069999,台泥元大02購01
071067,康控永豐03購01
071726,A50正2群益03購04
073438,台積電凱基04購10
074984,泰鼎永豐04購01
078520,金寶凱基07購01
03160P,大立光元大01售22
05252P,台灣50群益07售02
05297P,聯電統一06售11
063649,南六元大9C購02
071018,啟碁國票04購01
073012,華邦電元大05購01
075361,元大金國票06購01
1440,南紡
03192P,台積電國泰03售05
066215,惠特統一04購01
069421,康友統一03購01
076549,臺股指元大05購41
077525,中興電凱基05購04
078891,嘉晶元大08購01
079169,南電元大06購12
08942P,上証2X國票02售04
03559P,南電國泰02售03
04540P,大立光群益04售08
066467,晶碩統一03購01
067843,聯發科元富07購05
074806,智伸科統一04購04
078535,岱宇國泰07購01
04585P,聯電元大05售04
05446P,華邦電國票07售02
063707,儒鴻凱基9C購01
066262,華碩元大01購02
073142,南帝元大04購02
074598,鴻海元大04購10
078642,長榮凱基06購04
067573,滬深反群益02購01
071261,力山凱基04購01
074460,精元元富08購05
076517,道瓊反元大05購02
078713,萬海永豐06購01
069387,牧德元大02購04
070290,玉晶光凱基04購03
072051,晶技統一03購01
03020X,元展20
03552P,上銀元富08售02
064413,世紀鋼凱基02購01
066296,昇陽半元大01購02
074949,旺宏凱基06購01
075967,華新科統一07購02
077294,京鼎元富09購01
078604,台表科元大06購01
03142P,台灣50國票01售09
03239P,臺股指元大02售04
04844P,台積電凱基07售05
071954,T50反1凱基07購01
075562,海悅元大05購01
078020,友達中信06購01
072177,義隆元富05購01
074201,美利達中信04購01
075626,南港永豐05購01
03172P,台灣50國票01售10
04428P,臺股指國票04售10
066507,和碩富邦03購01
067795,臺股指群益01購07
077532,欣興凱基06購03
066546,鴻海元大01購10
3645,達邁
063670,美食統一9C購01
067119,泰鼎群益01購02
071187,友達元大04購02
071262,友訊凱基03購01
073862,微星國票05購01
074497,晶碩統一06購02
074499,南六統一06購02
075425,群創兆豐05購01
3057,喬鼎
03787P,瑞昱中信09售01
065310,華擎國票01購01
066453,嘉基群益01購01
066826,聯發科群益02購03
076344,為升國泰07購01
066727,鴻海元大01購12
067719,旺宏凱基01購03
068095,GIS群益01購01
066632,智原凱基02購01
069226,聯陽群益02購01
072076,總太永豐03購01
075193,嘉晶元大05購01
075763,國巨兆豐06購02
