073522,T50反1國泰07購02
074444,亞德客統一05購01
077037,臺股指凱基05購31
077073,和桐元富05購01
03751P,新日興國票04售01
067436,訊連凱基01購01
072188,聯電群益04購04
072829,彩晶群益04購03
078843,南電兆豐06購01
03106P,T50反1元大01售06
068621,國巨群益02購03
072970,日月光統一04購02
074750,大成鋼永豐04購01
1316,上曜
1626,艾美特-KY
04173P,世紀鋼元大03售09
060284,南港元大01購01
065793,旭富永豐9C購02
068149,旺宏元大01購05
071745,精元永豐03購02
073262,興農永豐04購01
075474,國巨永豐05購01
078313,圓剛元富0C購01
2606,裕民
073858,日月光元大04購03
077092,新光金富邦05購01
078948,華新科統一07購04
03873P,康舒國票04售02
068289,國泰金群益01購01
072191,聯電群益04購07
064951,聯發科凱基01購04
068205,京鼎凱基01購05
077095,訊芯富邦05購01
6177,達麗
03423P,聯電統一02售07
04904P,台積電元大05售13
069891,上銀元大02購02
071295,達方國票04購01
071643,台積電國票04購03
072190,聯電群益04購06
077551,群創國票06購01
060670,臺指反元大01購03
069273,精元永豐02購02
073572,大立光元大04購09
074214,微星元大04購01
075947,台積電國泰07購07
00739,元大MSCI A股
070369,旭富國票02購01
072431,台積電凱基03購19
075064,愛普元富0B購01
077985,瑞儀元大06購01
08963P,牧德凱基01售02
04256P,華通永豐04售02
069935,南六統一03購01
077956,滬深2X元大07購06
079014,台泥元大06購01
065244,聯發科兆豐9C購05
067196,大立光台新01購02
067570,台積電麥證01購11
068662,臺股指元大02購07
070147,南電統一05購01
075275,華新科永豐05購01
075509,矽創元大05購01
077449,力麗國票06購01
065110,嘉澤國票01購01
074574,金像電富邦06購01
077317,聯電永豐05購08
079761,聯詠元富07購05
064296,奇鋐國票01購01
066102,國揚國票02購01
3622,洋華
04360P,健策國票05售02
058114,台積電第一01購01
068528,緯創元富03購01
075696,欣興統一07購04
076919,大立光統一05購06
08899P,台積電群益01售16
03957P,奇鋐國票04售02
069859,敦泰永豐02購01
074442,緯穎凱基05購01
079746,台玻元富06購01
03734P,奇鋐元富03售01
063365,義隆富邦01購01
065893,華新科統一02購02
066081,文曄國泰03購01
073013,智邦元大04購03
074271,達邁永豐04購02
076801,聯發科國票08購04
077726,南電元大06購03
08313P,健策國票01售01
065359,台灣50元大9C購49
065552,聯發科凱基9C購12
068044,寶成元富07購01
069368,上証2X元大03購06
068039,鎧勝元富07購01
08984P,玉晶光凱基02售03
064439,大立光凱基03購02
071237,南電元富09購03
071413,光磊群益04購01
074942,台達化凱基05購01
075872,奇力新麥證05購01
08607P,聯發科富邦03售04
03677P,華通元大03售01
065661,智原永豐9C購01
066349,聚碩永豐01購01
067561,晶技國票02購01
076252,奇鋐群益05購04
077424,嘉澤國泰07購01
062785,世芯元大9C購01
068381,玉晶光永豐03購01
069374,長興元大02購01
073205,新光鋼凱基04購01
073233,新光鋼群益04購01
077327,景碩永豐05購04
067772,超眾統一03購02
072251,大成鋼凱基03購01
076171,大立光元大05購11
08656P,大立光群益9C售07
03718P,台灣50國票03售05
03785P,南電元富09售02
05046P,臺股指元大05售46
064510,GIS元大01購01
071347,健策元富05購01
08581P,臺股指元大9C售29
08802P,聯發科元大01售14
03403P,玉晶光凱基03售07
063584,南六國泰01購01
071055,為升凱基03購03
079239,國巨元大06購17
08006P,長榮航中信03售01
08835P,聯發科統一01售12
072150,華夏國票04購01
074629,松翰凱基06購01
063011,台積電元大9C購01
069837,華城群益02購01
070334,建準元大02購02
072670,力成元大03購01
073185,台聚康和04購01
076589,中鋼兆豐05購01
077974,景碩元大06購08
04989P,玉晶光兆豐06售03
066945,鴻海元大01購14
069159,美律元大02購04
073579,玉晶光麥證04購01
074610,立積元大07購01
075550,元金2X元大05購03
04022P,彩晶元大03售05
067028,上海銀兆豐03購01
071356,微星永豐03購01
075647,台灣50群益05購02
077884,中石化國票07購01
04829P,友訊元富05售02
063822,聯發科麥證01購01
065681,聯發科統一9C購17
067798,GIS中信03購01
068535,台積電中信05購06
069435,健策群益02購03
070078,可成凱基02購05
071574,台塑化中信04購01
6142,友勁
03564P,為升群益02售02
076972,愛普群益05購03
078966,瑞昱兆豐07購01
079194,滬深2X群益06購04
08540P,嘉晶國票01售01
08567P,台勝科群益9C售01
03411P,欣興元大02售08
062196,聯發科中信01購02
066889,元大金中信07購01
077663,南亞科元富07購03
078160,聯電凱基07購02
078207,緯穎元大07購01
078536,台積電國泰08購04
064144,智邦統一01購02
073277,華立永豐04購01
075713,香港2X元大05購01
6117,迎廣
074162,群創凱基06購01
074974,可成富邦06購01
04581P,台達化元大05售02
070089,中橡永豐02購01
071051,矽創中信04購01
072539,群創元大03購11
072780,信錦凱基04購01
2543,皇昌
03924P,上緯控元大03售04
068435,聯發科凱基01購21
069745,欣興永豐02購08
078693,華新科國泰08購01
079587,上銀元富06購02
08754P,臺股指群益01售04
6669,緯穎
03579P,玉晶光台新02售02
04963P,大立光富邦06售03
064057,緯穎統一02購01
067439,巨大凱基02購02
069769,金像電元大02購10
072499,牧德凱基03購01
072938,昇陽半元大07購01
077886,為升國票08購01
04333P,祥碩群益06售01
060491,台灣50元富04購01
066378,超眾兆豐03購01
069920,欣興凱基03購05
070753,智邦群益03購02
076068,亞德客元富05購01
03127P,台表科凱基01售03
072083,鴻海國票04購03
073020,臻鼎元大04購01
076368,金像電凱基05購01
076640,強茂元大06購01
076915,台積電統一06購07
08941P,臺股指中信04售04
068536,聯發科中信04購02
03397P,台積電中信06售08
065713,緯穎群益9C購04
068422,緯穎兆豐03購02
074393,合勤控康和04購02
077382,嘉澤元大05購03
04543P,智邦兆豐05售02
03923P,聯發科元大03售06
069805,道瓊銀國票04購01
077765,聯電群益06購01
064883,GIS兆豐01購01
065463,大立光中信01購02
066991,訊芯群益01購01
069114,智邦群益02購01
04049P,健策元大03售02
067662,聚陽元大01購03
072624,世紀鋼國票03購03
073332,富邦金國票05購01
078316,聯電麥證06購03
03143P,滬深2X國票03售02
070886,大毅凱基04購01
071098,台積電麥證03購02
076445,華碩麥證05購01
077804,華邦電元富07購02
6409,旭隼
066106,台郡國票02購01
068663,臺股指元大02購08
069973,欣興康和02購02
071280,義隆兆豐03購01
073704,欣興元大05購01
078434,圓剛群益06購01
020009,群益A50綠碳N
065506,道瓊指群益9C購03
066439,信錦群益02購01
069029,潤泰新國票03購01
075881,恆大凱基05購02
077439,晶豪科永豐05購03
04386P,大立光凱基05售05
066417,台積電元大01購13
068153,美律元大01購04
071502,奇鋐群益04購03
074601,玉晶光元大06購04
075293,日月光凱基05購02
077034,台表科凱基06購03
077594,嘉聯益統一08購01
063934,寶成統一02購01
064025,友達元大02購01
064064,義隆富邦03購01
064550,南茂凱基01購01
068886,群創統一02購04
073568,聯發科元大04購06
08122P,晶技國票9C售01
1104,環泥
03793P,茂林元大03售01
066712,台灣50元大01購20
067979,寶成群益03購01
068134,上証反元大04購01
069823,欣興統一03購01
072142,晶豪科元大03購03
077142,玉晶光凱基05購10
05334P,聯電元大06售18
075709,嘉聯益元富05購01
076130,祥碩兆豐06購02
067783,高鐵群益02購01
076431,永豐餘國票07購01
08111P,臺股指中信01售06
063668,奇力新統一01購03
067378,欣興統一02購02
072808,聯電統一06購01
067908,玉晶光國泰03購01
069663,華新科兆豐04購01
074483,華城兆豐04購01
05201P,臺股指麥證06售02
066851,瀚宇博元大01購02
067041,國巨凱基04購02
070685,南六群益03購02
072880,國巨中信04購01
076566,創意富邦06購02
077620,欣興永豐05購04
079295,群創元富06購05
05038P,聯電凱基06售03
066037,華通元大01購03
066487,聯詠元富01購03
067143,台灣50統一04購01
072237,為升國票04購02
073998,群創元富08購01
057830,T50反1台新02購02
067254,華擎國票02購02
068361,惠特凱基03購01
074879,中纖國票05購02
077161,國巨元大05購16
077218,鴻海凱基05購10
2476,鉅祥
068903,帆宣元大02購01
074071,滬深2X元富04購05
04284P,玉晶光元大04售03
060521,鴻海中信01購03
068398,上証2X元富07購04
069229,瑞祺群益02購01
071479,旺宏凱基03購03
075578,聯發科國票05購05
078375,瀚宇博元大07購01
079568,上銀國票07購03
08837P,牧德國票03售01
8201,無敵
04946P,景碩元富05售04
05350P,臺股指凱基06售18
063413,台積電麥證01購01
065650,旭富元大9C購07
074382,義隆國泰06購01
075078,松翰凱基05購02
075592,奇力新康和05購01
00702,國泰標普低波高息
03638P,康控元大02售01
066198,華碩統一03購01
067832,鴻海統一02購04
070720,為升元大03購01
078297,A50正2兆豐07購01
079504,聯電麥證09購01
063570,嘉晶元大9C購02
075694,奇力新統一07購01
04363P,奇鋐中信04售02
074206,世紀鋼兆豐05購01
077576,玉晶光元大05購08
03955P,金像電國票04售02
04332P,大立光群益04售04
04662P,景碩國票06售03
067133,正崴永豐01購01
06947P,FBVIX元大01售01
070939,金像電群益05購01
074373,玉晶光國票04購05
076089,長榮航凱基05購01
077960,中鋼元大06購01
078089,南亞科統一06購02
4581,光隆精密-KY
076954,達運永豐05購01
068592,台積電統一01購13
069990,聯發科兆豐03購04
073782,聯電凱基05購04
075480,禾伸堂永豐05購01
076234,萬海群益05購03
076643,玉晶光元大06購06
064935,寶成統一02購02
069133,神隆永豐02購01
073888,玉晶光中信06購01
076889,京鼎元大05購04
04998P,臺股指麥證05售11
064832,長榮航統一01購01
065311,TPK國票01購03
073916,台光電元大04購02
077660,台灣50元富06購02
08228P,華擎國票9C售01
08533P,技嘉元富06售02
2707,晶華
03444P,道瓊銀群益02售04
03662C,FBVIX凱基03牛01
03811P,臻鼎元大03售02
04190P,南電元大04售03
065227,金像電凱基9C購01
065573,新日興群益01購02
068631,亞泥凱基02購01
076485,嘉聯益群益05購03
2630,亞航
04741P,台灣50國票08售01
066331,東森永豐01購01
074383,鴻海永豐04購02
2702,華園
065021,貿聯富邦03購01
065280,道瓊指群益9C購02
070046,奇鋐永豐03購01
073953,聯詠凱基04購02
076070,為升元富08購03
076559,中興電國泰07購01
079546,上銀群益06購02
03708C,T50反1元大06牛02
04795P,臺股指國票06售06
068871,台灣50凱基03購04
070892,臺股指凱基05購06
071695,致伸國票04購02
079529,宏達電元大06購03
068418,微星兆豐03購01
069126,世紀鋼群益02購01
070253,玉晶光統一02購04
070595,統一中信04購01
075178,聯電兆豐06購02
075929,上証2X國票06購01
03177P,國巨群益01售12
067307,聯詠元大01購06
076683,泰鼎凱基05購01
078787,聯發科日盛07購01
1537,廣隆
04597P,欣興群益05售05
066677,台泥兆豐03購01
075857,為升永豐05購01
076892,正文元大05購03
1805,寶徠
03542P,可成永豐02售02
04103P,金像電凱基03售06
065555,旭富凱基01購02
070915,世紀鋼台新03購01
073212,義隆凱基04購04
075150,東森元大05購01
076137,道瓊反凱基05購03
03163P,玉晶光元大01售15
04660P,鴻海群益05售02
065560,同欣電麥證9C購02
069406,台積電統一03購16
070139,京鼎統一04購01
070256,瀚宇博統一04購02
073244,台達化國泰06購01
04920P,台積電凱基08售04
05017P,聯電群益05售05
05294P,旺宏元大06售08
067911,SP黃豆富邦02購01
069015,臻鼎兆豐03購01
071084,瑞祺元大03購01
074719,國喬國票05購01
076082,A50正2凱基06購01
077548,長榮航國票08購01
078892,智原元大07購01
08631P,臺股指麥證9C售06
062873,國巨兆豐9C購01
065761,中租元大9C購02
068075,欣興凱基01購04
068366,泰碩國泰03購02
068643,GIS凱基02購05
069724,新光金群益02購02
072735,亞泥元大03購01
08596P,聯發科國泰02售02
065007,群創國票01購01
067159,上証2X國票02購01
073090,亞光中信08購01
078605,惠特元大06購01
2480,敦陽科
3209,全科
073744,大立光統一06購04
078102,台聚元富0C購01
07251P,台灣50元富01售04
072642,滬深2X元富09購02
072878,玉晶光兆豐05購01
074634,愛普凱基05購01
075455,上銀群益05購01
077544,友達國票08購02
079196,台聚群益07購01
066935,奇鋐國票02購02
067034,台郡康和01購01
067246,鎧勝群益01購02
068006,玉晶光元大03購03
070507,亞光國票03購01
073456,元石油元大04購01
079612,國巨富邦07購04
066383,臻鼎康和01購01
077062,大立光統一08購02
078653,中興電元大06購04
079661,鴻海元大06購12
4904,遠傳
03313P,台積電元大02售15
03945P,臺股指凱基03售19
04739P,台灣50國票06售02
071829,彩晶元大03購03
072630,國巨統一03購10
075429,大成鋼凱基06購01
077246,旺宏元大05購04
04095P,聯發科國票04售03
063246,嘉晶元大9C購01
064625,健策元大01購02
070415,T50反1國泰05購01
072993,晶華群益04購01
076103,聯詠群益06購01
077472,聯發科國票08購06
078607,南茂元大06購01
04564P,聯電國票07售01
061290,玉晶光統一01購04
067674,可成元大01購08
073411,申豐元富0A購01
074494,萬海統一06購03
074734,技嘉元大04購02
079044,大毅元大06購01
03488P,欣興中信02售05
067977,中磊群益01購02
064967,道瓊銀元大01購01
072635,美律統一05購01
076655,愛普統一07購02
068427,儒鴻凱基01購01
075845,祥碩國泰07購01
076662,台積電元富05購01
1522,堤維西
067135,聯詠永豐01購02
069791,聯強凱基02購01
071971,技嘉元大03購02
00742,新光內需收益
00875,國泰網路資安
063489,新日興國泰01購01
065414,立積永豐9C購01
070514,泰豐元大02購01
071477,台積電凱基04購04
075313,南港元大05購01
066862,台達電台新01購01
067475,微星元大01購05
068961,宏達電群益02購01
073285,材料永豐04購01
079161,嘉晶元大06購02
074618,華邦電凱基05購02
079503,上銀麥證06購01
064256,玉晶光國泰02購02
067292,大立光兆豐01購01
071260,中興電凱基04購01
071738,康那香國泰04購01
072806,巨大國票05購01
079605,鴻海國泰0B購01
1210,大成
063209,巨大統一01購01
066002,健策國票02購01
075330,同欣電元大05購01
078934,華晶科永豐06購03
068861,聯發科元富08購02
069968,欣興群益02購11
075203,大立光群益05購06
04707P,台灣50富邦05售02
067084,泰鼎元大01購02
070935,S&P反1群益06購02
071139,康控元富03購02
076116,鴻海永豐05購01
076453,鴻海元大05購08
03719P,金像電國票03售03
04714P,臺股指麥證05售06
05250P,台灣50群益06售03
059338,滬深2X凱基9C購02
065536,健鼎統一02購04
06771P,台灣50中信02售01
069678,金像電元大03購01
072387,可成永豐03購01
08627P,臺股指群益9C售22
067294,中磊兆豐03購01
076003,健策兆豐05購01
078362,華邦電元大07購03
066499,台郡國泰02購01
077843,長榮元大06購04
020001,富邦存股雙十N
03386P,台積電凱基02售18
04886P,臺股指國票05售06
05141P,華新科群益06售02
071530,友達國票04購03
08720P,台光電元大01售03
03479B,臺股指凱基06熊30
057446,旺宏元富02購01
064559,旺宏群益01購02
069966,聯發科群益03購02
071435,啟碁元大03購04
071529,台積電國票05購01
073601,華邦電兆豐05購01
2415,錩新
071405,微星麥證03購01
079138,台達電元大06購03
3703,欣陸
03499P,南電凱基02售07
066184,鎧勝凱基01購01
066600,瀚宇博國泰03購01
072181,群創中信07購01
1516,川飛
05094P,欣興凱基05售10
068594,台積電統一03購09
073253,大立光富邦08購01
075668,日月光康和05購01
077846,萬海元大06購07
1708,東鹼
03956P,精元國票03售02
061139,玉晶光統一9C購02
067942,瑞儀凱基02購01
068127,台積電統一02購07
070599,茂林中信03購01
070625,台光電元大03購01
071231,長興元富07購01
077225,華新科凱基05購10
04427P,臺股指國票04售09
069446,華新科統一04購01
070528,彩晶元大02購04
076119,長榮航永豐05購01
076471,祥碩元大07購01
079754,國巨元富07購26
065253,和大元大01購02
066525,創意統一03購01
069016,瑞儀兆豐03購01
078998,光罩凱基06購01
072487,台積電國票05購03
073883,玉晶光永豐04購04
08883P,台積電國票02售02
03137P,台灣50凱基03售03
03773P,燿華元大03售01
04902P,台灣50元大05售09
05166P,聯電元富07售04
062586,國巨統一01購06
2368,金像電
066764,聯鈞永豐01購01
067872,玉晶光元大02購03
070079,玉晶光凱基02購08
071425,國喬元大03購02
072055,英業達元富09購01
075904,南紡元大05購02
078001,友達富邦06購02
078640,光罩凱基07購02
062613,臺指反元大02購10
067088,啟碁元大01購01
070467,聯發科群益03購04
073505,瑞昱元富0A購01
076703,臺股指富邦05購02
08714P,華碩元富01售03
03190P,日月光元大01售05
058655,鴻海中信03購02
067313,欣興元大03購01
070710,國巨國票03購05
078276,明泰國票07購01
078667,友訊元大06購06
03466P,玉晶光台新02售01
05286P,臺股指群益06售07
05363P,臺股指中信09售06
070386,凌陽永豐02購01
073778,聚陽凱基04購01
077755,光罩國票08購01
3038,全台
065543,緯穎元富01購01
066772,友達富邦03購01
070616,SP黃豆元大03購05
076148,日月光凱基05購04
03132P,玉晶光台新01售01
064756,友達凱基02購02
068455,聯發科國票03購02
078055,南亞科元大06購02
079731,華通統一07購01
03942P,上緯控凱基03售02
065073,亞德客元大01購02
068632,華新凱基03購01
069045,國巨元富08購01
071561,南電元大03購07
074886,可成國票06購03
072784,漢唐凱基05購01
076735,廣宇凱基06購01
076982,世芯元大05購02
077602,玉晶光元富0B購02
069587,SP黃豆國票03購01
069711,宏達電國票02購02
072370,國揚元大03購02
072809,台積電統一04購15
077039,世芯國泰07購01
079322,群創中信0A購02
05068P,台積電元大05售26
061070,超眾凱基9C購01
066926,聚陽國票02購01
069140,金像電永豐02購01
078364,南亞科元大06購05
065726,京元電凱基9C購02
071112,群創國票04購03
075575,南紡國票06購02
03328P,台積電群益03售02
072029,滬深2X元大03購12
072400,祥碩國票03購03
075389,華立永豐05購01
075721,聯發科元大05購05
076132,聯茂兆豐06購02
03306P,臺股指中信05售01
068914,奇鋐群益02購01
072152,億光國票04購01
072685,南港永豐03購02
072795,可成國票05購01
074116,大立光群益04購06
08119P,南亞科統一9C售03
08752P,長榮航群益01售01
069388,松翰元大02購01
076430,道瓊銀國票06購02
077471,聯發科國票08購05
06326P,鴻海中信01售01
073981,大立光統一04購07
074571,T50反1國泰07購03
078274,宏達電國票08購01
03344P,台積電元富08售15
03347P,欣興台新02售01
062786,立積元大9C購03
066034,南六群益02購02
068900,上緯控元大02購01
071401,松翰國票05購01
08945P,臺股指國票01售02
03843P,聯發科群益04售03
04544P,聯發科兆豐05售03
069651,國巨凱基06購01
071679,臻鼎凱基03購01
072580,大立光元富03購06
00876,元大未來關鍵科技
05263P,台積電凱基07售09
066880,上証2X永豐01購01
071389,矽力凱基03購02
075090,緯創富邦07購01
078833,聯成兆豐06購01
079575,聯發科國票08購07
08872P,臺股指群益01售05
3059,華晶科
066221,康友台新01購01
069619,聯發科統一03購14
071677,TPK凱基03購01
074195,神基永豐04購01
074310,大立光凱基05購06
078617,嘉聯益兆豐07購01
03711C,臺股指凱基05牛26
05177P,萬海凱基06售02
066087,大毅永豐01購02
066725,華通元大01購05
067348,元金2X群益01購01
069661,南港兆豐03購02
070430,可成統一04購02
08998P,玉晶光群益02售15
1447,力鵬
065621,聯發科第一9C購01
066250,大成鋼元大01購01
074304,聯電凱基04購10
074582,愛普永豐04購01
076350,寶成富邦06購01
2454,聯發科
03122P,台積電元大01售44
03556P,華碩元大02售05
03642P,國巨群益03售04
065242,巨大凱基01購02
067256,新唐國票02購01
070036,敦泰國泰04購01
064031,玉晶光元大02購01
070372,聯發科統一03購17
075718,南帝元大05購04
077969,華立元大06購01
078054,南亞科元大06購01
078086,世芯永豐07購03
04453P,滬深2X群益04售04
072394,聯電國票06購01
075453,SGBR2X群益05購01
076067,和大元富0B購01
072089,臺股指國票03購13
072144,玉晶光元大03購14
076382,南電凱基05購02
067230,國巨群益01購05
072865,劍麟永豐04購01
03829P,友達元富06售01
064199,南六群益01購01
070677,建準群益03購01
077988,台郡元大06購01
078022,臺股指中信06購06
068371,華城永豐01購04
071440,惠特元大03購04
072485,喬山國票04購02
073078,滬深2X富邦06購01
074707,敬鵬群益04購01
072988,滬深2X群益04購01
074523,國巨麥證04購01
077324,正崴永豐05購01
04220P,祥碩國票06售02
065647,健鼎元大9C購05
067821,力成凱基01購02
06812P,台灣50元富9C售01
074401,南帝元大04購05
077970,禾伸堂元大06購01
065589,景碩永豐9C購02
066094,元黃金中信03購01
066598,致新群益02購01
073973,南亞科永豐04購02
078074,台表科國票08購01
3257,虹冠電
070128,聯強統一02購01
064790,金像電國票01購01
066856,致新元大01購01
067989,台積電元大01購31
069190,上銀統一03購02
070189,華擎群益03購03
073214,大立光凱基04購05
08981P,台積電凱基01售16
03462P,國巨統一02售07
03778P,聚陽國票04售01
067691,台虹元大01購03
068074,玉山金凱基01購01
069977,仁寶凱基04購01
072616,可成國票03購04
073181,合勤控國票05購01
074415,貿聯元大04購03
065215,義隆國泰02購02
065943,台表科元富01購01
075628,光磊永豐05購01
08603P,電子類元大9C售02
061709,SP黃豆凱基01購02
067839,臺股指統一01購01
073313,可成群益04購05
073987,華城元富04購01
04579P,GIS群益05售01
068786,亞德客凱基03購02
069301,道瓊反凱基04購01
069430,精元群益02購01
071423,亞聚元大03購02
071911,為升元大03購04
073091,松翰中信04購01
075306,FBVIX元大05購02
078531,彩晶凱基0A購01
078785,友達日盛06購01
079241,國巨元大08購01
2434,統懋
05311P,世芯元富06售04
059557,台灣50凱基9C購07
062693,中石化元大02購01
064534,京元電國票01購01
066766,嘉澤永豐01購01
069986,志超凱基02購01
2891C,中信金丙特
6133,金橋
03005P,旭富群益01售05
03021P,玉晶光群益02售25
067251,長興國票01購01
067546,世紀鋼群益01購05
067668,金像電元大01購02
067594,國巨凱基01購06
073606,貿聯兆豐04購01
074674,愛普永豐04購02
078801,興勤凱基06購02
08299P,玉晶光國票02售01
3029,零壹
064366,群創統一01購01
067505,微星統一03購01
072445,道瓊銀元大03購09
074117,大立光群益04購07
075468,臺股指群益05購02
056927,T50反1台新02購01
066029,神達群益02購01
067430,中工凱基05購01
072763,大立光國泰07購02
067688,南六元大01購06
068504,訊芯元大01購02
070313,力成中信02購01
072760,台積電國泰05購05
066599,鴻海國泰03購02
071562,達方元大03購02
073427,SP黃豆中信06購01
074869,華通兆豐04購02
077683,合勤控凱基06購01
079411,長榮富邦06購02
3042,晶技
05356P,台灣50元大06售10
063019,聯發科元大9C購01
066897,京元電康和01購01
076948,光罩永豐05購02
073484,臺股指元大04購29
075918,萬海元大05購02
4545,銘鈺
04773P,臺股指國票09售05
061134,大成鋼統一9C購01
067969,玉晶光群益02購19
075749,上緯控永豐05購03
076844,玉晶光群益05購02
05255P,圓剛群益09售01
05443P,聯發科群益07售02
062500,國巨群益01購01
068925,欣興國泰04購01
071311,茂林元大03購02
076997,世芯國票05購01
03353P,臺股指麥證02售02
04110P,台積電元大03售22
068498,玉晶光元大01購16
073250,精元富邦06購01
074953,晶豪科凱基04購02
072665,京元電元大03購02
074170,大立光統一06購08
076143,國揚凱基06購01
076328,聯詠元大05購02
08580P,臺股指元大9C售28
075683,晶豪科兆豐06購01
078880,微星元大06購02
00686R,群益臺灣加權反1
2849,安泰銀
068062,瑞昱兆豐03購01
068533,台郡元富07購03
071323,可成統一03購03
079063,玉晶光國票09購03
067536,大立光群益01購09
070606,宏碁統一03購04
074635,申豐凱基04購01
078565,SP黃豆元大07購03
065487,臺股指元大9C購25
070675,台光電群益03購01
072467,聯電元富05購04
076204,晶豪科國票06購02
079319,大立光中信07購03
064047,義隆統一02購01
074469,晶碩元富08購01
078194,全新元大06購01
03025P,國巨元大01售12
069112,道瓊反群益02購01
071880,聯陽凱基03購02
079183,神達永豐06購01
04568P,亞聚國票06售01
064757,義隆凱基01購02
066630,東森凱基01購01
069269,帆宣兆豐03購02
069983,奇鋐凱基03購02
072194,台勝科群益03購01
073839,國巨元大04購12
074503,精成科元富08購02
075784,茂林凱基05購01
076261,南亞凱基05購01
04358P,聯電元大04售10
063451,漢翔統一9C購01
065860,南電元大02購01
079129,長榮國票07購07
079683,群創元大06購10
04554P,臺股指凱基04售23
064529,友達中信01購03
066581,臺股指元大01購10
072197,國巨元大03購15
075307,道瓊銀元大05購02
03569P,台積電元大02售41
072706,和大統一03購01
072974,彩晶統一05購01
073653,上銀兆豐05購01
077466,旺宏國票08購01
04599P,聯電凱基05售07
04912P,鴻海元富05售05
066957,健策元大01購06
068605,聯發科凱基01購25
069489,聯陽元大02購02
075893,上緯控凱基06購02
077288,國巨元富05購06
077289,友訊元富05購03
078188,旺宏元大06購05
078810,玉晶光凱基07購03
08807P,可成元富07售02
9930,中聯資源
063275,臺指反元大02購16
072818,祥碩元富08購02
078406,友達永豐06購02
02001R,富邦蘋果反一N
064875,國巨兆豐01購01
068749,聯詠群益02購01
