03848P,國泰金元大03售02
065027,玉晶光中信03購01
066887,聯發科中信02購01
068705,聯發科國票03購03
077579,玉晶光元大06購09
03464P,信邦元富02售01
04224P,美指2X元富0A售01
04592P,臺股指元大05售08
065464,健鼎中信9C購01
065733,茂林凱基9C購03
068513,聯發科統一03購08
073211,聯發科凱基04購05
074919,上銀元大04購07
061964,台積電統一01購05
066148,美利達群益01購02
071833,華通國泰05購01
1730,花仙子
03341P,帆宣國票03售03
065995,台虹永豐01購01
069546,微星元大02購01
076159,台聚元大05購01
03646P,國巨國泰04售02
066937,群創國票03購01
068889,康友統一04購01
073184,元金2X康和04購01
077780,榮成凱基07購01
077911,GIS凱基07購01
069375,聯電元大02購09
075252,旺宏元富05購01
075640,國巨統一05購04
075684,欣興兆豐06購01
076876,南亞科元大05購02
078351,祥碩凱基06購01
03991P,宏碁元富07售04
072113,力山凱基03購02
9921,巨大
03475B,臺股指元大06熊10
065937,大毅群益02購01
069143,強茂永豐02購01
070330,中興電元大02購02
072498,嘉澤凱基03購01
073324,永豐餘國票05購01
076729,榮成康和05購01
03456P,華新科凱基02售04
074262,臺股指富邦04購02
076562,中興電富邦06購01
077785,聯電凱基07購01
03329P,大立光群益02售06
066306,亞聚永豐01購01
067844,全新元富07購01
068617,康舒國票03購01
074609,立積元大06購01
075741,樺漢富邦06購01
075952,聲寶永豐05購01
03759P,金像電國泰05售01
071028,大立光永豐03購01
5546,永固-KY
04897P,台灣50麥證05售02
068767,台積電統一04購05
075355,元石油國票08購01
076213,滬深2X富邦07購01
079394,寶成元大06購03
064077,台積電中信06購03
067339,欣興凱基02購01
068306,建準國票03購01
073855,緯創元大04購01
074100,瑞祺永豐04購01
2239,英利-KY
067382,康控統一03購02
071913,華邦電元大03購02
072209,牧德元大03購04
076511,臺股指凱基05購25
078949,長榮統一07購02
03232P,國巨元大02售06
067178,京鼎康和01購01
067454,矽格國票02購02
068369,玉晶光富邦03購01
070141,和碩統一03購01
071753,FBVIX元大06購01
076565,聯發科富邦08購01
077105,聯發科統一06購04
079294,聯電元富08購06
076504,上緯控凱基05購03
00675L,富邦臺灣加權正2
063769,玉晶光國泰02購01
067250,中化國票02購01
067714,上銀凱基01購01
076128,玉晶光兆豐06購02
078738,圓剛元富06購03
05430P,玉晶光凱基06售06
058541,T50反1富邦01購01
066201,大毅統一02購01
065075,葡萄王元大01購01
066113,金像電兆豐01購01
070640,達新凱基03購01
079038,友達元大07購04
065287,華新科群益01購03
067539,緯創群益01購01
074034,玉晶光兆豐05購03
074613,世紀鋼元大05購02
075161,臺股指元大05購05
077972,聯詠元大06購03
064220,力山國票01購01
068395,GIS統一03購03
8131,福懋科
03094P,台達電凱基01售04
068017,玉晶光國票01購09
072979,鴻海元富07購14
076381,緯穎凱基05購03
063199,台積電統一01購07
066405,晶碩凱基01購01
077661,台灣50元富0C購01
078734,友訊元富06購02
065195,國巨元富06購01
071878,宏碁凱基03購03
076496,中興電凱基07購01
079205,晶技麥證06購01
2409,友達
070696,聚陽凱基03購01
072063,松翰群益03購01
075941,緯穎國票07購01
076363,元金2X凱基06購04
03071P,GIS群益01售02
075588,聯茂國票06購01
076333,南六元大05購03
078252,鴻海群益07購01
072085,華新科國票04購01
072569,瑞祺統一03購02
075219,瑞儀凱基05購01
076058,萬海統一06購05
079396,榮成國票07購01
079588,上銀元富06購03
04182P,瑞昱國票05售02
05232P,臺股指群益06售03
061135,聯發科統一9C購03
066370,帆宣中信01購01
067659,滬深2X元大03購05
070558,申豐群益02購02
070755,華碩群益03購01
072255,世紀鋼凱基03購04
2459,敦吉
069735,百和麥證02購01
071441,電子類元大03購02
071611,道瓊反元大06購02
074577,群光永豐04購01
078469,華邦電統一07購01
078917,中興電永豐06購03
1418,東華
059014,SGBR2X元富03購01
067006,德律永豐01購02
069676,華碩元大02購03
071952,台汽電國票04購01
072161,聯詠國票04購01
074607,立積元大05購01
065750,智邦元大9C購09
069869,臺股指群益02購09
072585,華新科富邦05購01
074089,玉晶光富邦04購01
076911,健策國票07購01
078261,同欣電群益06購02
066602,滬深2X富邦03購01
068816,美律元大02購02
076156,臺指反元大05購09
077240,力麗元大06購01
078526,全新凱基08購01
078717,中興電統一07購03
08814P,世紀鋼群益01售04
8070,長華*
065133,SP黃豆凱基02購01
065380,緯穎元大9C購02
065603,聯發科元大9C購16
073960,FBVIX國泰06購01
075676,台積電麥證05購01
076570,榮成永豐05購01
079317,友訊中信06購01
08598P,立積元大9C售04
066114,瑞昱兆豐02購01
072360,聯電元大03購05
075614,彩晶凱基05購02
076290,玉晶光統一09購01
077714,萬海元大06購04
05269P,臺股指凱基06售12
059417,上証反元大9C購01
068907,臺指反群益02購04
069533,創意群益02購01
070812,金像電元大03購04
074231,台積電麥證04購04
077061,國揚統一07購01
065658,聯發科富邦03購03
068723,億光元大02購01
068732,嘉聯益元大02購01
070048,泰碩永豐02購02
070229,聚陽國票03購01
071603,國巨麥證03購02
074198,華城中信04購01
074395,合勤控國票05購02
079066,嘉晶國泰08購01
05329P,T50正2國票09售02
066291,惠特元大01購01
066336,聯陽永豐01購01
070499,台積電國票02購06
076490,強茂國票06購02
077302,國巨國泰07購05
03396P,台積電中信06售07
064675,A50正2兆豐01購01
070341,欣興元大02購23
071281,富邦金兆豐03購02
077681,聯詠凱基07購01
08770P,上証2X凱基03售04
6541,泰福-KY
063810,香港反群益03購01
070242,聯發科國泰04購02
071316,矽創元大03購02
076273,大立光凱基05購09
04046P,南電群益03售04
06900P,FBVIX國票12售01
076102,美食群益05購01
078965,友訊兆豐06購01
04225P,聯電元富06售01
063786,瑞昱中信06購01
068868,聯發科台新02購02
072471,聚陽永豐03購01
03003P,京鼎群益01售02
06898P,FBVIX群益9C售03
069185,華擎麥證02購01
072056,大立光元富06購01
077202,群創群益05購03
078025,華邦電凱基08購01
079563,中纖國票08購01
068189,國巨凱基04購03
074286,南電群益04購04
074931,群創元大07購02
04621P,上緯控元大05售01
064746,貿聯國票01購02
070711,京元電國票03購03
072154,全新國票03購01
076476,緯創兆豐06購01
078897,和碩元大06購01
075128,緯創凱基06購01
05175P,聯電凱基06售05
071948,神達國票04購01
075571,正文元大05購02
077407,世紀鋼凱基05購06
03181P,台灣50元大01售40
065578,台郡群益9C購02
070188,玉晶光群益02購28
075631,京元電永豐05購01
03725P,聯發科元大03售02
070000,國喬元大02購01
05158P,大立光元大06售02
067024,旺宏兆豐03購01
067636,復盛永豐01購01
069345,台勝科群益04購01
071545,裕隆元大03購01
074518,華晶科國票05購01
079434,群創統一08購01
08110P,臺股指中信01售05
066595,敦泰群益01購01
073932,材料元大04購02
078377,同欣電元大06購01
078447,旺宏第一06購01
078600,臻鼎元大07購01
04455P,欣興群益04售04
063118,中鋼元大9C購01
075071,元金2X凱基06購01
03549P,聯發科凱基02售10
03657P,國巨群益03售07
04654P,T50正2國票08售02
065707,聯詠群益9C購02
067963,宏碁群益02購01
074749,達新永豐04購01
08733P,臺股指麥證01售05
066519,達方永豐01購01
072326,台積電富邦06購01
074472,精元永豐04購01
077874,華通兆豐06購02
03784P,貿聯元富06售01
059713,滬深2X元大9C購04
066092,億豐永豐01購01
068302,國巨國票01購02
071094,正文群益04購01
077511,鴻海群益05購04
079459,長榮航元富09購02
00708L,元大S&P黃金正2
05051P,聯電元富05售07
063347,祥碩統一01購03
065507,亞德客群益01購02
073724,南亞科國票05購01
075597,SGBR2X凱基07購01
077243,聯電元大05購10
05347P,聯發科凱基06售09
067369,瑞昱統一01購07
068500,華擎元大01購09
069306,國巨凱基04購05
074015,永冠群益04購02
3443,創意
063318,京鼎群益9C購02
066594,聯詠群益01購01
069588,長興國票02購01
072042,精成科元大03購03
072185,禾伸堂兆豐04購01
078175,南亞科兆豐06購01
1611,中電
1614,三洋電
066442,華碩群益01購01
072411,祥碩統一05購02
078349,群創凱基09購03
03032P,華通國票03售01
04213P,聯電元大04售03
059777,台灣50元大9C購18
071604,國巨麥證03購03
072837,聯強元大07購01
073266,勝一永豐04購01
073476,奇鋐元大05購01
074352,大立光統一07購02
03305P,台達電台新02售01
03308P,臺股指中信05售03
04043P,世紀鋼凱基03售05
057718,旺宏元富02購02
075553,大成鋼元大06購01
077923,漢唐群益06購01
04279P,大立光凱基04售07
066631,聯詠凱基03購01
070037,日月光國泰03購01
070108,台積電元大04購02
076267,廣宇凱基05購01
05341P,聯發科富邦08售02
059607,台積電富邦9C購04
063051,仁寶統一01購01
066533,南茂元富01購01
075114,日月光群益05購01
075879,T50反1凱基07購05
077573,冠德元大05購01
08443P,臺股指麥證01售02
3605,宏致
03478B,臺股指凱基09熊02
03748P,美律國票04售01
04007P,臺股指國票03售07
04761P,臺股指群益05售06
059882,臺股指凱基9C購06
070228,國喬國票03購01
078475,華新科統一08購03
2327,國巨
068610,牧德凱基01購05
072037,億光元大03購02
077533,景碩凱基06購02
072419,南亞科元富09購01
073374,松翰元大04購03
075988,達邁群益05購01
066284,松翰元大01購01
067413,臺股指中信04購02
074817,緯穎統一04購01
075850,群創富邦05購01
03948P,玉晶光凱基04售04
064681,牧德兆豐01購01
074164,啟碁凱基04購01
077358,新光鋼元大05購01
079024,華通元大06購02
04111P,台積電元大03售23
04618P,亞德客元大05售01
05392P,臺股指凱基06售24
067690,惠特元大01購04
070044,高鐵永豐02購01
079036,瑞昱元大07購01
05142P,欣興群益07售02
068580,聯電永豐01購02
069169,TPK元大02購02
069628,聯電元富04購01
073453,聯茂凱基05購01
076157,元金2X元大05購04
079327,聯發科群益08購03
073046,康控元富08購01
078099,長華統一08購02
08862P,台積電元大01售24
067362,眾達群益01購02
068405,玉晶光元富07購01
069257,康控凱基02購02
071747,日月光永豐03購01
078232,南亞科元富09購03
066847,群創元大01購03
067815,玉晶光凱基01購04
068762,牧德永豐02購01
071058,大立光凱基03購07
075964,台積電統一05購08
5284,jpp-KY
067085,臻鼎元大01購02
069456,鴻海麥證02購02
069523,南六凱基02購04
072279,聯電元大03購03
074192,啟碁國泰06購01
076923,欣陸統一07購01
079335,大立光日盛07購01
072337,世紀鋼永豐03購03
073348,大立光凱基07購01
072163,松翰國票04購01
074644,華邦電國票05購02
03688P,臺股指群益03售03
05285P,台積電群益06售07
078547,岱宇永豐06購01
079453,聯發科元富0C購01
5706,鳳凰
05194P,圓剛元富09售02
066517,智伸科永豐01購01
071217,高鐵統一03購01
071982,南茂國票04購01
077543,友達國票08購01
08921P,台灣50國泰03售01
065256,上銀元大9C購10
066983,禾伸堂群益01購01
068217,台達電統一03購01
070344,貿聯元大02購01
070806,儒鴻元大03購01
075506,台郡元大05購02
078858,台積電台新07購01
05439P,欣興元大06售03
068879,TPK凱基02購03
070055,台灣50兆豐03購04
071522,華邦電元富09購01
072519,奇鋐群益03購02
075826,南港統一05購01
05168P,宏碁元富0C售02
077853,祥碩元大06購01
2504,國產
03906P,臺股指凱基03售11
04250P,台船康和04售02
064145,宏碁統一02購01
076023,國揚元大05購03
020008,元大特股高息N
6706,惠特
065436,力成凱基02購01
066963,T50反1元富07購03
072796,可成國票05購02
07828P,SP黃豆凱基01售01
064149,美律統一02購01
066583,上証2X群益03購01
066844,聯發科元大01購12
03671P,臺股指中信05售06
068994,精成科永豐02購01
03322P,景碩凱基02售02
061830,元金2X凱基01購01
063150,聯發科元富05購03
063974,南電國票01購01
072393,台泥國票04購01
078872,大亞元大07購01
03407P,華新科國泰03售02
04880P,臺股指群益05售14
064455,美食統一01購03
068912,聯發科群益02購10
072847,聯茂元大04購01
078643,長榮凱基08購02
00657K,國泰日經225+U
03641P,上銀群益02售02
060875,華通中信02購01
078770,中興電群益07購01
073326,敬鵬國票05購01
079167,樺漢元大06購04
065036,世芯統一02購02
069564,儒鴻凱基02購01
075081,台表科凱基06購01
065924,東元國票02購01
066156,建準康和01購01
069168,景碩元大02購03
071957,智伸科凱基03購02
072465,聯電元富05購02
073551,聯發科群益04購04
074923,友訊元大04購01
078712,新興永豐06購02
1558,伸興
066054,創意元大01購02
061324,華新科凱基9C購01
072583,南電元富07購05
076653,致伸統一06購01
079222,聯發科凱基06購10
04850P,臺股指凱基05售20
066295,昇陽半元大01購01
067672,聯發科元大01購21
068414,聯電中信01購01
070312,可成中信03購02
072696,彩晶永豐03購02
076172,聯鈞元大05購01
077537,彩晶凱基08購02
075519,SGBR2X元富0B購01
077164,大立光元大05購17
062541,臻鼎國泰01購01
065354,金像電元富03購01
068603,京元電凱基03購01
074302,為升凱基04購01
075234,晶碩國票06購01
077402,智伸科凱基05購01
078623,華通群益07購01
08677P,超眾群益01售02
068742,A50群益02購01
068853,華新科統一02購03
068856,台達電元富08購01
069272,華通永豐02購01
072833,中橡元大07購01
078488,華邦電國票08購03
063331,瑞儀國票9C購01
069862,南茂永豐02購01
072716,聯茂國票04購03
04299P,大立光兆豐04售06
066116,宏達電兆豐01購01
066637,瀚宇博凱基01購02
068273,嘉晶永豐01購01
068496,景碩元大01購04
079662,鴻海元大07購04
04273P,上証2X群益04售02
064155,大立光統一01購05
065951,聯發科統一01購08
068690,喬山凱基03購01
074982,敬鵬永豐04購02
1808,潤隆
03691P,臺股指群益03售06
064742,奇鋐國票01購02
067779,滬深2X群益01購08
068669,國巨統一03購04
078633,華新科麥證06購01
04447P,臺股指群益04售15
04756P,世紀鋼凱基05售03
04661P,可成群益06售01
063441,台達電統一9C購01
065049,世芯凱基02購01
069984,玉晶光凱基04購01
075290,上緯控凱基05購01
066197,鴻海統一02購02
076934,宏達電國泰07購01
078837,奇力新兆豐06購02
078924,興勤永豐06購02
04038P,台積電凱基03售17
068429,裕隆凱基01購01
08866P,旭富元大01售01
2867,三商壽
05326P,台灣50國票06售04
064536,富邦金國票01購01
067984,SP黃豆元大01購04
074296,奇鋐兆豐04購03
076879,義隆元大05購05
077395,長榮凱基05購05
064298,台灣50兆豐01購02
069360,聯發科永豐02購03
071680,樺漢凱基03購01
1451,年興
04508P,台灣50國票05售02
059476,道瓊指群益9C購01
065810,台表科群益9C購05
067189,牧德凱基02購02
068190,台積電凱基01購20
070232,台積電國票03購11
073952,嘉晶凱基04購02
4576,大銀微系統
03378P,台積電群益02售10
064157,健鼎統一01購02
070687,臺股指群益03購01
070763,聯發科國泰04購05
075403,萬海統一07購02
076631,鴻海元大07購03
079255,亞光元大06購03
063990,世芯永豐01購01
067759,美食永豐01購01
068499,京鼎元大01購07
071062,貿聯凱基04購01
077942,微星統一08購01
08957P,聯電凱基03售02
00632R,元大台灣50反1
066205,京鼎統一03購01
070244,玉晶光台新02購03
077812,南電統一09購01
08422P,玉晶光群益02售03
3296,勝德
074558,友達凱基04購04
074562,欣興凱基04購06
074969,中石化富邦06購01
1231,聯華食
03539P,牧德元富08售01
061652,T50反1國票9C購01
065738,國巨麥證9C購04
070282,聯發科凱基08購01
078573,聯電元大06購11
04535P,聯發科元富05售05
071061,智易凱基03購01
071975,臺股指元大03購21
073727,玉晶光國票05購04
074756,瀚宇博永豐04購01
03331P,臺股指群益02售05
062924,世紀鋼元大9C購04
064165,同欣電統一01購01
073329,友達國票06購01
074090,嘉澤富邦06購01
075284,精元凱基05購01
04099P,臺指2X凱基04售01
065394,英業達群益9C購01
070354,國巨國票02購07
072418,正隆元富09購01
075120,東鋼凱基05購01
068401,瑞昱元富07購03
072555,聯電統一04購07
073515,瑞軒國票05購01
073553,欣興群益04購01
078849,國巨統一07購05
064150,全新統一01購03
064821,聯電統一02購01
065055,臺股指凱基02購04
066714,台灣50元大01購22
074106,南電兆豐04購02
074153,滬深2X凱基05購03
074260,台積電元富08購30
078622,岱宇群益06購01
065252,玉晶光永豐9C購08
066088,漢翔永豐01購01
066557,京鼎元大01購01
067595,國巨凱基02購04
068585,美律台新01購02
069219,華新群益04購01
069415,欣興統一04購04
073278,華晶科永豐04購01
075387,華碩永豐05購01
075890,欣興凱基06購02
04141P,彩晶國票03售02
067560,聯詠國票02購01
070438,聯發科凱基03購10
076748,大立光凱基05購11
077170,科嘉元大06購01
2020,美亞
063546,國巨兆豐9C購03
068170,臺股指元大01購23
079569,聯電國票07購06
065366,英業達元大9C購02
067222,申豐元大01購01
078132,國巨群益06購01
069911,美利達元大02購03
072541,祥碩元大03購03
074056,日月光元大05購01
075433,友達凱基07購02
077335,國巨中信05購01
077564,台積電元大05購32
079083,上銀群益06購01
069953,微星永豐02購01
071110,中工國票05購01
074204,貿聯兆豐04購02
076397,海悅永豐05購02
076580,聯發科第一05購01
078705,勝一永豐06購01
04041P,國喬國票03售02
03259P,聯發科康和02售01
04288P,台灣50群益04售04
069600,景碩國票03購01
073032,新日興統一04購01
075225,儒鴻國票06購01
077023,亞光凱基05購02
077179,台積電富邦08購05
078382,臺股指元大06購09
071931,美律國泰05購01
051795,T50反1台新05購02
060495,台灣50元大01購13
063465,友達元大9C購10
064416,南亞科中信01購01
070286,玉晶光凱基02購10
072340,世紀鋼兆豐04購02
08594P,台積電群益01售05
00737,國泰AI+ROBO
03431P,聯詠元大02售06
04040P,台灣50國票03售07
05159P,世芯元大06售03
071428,旺宏元大03購04
072091,臺股指國票03購15
072540,祥碩元大03購02
076826,金像電永豐05購02
079287,友達統一07購01
03586P,玉晶光元大02售11
066469,申豐統一02購02
072453,可成元大03購05
077515,南電群益05購08
00753L,中信中國50正2
066612,台積電麥證01購04
072086,大立光國票04購02
075870,鴻海麥證05購01
065167,華通元大02購01
070120,京鼎元大02購03
077296,南電元富05購05
077834,鴻海元大06購06
064242,TPK統一02購01
065247,聯發科麥證9C購02
072030,味全元大06購01
073455,宏全凱基04購01
079640,長榮兆豐06購02
00732,國泰RMB短期報酬
065495,上銀富邦01購02
066496,大立光國泰03購01
075989,健策群益05購01
020003,統一漲升股利150N
2891B,中信金乙特
04075P,南亞科元富09售02
065973,嘉晶元大01購03
068515,聯發科統一03購10
071652,義隆國票04購02
2597,潤弘
3026,禾伸堂
07270P,台灣50元大01售09
072915,滬深2X元大04購06
075667,大立光國票07購01
03311P,欣興凱基02售05
074718,香港2X國票04購01
079121,上緯控凱基06購04
08546P,可成中信9C售02
08616P,聯發科元富9C售02
9943,好樂迪
071326,長榮航統一03購01
073119,元黃金元大07購01
068557,道瓊銀元大03購02
074396,康控國票05購01
076783,富邦金元富05購01
077160,國巨元大05購15
070843,金寶永豐03購01
072206,大立光元大03購05
072765,上緯控國泰05購01
076423,仁寶元富05購01
076750,台表科凱基05購03
03902P,玉晶光國泰05售01
071800,新光金國票06購01
062151,世紀鋼國票01購01
068116,欣興元富07購01
070802,奇鋐國票03購04
03144P,台積電國票01售09
064228,同欣電國票01購01
064693,玉晶光群益01購06
069783,國巨麥證02購01
071412,鴻海群益03購06
075188,華邦電元大05購06
075527,台積電國票07購02
077866,華新永豐06購01
04803P,臺股指國票06售14
065852,創意元大9C購06
066432,南六元大01購02
075748,華擎永豐05購01
077646,大亞統一08購01
05156P,臺股指凱基07售02
065639,臺指反元大03購04
067168,國巨麥證01購05
068318,中興電元大01購01
076332,訊芯元大05購01
078546,恆大永豐06購01
079534,群創元大06購08
058054,台積電統一9C購01
064224,玉晶光國票01購04
064793,新光金國票01購02
066017,南六元富03購01
066573,瑞祺元大01購02
067457,FBVIX國泰03購01
075170,京鼎統一05購01
077188,漢唐永豐05購02
04767P,台積電麥證05售05
05231P,立積群益06售03
074998,友達群益05購01
078222,友達永豐06購01
03382P,帆宣康和02售01
064191,聯發科中信03購01
067124,華擎富邦03購01
071368,微星群益04購01
078117,強茂元富09購01
3432,台端
063831,帆宣國票01購01
072699,可成群益03購07
077721,玉晶光元大09購01
077768,宏達電群益07購01
077931,群創群益06購01
4960,誠美材
05089P,萬海群益05售04
064462,致伸統一02購01
066992,緯穎群益01購02
075210,台積電凱基05購06
077664,南電元富06購02
072761,金像電國泰05購03
075563,聯發科元大05購04
078544,彩晶富邦06購02
064231,鴻海統一01購03
071130,群創統一03購02
076758,FBVIX元大05購04
079457,萬海元富07購02
067153,聯鈞統一03購02
069048,台積電元富08購14
070569,長興永豐02購02
072196,松翰群益03購02
074005,聯發科凱基04購10
076583,上証反中信06購01
065197,景碩元富06購01
077374,大毅元大05購02
05092P,台灣50凱基05售20
063283,華新科元大9C購03
074966,聯發科國泰06購03
076289,台聚統一06購02
3018,同開
3229,晟鈦
03265P,訊芯國票04售01
04875P,台灣50群益05售07
063940,國巨元大01購02
071917,聯發科元大03購12
078714,大立光永豐06購01
08709P,台積電台新01售02
04634P,聯發科凱基05售04
067033,新日興康和01購01
068045,滬深2X統一03購01
068554,上証2X元大01購07
072923,國巨元大05購02
073514,美律國票05購01
076745,萬海凱基05購03
077311,大立光富邦07購01
04558P,聯發科富邦06售02
068686,瑞儀中信02購01
072479,致伸永豐03購01
077560,聯電元大05購14
078929,中工永豐06購01
08839P,臺股指麥證01售06
1909,榮成
5880,合庫金
03109P,台積電元大01售41
03882P,臺股指元大04售15
066707,揚明光群益01購02
073951,富邦金凱基04購01
078226,晶碩永豐06購01
066080,台光電國泰03購01
066905,台積電凱基03購03
070842,為升永豐03購01
1525,江申
04511P,玉晶光國票06售07
05030P,萬海永豐05售04
065300,燿華元富9C購03
075419,上緯控元富0B購01
2453,凌群
05398P,聯發科元大06售11
065728,嘉晶凱基9C購04
068070,友達凱基05購01
068822,欣興元大02購04
073124,台達化元大04購01
079363,達運凱基06購01
063562,國巨元大9C購06
064856,GIS國泰02購01
066142,超眾群益01購03
067063,為升元大01購01
074485,美律兆豐04購01
071202,訊連國票04購01
073116,達麗元富08購01
074246,聯茂凱基04購01
060975,滬深2X元大01購02
065011,智邦國泰02購01
066178,拓凱凱基01購01
076285,國泰金兆豐05購01
077723,中磊元大06購01
069763,上証2X元大03購08
071960,T50反1群益03購05
077455,聯電國票06購06
078591,大立光元大06購04
079127,上銀國票07購02
079438,T50反1元富07購12
1326,台化
04557P,聯電富邦06售01
05342P,全新統一07售02
067888,奇力新群益01購02
070665,SP黃豆群益03購02
071328,群創統一03購03
077328,嘉澤永豐05購02
067949,緯穎國泰03購01
069439,華固康和02購01
075344,欣興群益05購06
078234,晶技元富0C購01
08718P,台灣50元大02售03
03249P,華擎元富04售01
065295,旭富群益9C購02
065885,神達元富9C購01
078503,精成科國票08購01
078590,大立光元大06購03
04589P,GIS元大05售01
08527P,大立光元大01售06
08684P,禾伸堂凱基01售01
04865P,長榮元富05售02
062569,南電中信01購01
070181,上銀群益03購02
077842,長榮元大06購03
068030,台積電元富07購10
068716,華通元大02購03
078318,國巨麥證06購01
078903,同欣電元大06購02
079296,群創元富07購03
04607P,友達元富05售02
068219,聯發科統一03購06
069737,強茂國泰04購01
069881,南電國票03購04
073988,華城元富06購01
064089,新日興凱基02購01
069411,奇力新統一04購01
070133,億光統一04購01
4555,氣立
066970,T50反1群益01購05
068517,大立光統一01購09
068715,為升元大02購01
070205,華碩元大02購06
073735,大立光國泰06購03
075405,欣興統一06購05
076806,景碩國票06購04
04088P,南電元大03售12
04200P,臺股指群益04售05
067743,緯創元大01購02
069792,致茂凱基02購01
070327,超眾兆豐03購02
074220,新日興元大04購03
078227,南茂永豐06購01
08658P,聯發科統一9C售19
2727,王品
04219P,祥碩國票05售03
067650,技嘉元富07購03
068997,T50反1兆豐03購01
070382,聯發科元富08購07
071608,台灣50元大04購03
074288,臺股指群益04購09
077047,奇力新永豐05購03
079264,嘉聯益元大06購06
020007,凱基臺灣500N
068221,聯發科統一05購01
068424,台灣50凱基04購11
072264,華夏群益03購02
078301,金寶兆豐07購01
079174,聯發科國泰08購03
066789,聯詠麥證01購01
071689,國巨國票05購02
078046,臺指反元大09購01
04107P,S&P正2中信05售02
068760,精元永豐02購01
069008,大立光兆豐03購01
071348,台積電國泰06購03
072513,S&P正2中信05購01
079592,國巨元富06購03
065052,南六凱基02購02
068602,智邦凱基01購01
069173,康舒元大02購02
072701,中租群益03購01
075651,聯發科群益05購01
03136P,大立光康和01售01
078119,富邦金元富0C購01
079423,矽創永豐06購01
00670L,富邦NASDAQ正2
067295,滬深2X元大01購11
072187,大成鋼群益04購01
07259P,滬深2X國票01售01
072875,聚碩永豐04購01
073911,南帝元大04購03
08284P,鴻海凱基01售03
03033P,微星國票03售01
